title,authors,published,arxiv_id,url,pdf_url,category,primary_category,abstract,code_links,comment
Benchmarking Retrieval Strategies for Biomedical Retrieval-Augmented Generation: A Controlled Empirical Study,"Devi Prasad Bal, Subhashree Puhan",2026-05-04,2605.02520v1,http://arxiv.org/abs/2605.02520v1,https://arxiv.org/pdf/2605.02520v1,information_retrieval,cs.CL,"Retrieval-Augmented Generation (RAG) offers a well-established path to grounding large language model (LLM) outputs in external knowledge, yet the question of which retrieval strategy works best in a high-stakes domain such as biomedicine has not received the controlled, multi-metric treatment it deserves. This paper presents a systematic empirical comparison of five retrieval strategies -- Dense Vector Search, Hybrid BM25 + Dense retrieval, Cross-Encoder Reranking, Multi-Query Expansion, and Maximal Marginal Relevance (MMR) -- within a biomedical question-answering RAG pipeline. All strategies share a fixed generation model (GPT-4o-mini), a common vector store (ChromaDB), and OpenAI's text-embedding-3-small embeddings, ensuring that observed differences are attributable to retrieval alone. Evaluation is conducted on 250 question-answer pairs drawn from a preprocessed subset of the BioASQ benchmark (rag-mini-bioasq) using four DeepEval metrics: contextual precision, contextual recall, faithfulness, and answer relevancy, each reported with 95% confidence intervals. A no-context ablation is included as a lower bound. Cross-Encoder Reranking achieves the best composite score (0.827) and highest contextual precision (0.852), confirming that query-document interaction yields measurable retrieval gains. Multi-Query Expansion, despite its recall-oriented design, produces the weakest contextual precision (0.671), suggesting naive query diversification introduces retrieval noise. MMR sacrifices answer relevancy for diversity, while the Dense baseline (composite 0.822) falls within 0.005 points of the top strategy. All RAG conditions dramatically outperform the no-context ablation on answer relevancy (0.658-0.701 vs. 0.287), confirming the practical value of retrieval. The full pipeline, hyperparameters, and evaluation code are publicly available.",https://github.com/deviprasadbal/RAGHealthcareRetrievalStrategies,"15 pages, 4 figures, 2 tables. Code and data: https://github.com/deviprasadbal/RAGHealthcareRetrievalStrategies Also archived at Zenodo: https://doi.org/10.5281/zenodo.19774692"
FEDIN: Frequency-Enhanced Deep Interest Network for Click-Through Rate Prediction,"Zenan Dai, Jinpeng Wang, Junwei Pan, Dapeng Liu, Lei Xiao, Shu-Tao Xia",2026-05-03,2605.01726v1,http://arxiv.org/abs/2605.01726v1,https://arxiv.org/pdf/2605.01726v1,information_retrieval,cs.IR,"Sequential recommendation models often struggle to capture latent periodic patterns in user interests, primarily due to the noise inherent in time-domain behavioral data. While frequency-domain analysis offers a global perspective to address this, existing approaches typically treat user sequences in isolation, overlooking the crucial context of the target item. In this work, we present a novel empirical observation: user attention scores exhibit distinct spectral entropy distributions when conditioned on positive versus negative target items. Specifically, true user interests manifest as highly concentrated spectral patterns with lower entropy in the frequency domain, whereas irrelevant behaviors appear as high-entropy noise. Leveraging this insight, we propose the Frequency-Enhanced Deep Interest Network (FEDIN). FEDIN introduces a frequency-domain branch that utilizes a target-aware spectrum filtering mechanism to isolate these periodic interest signals. Extensive experiments on three public datasets demonstrate that FEDIN consistently outperforms state-of-the-art sequential recommendation baselines, demonstrating superior robustness against noise. We have released our code at: https://github.com/otokoneko/FEDIN.",https://github.com/otokoneko/FEDIN,"Accepted by SIGIR 2026. 6 pages, 4 figures, 2 tables"
Beyond Semantic Relevance: Counterfactual Risk Minimization for Robust Retrieval-Augmented Generation,"Peiyang Liu, Qiang Yan, Ziqiang Cui, Di Liang, Xi Wang, Wei Ye",2026-05-02,2605.01302v1,http://arxiv.org/abs/2605.01302v1,https://arxiv.org/pdf/2605.01302v1,information_retrieval,cs.CL,"Standard Retrieval-Augmented Generation (RAG) systems predominantly rely on semantic relevance as a proxy for utility. However, this assumption collapses in realistic decision-making scenarios where user queries are laden with cognitive biases, such as false premises or confirmation bias. In such cases, maximizing relevance paradoxically promotes the retrieval of sycophantic evidence that reinforces hallucinations, a critical failure we term the ``Relevance-Robustness Gap''. To bridge this gap, we propose CoRM-RAG (Counterfactual Risk Minimization for RAG), a framework that aligns retrieval with decision safety rather than mere similarity. Grounded in causal intervention, we introduce a Cognitive Perturbation Protocol to simulate user biases during training, which is then distilled into a lightweight Evidence Critic. This scoring module learns to identify documents that possess sufficient evidential strength to steer the model toward correctness despite adversarial query perturbations. Extensive experiments on decision-making benchmarks demonstrate that CoRM-RAG significantly outperforms strong dense retrievers and LLM-based rerankers in adversarial settings, while enabling effective risk-aware abstention through reliable robustness scoring. Our code is available at https://github.com/PeiYangLiu/CoRM-RAG.git.",https://github.com/PeiYangLiu/CoRM-RAG,
Chain of Evidence: Pixel-Level Visual Attribution for Iterative Retrieval-Augmented Generation,"Peiyang Liu, Ziqiang Cui, Xi Wang, Di Liang, Wei Ye",2026-05-02,2605.01284v1,http://arxiv.org/abs/2605.01284v1,https://arxiv.org/pdf/2605.01284v1,information_retrieval,cs.CV,"Iterative Retrieval-Augmented Generation (iRAG) has emerged as a powerful paradigm for answering complex multi-hop questions by progressively retrieving and reasoning over external documents. However, current systems predominantly operate on parsed text, which creates two critical bottlenecks: (1) \textit{Coarse-grained attribution}, where users are burdened with manually locating evidence within lengthy documents based on vague text-level citations; and (2) \textit{Visual semantic loss}, where the conversion of visually rich documents (e.g., slides, PDFs with charts) into text discards spatial logic and layout cues essential for reasoning. To bridge this gap, we present \textbf{Chain of Evidence (CoE)}, a retriever-agnostic visual attribution framework that leverages Vision-Language Models to reason directly over screenshots of retrieved document candidates. CoE eliminates format-specific parsing and outputs precise bounding boxes, visualizing the complete reasoning chain within the retrieved candidate set. We evaluate CoE on two distinct benchmarks: \textbf{Wiki-CoE}, a large-scale dataset of structured web pages derived from 2WikiMultiHopQA, and \textbf{SlideVQA}, a challenging dataset of presentation slides featuring complex diagrams and free-form layouts. Experiments demonstrate that fine-tuned Qwen3-VL-8B-Instruct achieves robust performance, significantly outperforming text-based baselines in scenarios requiring visual layout understanding, while establishing a retriever-agnostic solution for pixel-level interpretable iRAG. Our code is available at https://github.com/PeiYangLiu/CoE.git.",https://github.com/PeiYangLiu/CoE,
MUDY: Multi-Granular Dynamic Candidate Contextualization for Unsupervised Keyphrase Extraction,"Hyeongu Kang, Susik Yoon",2026-05-01,2605.00597v1,http://arxiv.org/abs/2605.00597v1,https://arxiv.org/pdf/2605.00597v1,information_retrieval,cs.IR,"Keyphrase extraction aims to automatically identify concise phrases that effectively represent the content of a document. While recent methods leveraging pre-trained language models (PLMs) have significantly improved the extraction of keyphrases with strong global semantic relevance, they often fall short in capturing the local contextual importance of keyphrases tied to specific subtopics dispersed in a document. In this paper, we propose a novel context-centric framework, MUDY, that effectively captures multi-granular contextual salience of candidate keyphrases. MUDY employs two complementary components: (1) a prompt-based scoring that estimates the generation likelihood of each candidate keyphrase, augmented with candidate-aware weighting to better reflect its local contextual importance, and (2) a self-attention-based scoring that utilizes multi-granular attention patterns from PLMs to assess candidate significance at both the document-wide and segment-specific levels. Evaluations on four real-world datasets demonstrate that MUDY outperforms state-of-the-art baselines in top-k accuracy at various cutoff thresholds. In-depth quantitative and qualitative analyses further highlight the efficacy of context-centric keyphrase extraction with multi-granular saliency. For reproducibility, the source code of MUDY is available at https://github.com/HgKang1/MUDY.",https://github.com/HgKang1/MUDY,Accepted to SIGIR 2026
Hierarchical Abstract Tree for Cross-Document Retrieval-Augmented Generation,"Ziwen Zhao, Menglin Yang",2026-05-01,2605.00529v1,http://arxiv.org/abs/2605.00529v1,https://arxiv.org/pdf/2605.00529v1,information_retrieval,cs.LG,"Retrieval-augmented generation (RAG) enhances large language models with external knowledge, and tree-based RAG organizes documents into hierarchical indexes to support queries at multiple granularities. However, existing Tree-RAG methods designed for single-document retrieval face critical challenges in scaling to cross-document multi-hop questions: (1) poor distribution adaptability, where $k$-means clustering introduces noise due to rigid distribution assumptions; (2) structural isolation, as tree indexes lack explicit cross-document connections; and (3) coarse abstraction, which obscures fine-grained details. To address these limitations, we propose $Ψ$-RAG, a tree-RAG framework with two key components. First, a hierarchical abstract tree index built through an iterative ""merging and collapse"" process that adapts to data distributions without a priori assumption. Second, a multi-granular retrieval agent that intelligently interacts with the knowledge base with reorganized queries and an agent-powered hybrid retriever. $Ψ$-RAG supports diverse tasks from token-level question answering to document-level summarization. On cross-document multi-hop QA benchmarks, it outperforms RAPTOR by 25.9% and HippoRAG 2 by 7.4% in average F1 score. Code is available at https://github.com/Newiz430/Psi-RAG.",https://github.com/Newiz430/Psi-RAG,ICML 2026
DynamicPO: Dynamic Preference Optimization for Recommendation,"Xingyu Hu, Kai Zhang, Jiancan Wu, Shuli Wang, Chi Wang, Wenshuai Chen, Yinhua Zhu, Haitao Wang, Xingxing Wang, Xiang Wang",2026-05-01,2605.00327v1,http://arxiv.org/abs/2605.00327v1,https://arxiv.org/pdf/2605.00327v1,information_retrieval,cs.IR,"In large language model (LLM)-based recommendation systems, direct preference optimization (DPO) effectively aligns recommendations with user preferences, requiring multi-negative objective functions to leverage abundant implicit-feedback negatives and sharpen preference boundaries. However, our empirical analyses reveal a counterintuitive phenomenon, preference optimization collapse, where increasing the number of negative samples can lead to performance degradation despite a continuously decreasing training loss. We further theoretically demonstrate that this collapse arises from gradient suppression, caused by the dominance of easily discriminable negatives over boundary-critical negatives that truly define user preference boundaries. As a result, boundary-relevant signals are under-optimized, weakening the model's decision boundary. Motivated by these observations, we propose DynamicPO (Dynamic Preference Optimization), a lightweight and plug-and-play framework comprising two adaptive mechanisms: Dynamic Boundary Negative Selection, which identifies and prioritizes informative negatives near the model's decision boundary, and Dual-Margin Dynamic beta Adjustment, which calibrates optimization strength per sample according to boundary ambiguity. Extensive experiments on three public datasets show that DynamicPO effectively prevents optimization collapse and improves recommendation accuracy on multi-negative preference optimization methods, with negligible computational overhead. Our code and datasets are available at https://github.com/xingyuHuxingyu/DynamicPO.",https://github.com/xingyuHuxingyu/DynamicPO,DASFAA2026
Reliable Answers for Recurring Questions: Boosting Text-to-SQL Accuracy with Template Constrained Decoding,"Smit Jivani, Sarvam Maheshwari, Sunita Sarawagi",2026-04-30,2604.28028v1,http://arxiv.org/abs/2604.28028v1,https://arxiv.org/pdf/2604.28028v1,information_retrieval,cs.CL,"Large language models (LLMs) have revolutionized Text-to-SQL generation, allowing users to query structured data using natural language with growing ease. Yet, real-world deployment remains challenging, especially in complex or unseen schemas, due to inconsistent accuracy and the risk of generating invalid SQL. We introduce Template Constrained Decoding (TeCoD), a system that addresses these limitations by harnessing the recurrence of query patterns in labeled workloads. TeCoD converts historical NL-SQL pairs into reusable templates and introduces a robust template selection module that uses a fine-tuned natural language inference model to match or reject queries efficiently. Once the template is selected, TeCoD enforces it during SQL generation through grammar-constrained decoding, implemented via a novel partitioned strategy that ensures both syntactic validity and efficiency. Together, these components yield up to 36% higher execution accuracy than in-context learning (ICL) and 2.2x lower latency on matched queries.",https://github.com/SSLab-CSE-IITB/tecod,Project Code: https://github.com/SSLab-CSE-IITB/tecod
"NeocorRAG: Less Irrelevant Information, More Explicit Evidence, and More Effective Recall via Evidence Chains","Shiyao Peng, Qianhe Zheng, Zhuodi Hao, Zichen Tang, Rongjin Li, Qing Huang, Jiayu Huang, Jiacheng Liu, Yifan Zhu, Haihong E",2026-04-30,2604.27852v1,http://arxiv.org/abs/2604.27852v1,https://arxiv.org/pdf/2604.27852v1,information_retrieval,cs.IR,"Although precise recall is a core objective in Retrieval-Augmented Generation (RAG), a critical oversight persists in the field: improvements in retrieval performance do not consistently translate to commensurate gains in downstream reasoning. To diagnose this gap, we propose the Recall Conversion Rate (RCR), a novel evaluation metric to quantify the contribution of retrieval to reasoning accuracy. Our quantitative analysis of mainstream RAG methods reveals that as Recall@5 improves, the RCR exhibits a near-linear decay. We identify the neglect of retrieval quality in these methods as the underlying cause. In contrast, approaches that focus solely on quality optimization often suffer from inferior recall performance. Both categories lack a comprehensive understanding of retrieval quality optimization, resulting in a trade-off dilemma. To address these challenges, we propose comprehensive retrieval quality optimization criteria and introduce the NeocorRAG framework. This framework achieves holistic retrieval quality optimization by systematically mining and utilizing Evidence Chains. Specifically, NeocorRAG first employs an innovative activated search algorithm to obtain a refined candidate space. Then it ensures precise evidence chain generation through constrained decoding. Finally, the retrieved set of evidence chains guides the retrieval optimization process. Evaluated on benchmarks including HotpotQA, 2WikiMultiHopQA, MuSiQue, and NQ, NeocorRAG achieves SOTA performance on both 3B and 70B parameter models, while consuming less than 20% of tokens used by comparable methods. This study presents an efficient, training-free paradigm for RAG enhancement that effectively optimizes retrieval quality while maintaining high recall. Our code is released at https://github.com/BUPT-Reasoning-Lab/NeocorRAG.",https://github.com/BUPT-Reasoning-Lab/NeocorRAG,Accepted to WWW 2026
"One Pass, Any Order: Position-Invariant Listwise Reranking for LLM-Based Recommendation","Ethan Bito, Yongli Ren, Estrid He",2026-04-30,2604.27599v1,http://arxiv.org/abs/2604.27599v1,https://arxiv.org/pdf/2604.27599v1,information_retrieval,cs.IR,"Large language models (LLMs) are increasingly used for recommendation reranking, but their listwise predictions can depend on the order in which candidates are presented. This creates a mismatch between the set-based nature of recommendation and the sequence-based computation of decoder-only LLMs, where permuting an otherwise identical candidate set can change item scores and final rankings. Such order sensitivity makes LLM-based rerankers difficult to rely on, since rankings may reflect prompt serialization rather than user preference. We propose InvariRank, a permutation-invariant listwise reranking framework that addresses this dependence at the architectural level. InvariRank blocks cross-candidate attention with a structured attention mask and negates position-induced scoring changes through shared positional framing under Rotary Positional Embeddings (RoPE). Combined with a listwise learning-to-rank objective, the model scores all candidates in a single forward pass, avoiding permutation-based invariance training objectives that require multiple permutations of a candidate set. Experiments on recommendation benchmarks show that InvariRank maintains competitive ranking effectiveness while producing stable rankings across candidate permutations. The results suggest that architectural invariance is a practical route to reliable and efficient LLM-based recommendation reranking. The source code is at https://github.com/ejbito/InvariRank.",https://github.com/ejbito/InvariRank,Accepted at SIGIR 2026
Hypencoder Revisited: Reproducibility and Analysis of Non-Linear Scoring for First-Stage Retrieval,"Arne Eichholtz, Yongkang Li, Jutte Vijverberg, Tobias Groot, Mohammad Aliannejadi",2026-04-29,2604.27037v1,http://arxiv.org/abs/2604.27037v1,https://arxiv.org/pdf/2604.27037v1,information_retrieval,cs.IR,"The Hypencoder, proposed by Killingback et al., is a retrieval framework that replaces the fixed inner-product scoring function used in standard bi-encoders with a query-specific neural network (the $q$-net), whose weights are generated by a hypernetwork from the contextualized query embeddings. This design enables more expressive relevance estimation while preserving independent query and document encoding. In this work, we conduct a reproducibility study of the Hypencoder and extend the original analysis in three directions. Our reproduction confirms that the Hypencoder outperforms a similarly trained bi-encoder baseline on in-domain and out-of-domain benchmarks, and that the proposed efficient search algorithm substantially reduces query latency with minimal performance loss. On hard retrieval tasks, we find partial support: the Hypencoder outperforms the baseline on DL-Hard and FollowIR, but not on TREC TOT, where checkpoint incompatibility and fine-tuning sensitivity complicate full verification. Beyond reproduction, we investigate three extensions: (i)~integrating alternative pre-trained encoders into the Hypencoder framework, where we find that performance gains depend on the encoder and fine-tuning strategy; (ii)~comparing query latency against a Faiss-based bi-encoder pipeline, revealing that standard bi-encoder retrieval remains faster under both exhaustive and efficient search settings; and (iii)~evaluating adversarial robustness, where we find that the $q$-net's non-linear scoring does not provide a consistent robustness disadvantage over inner-product scoring. Our code is publicly available at https://github.com/arneeichholtz/Hypencoder-reprod.",https://github.com/arneeichholtz/Hypencoder-reprod,This paper has been accepted as a reproducibility paper at SIGIR 2026
The Bandit's Blind Spot: The Critical Role of User State Representation in Recommender Systems,"Pedro R. Pires, Gregorio F. Azevedo, Rafael T. Sereicikas, Pietro L. Campos, Tiago A. Almeida",2026-04-29,2604.26651v1,http://arxiv.org/abs/2604.26651v1,https://arxiv.org/pdf/2604.26651v1,information_retrieval,cs.IR,"With the increasing availability of online information, recommender systems have become an important tool for many web-based systems. Due to the continuous aspect of recommendation environments, these systems increasingly rely on contextual multi-armed bandits (CMAB) to deliver personalized and real-time suggestions. A critical yet underexplored component in these systems is the representation of user state, which typically encapsulates the user's interaction history and is deeply correlated with the model's decisions and learning. In this paper, we investigate the impact of different embedding-based state representations derived from matrix factorization models on the performance of traditional CMAB algorithms. Our large-scale experiments reveal that variations in state representation can lead to improvements greater than those achieved by changing the bandit algorithm itself. Furthermore, no single embedding or aggregation strategy consistently dominates across datasets, underscoring the need for domain-specific evaluation. These results expose a substantial gap in the literature and emphasize that advancing bandit-based recommender systems requires a holistic approach that prioritizes embedding quality and state construction alongside algorithmic innovation. The source code for our experiments is publicly available on https://github.com/UFSCar-LaSID/bandits_blind_spot.",https://github.com/UFSCar-LaSID/bandits_blind_spot,"Published in SAC'26, 8 pages, 2 figures"
CARD: Non-Uniform Quantization of Visual Semantic Unit for Generative Recommendation,"Yibiao Wei, Jie Zou, Pengfei Zhang, Xiao Ao, Weikang Guo, Zeyu Ma, Yang Yang",2026-04-29,2604.26427v1,http://arxiv.org/abs/2604.26427v1,https://arxiv.org/pdf/2604.26427v1,information_retrieval,cs.IR,"Generative recommendation frameworks typically represent items as discrete Semantic IDs (SIDs). While existing studies have sought to enhance SID construction by incorporating multimodal content, collaborative signals, or more advanced quantization techniques, learning high-quality SIDs still faces two key challenges: (1) The two-stage generative recommendation paradigm (SID construction and autoregressive generation) provides insufficient supervision for heterogeneous fusion, which hinders learning high-quality SIDs, and (2) non-uniform embeddings lead to codeword imbalance and generation bias. To address these challenges, we propose a novel generative recommendation framework, called CARD. CARD introduces a visual semantic unit that unifies textual, visual, and collaborative signals into a structured visual representation prior to encoding, enabling holistic semantic modeling and effectively alleviating the semantic gap, thereby reducing the reliance on supervision signals during SID learning. Furthermore, to deal with the highly non-uniform distribution of item semantic embeddings in recommendation scenarios, we develop a non-uniform quantization framework (NU-RQ-VAE), which incorporates a learnable and invertible non-uniform transformation into the quantization process to map skewed semantic distributions into a more balanced latent space, thereby significantly improving codebook utilization and quantization accuracy. Experiments on multiple datasets show that CARD consistently outperforms baseline methods under various settings; meanwhile, the proposed non-uniform transformation module is plug-and-play and remains robust across different quantization schemes. Code is available at https://github.com/HAI-UESTC/CARD.",https://github.com/HAI-UESTC/CARD,
