title,authors,published,arxiv_id,url,pdf_url,category,primary_category,abstract,code_links,comment
PRISM: Personalized Recommendation via Information Synergy Module,"Xinyi Zhang, Yutong Li, Peijie Sun, Letian Sha, Zhongxuan Han",2026-01-16,2601.10944v1,http://arxiv.org/abs/2601.10944v1,https://arxiv.org/pdf/2601.10944v1,information_retrieval,cs.IR,"Multimodal sequential recommendation (MSR) leverages diverse item modalities to improve recommendation accuracy, while achieving effective and adaptive fusion remains challenging. Existing MSR models often overlook synergistic information that emerges only through modality combinations. Moreover, they typically assume a fixed importance for different modality interactions across users. To address these limitations, we propose \textbf{P}ersonalized \textbf{R}ecommend-ation via \textbf{I}nformation \textbf{S}ynergy \textbf{M}odule (PRISM), a plug-and-play framework for sequential recommendation (SR). PRISM explicitly decomposes multimodal information into unique, redundant, and synergistic components through an Interaction Expert Layer and dynamically weights them via an Adaptive Fusion Layer guided by user preferences. This information-theoretic design enables fine-grained disentanglement and personalized fusion of multimodal signals. Extensive experiments on four datasets and three SR backbones demonstrate its effectiveness and versatility. The code is available at https://github.com/YutongLi2024/PRISM.",https://github.com/YutongLi2024/PRISM,Accepted as a Full Paper at WWW 2026
Tail-Aware Data Augmentation for Long-Tail Sequential Recommendation,"Yizhou Dang, Zhifu Wei, Minhan Huang, Lianbo Ma, Jianzhe Zhao, Guibing Guo, Xingwei Wang",2026-01-16,2601.10933v1,http://arxiv.org/abs/2601.10933v1,https://arxiv.org/pdf/2601.10933v1,information_retrieval,cs.IR,"Sequential recommendation (SR) learns user preferences based on their historical interaction sequences and provides personalized suggestions. In real-world scenarios, most users can only interact with a handful of items, while the majority of items are seldom consumed. This pervasive long-tail challenge limits the model's ability to learn user preferences. Despite previous efforts to enrich tail items/users with knowledge from head parts or improve tail learning through additional contextual information, they still face the following issues: 1) They struggle to improve the situation where interactions of tail users/items are scarce, leading to incomplete preferences learning for the tail parts. 2) Existing methods often degrade overall or head parts performance when improving accuracy for tail users/items, thereby harming the user experience. We propose Tail-Aware Data Augmentation (TADA) for long-tail sequential recommendation, which enhances the interaction frequency for tail items/users while maintaining head performance, thereby promoting the model's learning capabilities for the tail. Specifically, we first capture the co-occurrence and correlation among low-popularity items by a linear model. Building upon this, we design two tail-aware augmentation operators, T-Substitute and T-Insert. The former replaces the head item with a relevant item, while the latter utilizes co-occurrence relationships to extend the original sequence by incorporating both head and tail items. The augmented and original sequences are mixed at the representation level to preserve preference knowledge. We further extend the mix operation across different tail-user sequences and augmented sequences to generate richer augmented samples, thereby improving tail performance. Comprehensive experiments demonstrate the superiority of our method. The codes are provided at https://github.com/KingGugu/TADA.",https://github.com/KingGugu/TADA,Accepted by WWW 2026
RoutIR: Fast Serving of Retrieval Pipelines for Retrieval-Augmented Generation,"Eugene Yang, Andrew Yates, Dawn Lawrie, James Mayfield, Trevor Adriaanse",2026-01-15,2601.10644v1,http://arxiv.org/abs/2601.10644v1,https://arxiv.org/pdf/2601.10644v1,information_retrieval,cs.IR,"Retrieval models are key components of Retrieval-Augmented Generation (RAG) systems, which generate search queries, process the documents returned, and generate a response. RAG systems are often dynamic and may involve multiple rounds of retrieval. While many state-of-the-art retrieval methods are available through academic IR platforms, these platforms are typically designed for the Cranfield paradigm in which all queries are known up front and can be batch processed offline. This simplification accelerates research but leaves state-of-the-art retrieval models unable to support downstream applications that require online services, such as arbitrary dynamic RAG pipelines that involve looping, feedback, or even self-organizing agents. In this work, we introduce RoutIR, a Python package that provides a simple and efficient HTTP API that wraps arbitrary retrieval methods, including first stage retrieval, reranking, query expansion, and result fusion. By providing a minimal JSON configuration file specifying the retrieval models to serve, RoutIR can be used to construct and query retrieval pipelines on-the-fly using any permutation of available models (e.g., fusing the results of several first-stage retrieval methods followed by reranking). The API automatically performs asynchronous query batching and caches results by default. While many state-of-the-art retrieval methods are already supported by the package, RoutIR is also easily expandable by implementing the Engine abstract class. The package is open-sourced and publicly available on GitHub: http://github.com/hltcoe/routir.",https://github.com/hltcoe/routir,"17 pages, 1 figure"
iTIMO: An LLM-empowered Synthesis Dataset for Travel Itinerary Modification,"Zhuoxuan Huang, Yunshan Ma, Hongyu Zhang, Hua Ma, Zhu Sun",2026-01-15,2601.10609v1,http://arxiv.org/abs/2601.10609v1,https://arxiv.org/pdf/2601.10609v1,information_retrieval,cs.IR,"Addressing itinerary modification is crucial for enhancing the travel experience as it is a frequent requirement during traveling. However, existing research mainly focuses on fixed itinerary planning, leaving modification underexplored. To bridge this gap, we formally define the itinerary modification task and introduce iTIMO, a dataset specifically tailored for this purpose. We identify the lack of {\itshape need-to-modify} itinerary data as the critical bottleneck hindering research on this task and propose a general pipeline to overcome it. This pipeline frames the generation of such data as an intent-driven perturbation task. It instructs large language models to perturb real world itineraries using three atomic editing operations: REPLACE, ADD, and DELETE. Each perturbation is grounded in three intents, including disruptions of popularity, spatial distance, and category diversity. Furthermore, a hybrid evaluation metric is designed to ensure perturbation effectiveness. We conduct comprehensive experiments on iTIMO, revealing the limitations of current LLMs and lead to several valuable directions for future research. Dataset and corresponding code are available at https://github.com/zelo2/iTIMO.",https://github.com/zelo2/iTIMO,
"AWED-FiNER: Agents, Web applications, and Expert Detectors for Fine-grained Named Entity Recognition across 36 Languages for 6.6 Billion Speakers","Prachuryya Kaushik, Ashish Anand",2026-01-15,2601.10161v1,http://arxiv.org/abs/2601.10161v1,https://arxiv.org/pdf/2601.10161v1,information_retrieval,cs.CL,"We introduce AWED-FiNER, an open-source ecosystem designed to bridge the gap in Fine-grained Named Entity Recognition (FgNER) for 36 global languages spoken by more than 6.6 billion people. While Large Language Models (LLMs) dominate general Natural Language Processing (NLP) tasks, they often struggle with low-resource languages and fine-grained NLP tasks. AWED-FiNER provides a collection of agentic toolkits, web applications, and several state-of-the-art expert models that provides FgNER solutions across 36 languages. The agentic tools enable to route multilingual text to specialized expert models and fetch FgNER annotations within seconds. The web-based platforms provide ready-to-use FgNER annotation service for non-technical users. Moreover, the collection of language specific extremely small sized open-source state-of-the-art expert models facilitate offline deployment in resource contraint scenerios including edge devices. AWED-FiNER covers languages spoken by over 6.6 billion people, including a specific focus on vulnerable languages such as Bodo, Manipuri, Bishnupriya, and Mizo. The resources can be accessed here: Agentic Tool (https://github.com/PrachuryyaKaushik/AWED-FiNER), Web Application (https://hf.co/spaces/prachuryyaIITG/AWED-FiNER), and 49 Expert Detector Models (https://hf.co/collections/prachuryyaIITG/awed-finer).",https://github.com/PrachuryyaKaushik/AWED-FiNER,Submitted to ACL'26 System Demonstration
Efficient Content-based Recommendation Model Training via Noise-aware Coreset Selection,"Hung Vinh Tran, Tong Chen, Hechuan Wen, Quoc Viet Hung Nguyen, Bin Cui, Hongzhi Yin",2026-01-15,2601.10067v1,http://arxiv.org/abs/2601.10067v1,https://arxiv.org/pdf/2601.10067v1,information_retrieval,cs.LG,"Content-based recommendation systems (CRSs) utilize content features to predict user-item interactions, serving as essential tools for helping users navigate information-rich web services. However, ensuring the effectiveness of CRSs requires large-scale and even continuous model training to accommodate diverse user preferences, resulting in significant computational costs and resource demands. A promising approach to this challenge is coreset selection, which identifies a small but representative subset of data samples that preserves model quality while reducing training overhead. Yet, the selected coreset is vulnerable to the pervasive noise in user-item interactions, particularly when it is minimally sized. To this end, we propose Noise-aware Coreset Selection (NaCS), a specialized framework for CRSs. NaCS constructs coresets through submodular optimization based on training gradients, while simultaneously correcting noisy labels using a progressively trained model. Meanwhile, we refine the selected coreset by filtering out low-confidence samples through uncertainty quantification, thereby avoid training with unreliable interactions. Through extensive experiments, we show that NaCS produces higher-quality coresets for CRSs while achieving better efficiency than existing coreset selection techniques. Notably, NaCS recovers 93-95\% of full-dataset training performance using merely 1\% of the training data. The source code is available at \href{https://github.com/chenxing1999/nacs}{https://github.com/chenxing1999/nacs}.",https://github.com/chenxing1999/nacs,WebConf 2026
MM-BRIGHT: A Multi-Task Multimodal Benchmark for Reasoning-Intensive Retrieval,"Abdelrahman Abdallah, Mohamed Darwish Mounis, Mahmoud Abdalla, Mahmoud SalahEldin Kasem, Mostafa Farouk Senussi, Mohamed Mahmoud, Mohammed Ali, Adam Jatowt, Hyun-Soo Kang",2026-01-14,2601.09562v2,http://arxiv.org/abs/2601.09562v2,https://arxiv.org/pdf/2601.09562v2,information_retrieval,cs.IR,"Existing retrieval benchmarks primarily consist of text-based queries where keyword or semantic matching is usually sufficient. Many real-world queries contain multimodal elements, particularly, images such as diagrams, charts, and screenshots that require intensive reasoning to identify relevant documents. To address this gap, we introduce MM-BRIGHT, the first multimodal benchmark for reasoning-intensive retrieval. Our dataset consists of 2,803 real-world queries spanning 29 diverse technical domains, with four tasks of increasing complexity: text-to-text, multimodal-to-text, multimodal-to-image, and multimodal-to-multimodal retrieval. Extensive evaluation reveals that state-of-the-art models struggle across all tasks: BM25 achieves only 8.5 nDCG@10 on text-only retrieval, while the best multimodal model Nomic-Vision reaches just 27.6 nDCG@10 on multimodal-to-text retrieval actually underperforming the best text-only model (DiVeR: 32.2). These results highlight substantial headroom and position MM-BRIGHT as a testbed for next-generation retrieval models that better integrate visual reasoning. Our code and data are available at https://github.com/mm-bright/MM-BRIGHT. See also our official website: https://mm-bright.github.io/.",https://github.com/mm-bright/MM-BRIGHT,
TEMPO: A Realistic Multi-Domain Benchmark for Temporal Reasoning-Intensive Retrieval,"Abdelrahman Abdallah, Mohammed Ali, Muhammad Abdul-Mageed, Adam Jatowt",2026-01-14,2601.09523v1,http://arxiv.org/abs/2601.09523v1,https://arxiv.org/pdf/2601.09523v1,information_retrieval,cs.IR,"Existing temporal QA benchmarks focus on simple fact-seeking queries from news corpora, while reasoning-intensive retrieval benchmarks lack temporal grounding. However, real-world information needs often require reasoning about temporal evolution and synthesizing evidence across time periods. We introduce TEMPO, the first benchmark combining temporal reasoning with reasoning-intensive retrieval across 13 domains. TEMPO features: (1) 1,730 complex queries requiring deep temporal reasoning such as tracking changes, identifying trends, or comparing cross-period evidence; (2) step-wise retrieval planning with 3,976 decomposed steps and gold documents mapped to each step for multi-hop evaluation; and (3) novel temporal metrics including Temporal Coverage@k and Temporal Precision@k measuring whether results span required time periods. Evaluation of 12 retrieval systems reveals substantial challenges: the best model (DiVeR) achieves only 32.0 NDCG@10 and 71.4\% Temporal Coverage@10, demonstrating difficulty in retrieving temporally complete evidence. We believe TEMPO provides a challenging benchmark for improving temporal reasoning in retrieval and RAG systems. Our code and data are available at https://github.com/tempo-bench/Tempo. See also our official website: https://tempo-bench.github.io/.",https://github.com/tempo-bench/Tempo,
Bridging Semantic Understanding and Popularity Bias with LLMs,"Renqiang Luo, Dong Zhang, Yupeng Gao, Wen Shi, Mingliang Hou, Jiaying Liu, Zhe Wang, Shuo Yu",2026-01-14,2601.09478v2,http://arxiv.org/abs/2601.09478v2,https://arxiv.org/pdf/2601.09478v2,information_retrieval,cs.IR,"Semantic understanding of popularity bias is a crucial yet underexplored challenge in recommender systems, where popular items are often favored at the expense of niche content. Most existing debiasing methods treat the semantic understanding of popularity bias as a matter of diversity enhancement or long-tail coverage, neglecting the deeper semantic layer that embodies the causal origins of the bias itself. Consequently, such shallow interpretations limit both their debiasing effectiveness and recommendation accuracy. In this paper, we propose FairLRM, a novel framework that bridges the gap in the semantic understanding of popularity bias with Recommendation via Large Language Model (RecLLM). FairLRM decomposes popularity bias into item-side and user-side components, using structured instruction-based prompts to enhance the model's comprehension of both global item distributions and individual user preferences. Unlike traditional methods that rely on surface-level features such as ""diversity"" or ""debiasing"", FairLRM improves the model's ability to semantically interpret and address the underlying bias. Through empirical evaluation, we show that FairLRM significantly enhances both fairness and recommendation accuracy, providing a more semantically aware and trustworthy approach to enhance the semantic understanding of popularity bias. The implementation is available at https://github.com/LuoRenqiang/FairLRM.",https://github.com/LuoRenqiang/FairLRM,"10 pages, 4 figs, WWW 2026 accepted"
"A Deep Dive into OpenStreetMap Research Since its Inception (2008-2024): Contributors, Topics, and Future Trends","Yao Sun, Liqiu Meng, Andres Camero, Stefan Auer, Xiao Xiang Zhu",2026-01-14,2601.09338v1,http://arxiv.org/abs/2601.09338v1,https://arxiv.org/pdf/2601.09338v1,information_retrieval,cs.DL,"OpenStreetMap (OSM) has transitioned from a pioneering volunteered geographic information (VGI) project into a global, multi-disciplinary research nexus. This study presents a bibliometric and systematic analysis of the OSM research landscape, examining its development trajectory and key driving forces. By evaluating 1,926 publications from the Web of Science (WoS) Core Collection and 782 State of the Map (SotM) presentations up to June 2024, we quantify publication growth, collaboration patterns, and thematic evolution. Results demonstrate simultaneous consolidation and diversification within the field. While a stable core of contributors continues to anchor OSM research, themes have shifted from initial concerns over data production and quality toward advanced analytical and applied uses. Comparative analysis of OSM-related research in WoS and SotM reveals distinct but complementary agendas between scholars and the OSM community. Building on these findings, we identify six emerging research directions and discuss how evolving partnerships among academia, the OSM community, and industry are poised to shape the future of OSM research. This study establishes a structured reference for understanding the state of OSM studies and offers strategic pathways for navigating its future trajectory.The data and code are available at https://github.com/ya0-sun/OSMbib.",https://github.com/ya0-sun/OSMbib,
Why not Collaborative Filtering in Dual View? Bridging Sparse and Dense Models,"Hanze Guo, Jianxun Lian, Xiao Zhou",2026-01-14,2601.09286v1,http://arxiv.org/abs/2601.09286v1,https://arxiv.org/pdf/2601.09286v1,information_retrieval,cs.IR,"Collaborative Filtering (CF) remains the cornerstone of modern recommender systems, with dense embedding--based methods dominating current practice. However, these approaches suffer from a critical limitation: our theoretical analysis reveals a fundamental signal-to-noise ratio (SNR) ceiling when modeling unpopular items, where parameter-based dense models experience diminishing SNR under severe data sparsity. To overcome this bottleneck, we propose SaD (Sparse and Dense), a unified framework that integrates the semantic expressiveness of dense embeddings with the structural reliability of sparse interaction patterns. We theoretically show that aligning these dual views yields a strictly superior global SNR. Concretely, SaD introduces a lightweight bidirectional alignment mechanism: the dense view enriches the sparse view by injecting semantic correlations, while the sparse view regularizes the dense model through explicit structural signals. Extensive experiments demonstrate that, under this dual-view alignment, even a simple matrix factorization--style dense model can achieve state-of-the-art performance. Moreover, SaD is plug-and-play and can be seamlessly applied to a wide range of existing recommender models, highlighting the enduring power of collaborative filtering when leveraged from dual perspectives. Further evaluations on real-world benchmarks show that SaD consistently outperforms strong baselines, ranking first on the BarsMatch leaderboard. The code is publicly available at https://github.com/harris26-G/SaD.",https://github.com/harris26-G/SaD,"25 pages, 6 figures"
MemRec: Collaborative Memory-Augmented Agentic Recommender System,"Weixin Chen, Yuhan Zhao, Jingyuan Huang, Zihe Ye, Clark Mingxuan Ju, Tong Zhao, Neil Shah, Li Chen, Yongfeng Zhang",2026-01-13,2601.08816v1,http://arxiv.org/abs/2601.08816v1,https://arxiv.org/pdf/2601.08816v1,information_retrieval,cs.IR,"The evolution of recommender systems has shifted preference storage from rating matrices and dense embeddings to semantic memory in the agentic era. Yet existing agents rely on isolated memory, overlooking crucial collaborative signals. Bridging this gap is hindered by the dual challenges of distilling vast graph contexts without overwhelming reasoning agents with cognitive load, and evolving the collaborative memory efficiently without incurring prohibitive computational costs. To address this, we propose MemRec, a framework that architecturally decouples reasoning from memory management to enable efficient collaborative augmentation. MemRec introduces a dedicated, cost-effective LM_Mem to manage a dynamic collaborative memory graph, serving synthesized, high-signal context to a downstream LLM_Rec. The framework operates via a practical pipeline featuring efficient retrieval and cost-effective asynchronous graph propagation that evolves memory in the background. Extensive experiments on four benchmarks demonstrate that MemRec achieves state-of-the-art performance. Furthermore, architectural analysis confirms its flexibility, establishing a new Pareto frontier that balances reasoning quality, cost, and privacy through support for diverse deployments, including local open-source models. Code:https://github.com/rutgerswiselab/memrec and Homepage: https://memrec.weixinchen.com",https://github.com/rutgerswiselab/memrec,
RMBRec: Robust Multi-Behavior Recommendation towards Target Behaviors,"Miaomiao Cai, Zhijie Zhang, Junfeng Fang, Zhiyong Cheng, Xiang Wang, Meng Wang",2026-01-13,2601.08705v2,http://arxiv.org/abs/2601.08705v2,https://arxiv.org/pdf/2601.08705v2,information_retrieval,cs.IR,"Multi-behavior recommendation faces a critical challenge in practice: auxiliary behaviors (e.g., clicks, carts) are often noisy, weakly correlated, or semantically misaligned with the target behavior (e.g., purchase), which leads to biased preference learning and suboptimal performance. While existing methods attempt to fuse these heterogeneous signals, they inherently lack a principled mechanism to ensure robustness against such behavioral inconsistency.
  In this work, we propose Robust Multi-Behavior Recommendation towards Target Behaviors (RMBRec), a robust multi-behavior recommendation framework grounded in an information-theoretic robustness principle. We interpret robustness as a joint process of maximizing predictive information while minimizing its variance across heterogeneous behavioral environments. Under this perspective, the Representation Robustness Module (RRM) enhances local semantic consistency by maximizing the mutual information between users' auxiliary and target representations, whereas the Optimization Robustness Module (ORM) enforces global stability by minimizing the variance of predictive risks across behaviors, which is an efficient approximation to invariant risk minimization. This local-global collaboration bridges representation purification and optimization invariance in a theoretically coherent way. Extensive experiments on three real-world datasets demonstrate that RMBRec not only outperforms state-of-the-art methods in accuracy but also maintains remarkable stability under various noise perturbations. For reproducibility, our code is available at https://github.com/miaomiao-cai2/RMBRec/.",https://github.com/miaomiao-cai2/RMBRec,
GraphFusionSBR: Denoising Multi-Channel Graphs for Session-Based Recommendation,"Jia-Xin He, Hung-Hsuan Chen",2026-01-13,2601.08497v1,http://arxiv.org/abs/2601.08497v1,https://arxiv.org/pdf/2601.08497v1,information_retrieval,cs.IR,"Session-based recommendation systems must capture implicit user intents from sessions. However, existing models suffer from issues such as item interaction dominance and noisy sessions. We propose a multi-channel recommendation model, including a knowledge graph channel, a session hypergraph channel, and a session line graph channel, to capture information from multiple sources. Our model adaptively removes redundant edges in the knowledge graph channel to reduce noise. Knowledge graph representations cooperate with hypergraph representations for prediction to alleviate item dominance. We also generate in-session attention for denoising. Finally, we maximize mutual information between the hypergraph and line graph channels as an auxiliary task. Experiments demonstrate that our method enhances the accuracy of various recommendations, including e-commerce and multimedia recommendations. We release the code on GitHub for reproducibility.\footnote{https://github.com/hohehohe0509/DSR-HK}",https://github.com/hohehohe0509/DSR-HK,
