title,authors,published,arxiv_id,url,pdf_url,category,primary_category,abstract,code_links,comment
VectorSmuggle: Steganographic Exfiltration in Embedding Stores and a Cryptographic Provenance Defense,Jascha Wanger,2026-05-13,2605.13764v1,http://arxiv.org/abs/2605.13764v1,https://arxiv.org/pdf/2605.13764v1,information_retrieval,cs.CR,"Modern retrieval-augmented generation (RAG) systems convert sensitive content into high-dimensional embeddings and store them in vector databases that treat the resulting numerical artifacts as opaque. Major vector-store products do not provide native controls for embedding integrity, ingestion-time distributional anomaly detection, or cryptographic provenance attestation. We show this opens a class of steganographic exfiltration attacks: an attacker with write access to the ingestion pipeline can hide payload data inside embeddings using simple post-embedding perturbations (noise injection, rotation, scaling, offset, fragmentation, and combinations thereof) while preserving the surface-level retrieval behavior the RAG system exposes to legitimate users.
  We evaluate these techniques across a synthetic-PII corpus on text-embedding-3-large, four locally hosted open embedding models, a cross-corpus replication on BEIR NFCorpus and a Quora subset (over 26,000 chunks combined), seven vector-store configurations, an adaptive-attacker variant of the detector evaluation, and a paraphrased-query retrieval benchmark. Distribution-shifting perturbations are often caught by simple anomaly detectors; small-angle orthogonal rotation defeats distribution-based detection across every (model, corpus) pair tested. A disjoint-Givens rotation encoder gives a closed-form per-vector capacity ceiling of floor(d/2) * b bits, but real embedding manifolds impose a capacity-detectability trade-off, and the retrieval-preserving operating point sits well below it.
  We propose VectorPin, a cryptographic provenance protocol that pins each embedding to its source content and producing model via an Ed25519 signature over a canonical byte representation. Any post-embedding modification breaks signature verification. Embedding-level integrity is a deployable, standardizable control that closes this attack class.",https://github.com/jaschadub/VectorSmuggle; https://github.com/jaschadub/VectorPin,"47 pages, 3 figures. Reference implementations: https://github.com/jaschadub/VectorSmuggle and https://github.com/jaschadub/VectorPin"
LeanSearch v2: Global Premise Retrieval for Lean 4 Theorem Proving,"Guoxiong Gao, Zeming Sun, Jiedong Jiang, Yutong Wang, Jingda Xu, Peihao Wu, Bryan Dai, Bin Dong",2026-05-13,2605.13137v2,http://arxiv.org/abs/2605.13137v2,https://arxiv.org/pdf/2605.13137v2,information_retrieval,cs.IR,"Proving theorems in Lean 4 often requires identifying a scattered set of library lemmas whose joint use enables a concise proof -- a task we call global premise retrieval. Existing tools address adjacent problems: semantic search engines find individual declarations matching a query, while premise-selection systems predict useful lemmas one tactic step at a time. Neither recovers the full premise set an entire theorem requires. We present LeanSearch v2, a two-mode retrieval system for this task. Its standard mode applies a hierarchy-informalized Mathlib corpus with an embedding-reranker pipeline, achieving state-of-the-art single-query retrieval without domain-specific fine-tuning (nDCG@10 of 0.62 vs. 0.53 for the next-best system). Its reasoning mode builds on standard mode as its retrieval substrate, targeting global premise retrieval through iterative sketch-retrieve-reflect cycles. On a 69-query benchmark of research-level Mathlib theorems, reasoning mode recovers 46.1% of ground-truth premise groups within 10 retrieved candidates, outperforming strong reasoning retrieval systems (38.0%) and premise-selection baselines (9.3%) on the same benchmark. In a controlled downstream evaluation with a fixed prover loop, replacing alternative retrievers with LeanSearch v2 yields the highest proof success (20% vs. 16% for the next-best system and 4% without retrieval), confirming that retrieval quality propagates to proof generation. We have open-sourced all code, data, and benchmarks. Code and data: https://github.com/frenzymath/LeanSearch-v2 . The standard mode is publicly available with API access at https://leansearch.net/ .",https://github.com/frenzymath/LeanSearch-v2,
Task-Adaptive Embedding Refinement via Test-time LLM Guidance,"Ariel Gera, Shir Ashury-Tahan, Gal Bloch, Ohad Eytan, Assaf Toledo",2026-05-12,2605.12487v1,http://arxiv.org/abs/2605.12487v1,https://arxiv.org/pdf/2605.12487v1,information_retrieval,cs.CL,"We explore the effectiveness of an LLM-guided query refinement paradigm for extending the usability of embedding models to challenging zero-shot search and classification tasks. Our approach refines the embedding representation of a user query using feedback from a generative LLM on a small set of documents, enabling embeddings to adapt in real time to the target task. We conduct extensive experiments with state-of-the-art text embedding models across a diverse set of challenging search and classification benchmarks. Empirical results indicate that LLM-guided query refinement yields consistent gains across all models and datasets, with relative improvements of up to +25% in literature search, intent detection, key-point matching, and nuanced query-instruction following. The refined queries improve ranking quality and induce clearer binary separation across the corpus, enabling the embedding space to better reflect the nuanced, task-specific constraints of each ad-hoc user query. Importantly, this expands the range of practical settings in which embedding models can be effectively deployed, making them a compelling alternative when costly LLM pipelines are not viable at corpus-scale. We release our experimental code for reproducibility, at https://github.com/IBM/task-aware-embedding-refinement.",https://github.com/IBM/task-aware-embedding-refinement,
A Case for Agentic Tuning: From Documentation to Action in PostgreSQL,"Hongyu Lin, Mingyu Li, Weichen Zhang, Yihang Lou, Mingjie Xing, Yanjun Wu, Haibo Chen",2026-05-19,2605.19988v1,http://arxiv.org/abs/2605.19988v1,https://arxiv.org/pdf/2605.19988v1,databases,cs.SE,"Documentation has long guided computer system tuning by distilling expert knowledge into per-parameter recommendations. Yet such guides capture only what experts conclude, discarding how they reason. This fundamental gap manifests in three concrete deficiencies: documentation grows stale as software evolves, fails under heterogeneous workloads, and ignores inter-parameter dependencies.
  We propose shifting from static documentation to dynamic action for system tuning. We introduce PerfEvolve, which translates expert tuning methodologies into executable skills that equip LLM-based agents to perform version-consistency verification, workload-specific profiling, and multi-parameter joint optimization. Evaluated on PostgreSQL under TPC-C and TPC-H benchmarks, PerfEvolve outperforms state-of-the-art documentation-driven tuning baselines by up to 35.2%. The tool is available at https://github.com/ISCAS-OSLab/PerfEvolve.",https://github.com/ISCAS-OSLab/PerfEvolve,
GroupAffect-4: A Multimodal Dataset of Four-Person Collaborative Interaction,"Meisam Jamshidi Seikavandi, Alice Modica, Anna Obara, Shan Ahmed Shaffi, Fabricio Batista Narcizo, Tanya Ignatenko, Ted Vucurevich, Karim Haddad, Daniel Barratt, Daniel Overholt, Jesper Bunsow Boldt, Paolo Burelli, Andrew Burke Dittberner",2026-05-19,2605.19765v1,http://arxiv.org/abs/2605.19765v1,https://arxiv.org/pdf/2605.19765v1,databases,cs.AI,"Existing affective-computing, social-signal-processing, and meeting corpora capture important parts of human interaction, but they rarely support analysis of affect in co-located groups as a coupled individual, interpersonal, and group-level process. The required signals (per-participant physiology, eye movement, audio, self-report, task outcomes, and personality) are usually fragmented across separate dataset traditions. We introduce GroupAffect-4, a multimodal corpus of 40 participants in 10 four-person groups, each completing four ecologically varied collaborative tasks spanning information pooling, negotiation, idea generation, and a public-goods game. Each participant is instrumented with a wrist-worn physiology sensor, eye-tracking glasses, and a close-talk microphone; sessions include continuous affect self-reports, post-task questionnaires, task outcomes, and Big-Five personality scores, all time-aligned to a shared clock. The dataset covers over 91% of expected physiology windows and 98% of eye-tracking windows, with strong task validity confirmed by a clear affective manipulation check across the negotiation block. We define fifteen benchmarkable targets spanning three analysis levels -- within-person state, between-person traits, and group dynamics -- and report leave-one-group-out feasibility baselines establishing the dataset's evaluative scope. GroupAffect-4 is released with a BIDS-inspired structure, Croissant metadata, a datasheet, per-session quality reports, and open processing scripts. Code and processing scripts are available at https://github.com/meisamjam/GroupAffect-4; the dataset is publicly archived at https://zenodo.org/records/20037847.",https://github.com/meisamjam/GroupAffect-4,
PipeANN-Filter: An Efficient Filtered Vector Search System on SSD,"Hao Guo, Jiwu Shu, Youyou Lu",2026-05-18,2605.17992v1,http://arxiv.org/abs/2605.17992v1,https://arxiv.org/pdf/2605.17992v1,databases,cs.OS,"We propose PipeANN-Filter, an efficient filtered vector search system on SSD. Unlike existing systems that explore only valid vectors (i.e., those satisfying the attribute constraints) during search, PipeANN-Filter explores a superset of valid vectors, and performs attribute verification after getting the top-k closest result vectors. This allows PipeANN-Filter to leverage probabilistic data structures (e.g., Bloom filters) to identify the superset, trading off a small number of false-positive vector explorations for a massive reduction in SSD I/O for attribute reading. Evaluations show that PipeANN-Filter improves search latency and throughput compared to state-of-the-art systems. PipeANN-Filter is open-source at https://github.com/thustorage/PipeANN",https://github.com/thustorage/PipeANN,
Agentic Cost-Aware Query Planning with Knowledge Distillation for Big Data Analytics,Mahdi Naser-Moghadasi,2026-05-18,2605.17831v1,http://arxiv.org/abs/2605.17831v1,https://arxiv.org/pdf/2605.17831v1,databases,cs.LG,"Query optimization in big data analytics remains computationally expensive, particularly for resource-constrained environments where traditional optimizers fail to satisfy memory and latency constraints. We present an agentic query planning system that combines a rule-based teacher planner, UCB1 bandit exploration, cost-aware prediction, and knowledge distillation to a lightweight student planner. Our teacher planner generates SQL plans using six key optimization strategies, while UCB1 bandit search efficiently explores the plan space under explicit resource constraints. A Random Forest cost model predicts query latency from plan features, enabling cost-aware decisions. A distilled student planner (Logistic Regression or Gradient Boosting) learns to mimic teacher-bandit decisions for fast inference. Evaluation on NYC Taxi and IMDB datasets demonstrates 23% latency reduction compared to default planners while maintaining 94% constraint satisfaction. The student planner achieves 89% accuracy in replicating optimal plans with 15x faster inference time. Our single-file implementation enables reproducible big-data analytics on resource-limited machines and is publicly available at https://github.com/mahdinaser/agentic-kd-planner.",https://github.com/mahdinaser/agentic-kd-planner,"8 pages, preprint, code at https://github.com/mahdinaser/agentic-kd-planner"
IVF-TQ: Streaming-Robust Approximate Nearest Neighbor Search via a Codebook-Free Residual Layer,Tarun Sharma,2026-05-17,2605.17415v1,http://arxiv.org/abs/2605.17415v1,https://arxiv.org/pdf/2605.17415v1,databases,cs.LG,"We propose IVF-TQ, an IVF index with a codebook-free residual layer: a fixed random rotation followed by precomputed Lloyd-Max scalar quantization depending only on (b, d). Only the IVF coarse partition is trained. Building on TurboQuant (Zandieh et al., 2025), the design substantially reduces a key failure mode of trained-codebook ANN indexes (PQ, OPQ, ScaNN): staleness under streaming ingestion.Empirical (3 seeds): Per-batch PQ retraining does not recover the streaming gap at any tested bit budget (paired-t p > 0.28 everywhere). On streaming Deep-10M, IVF-TQ holds at 87.4% -> 86.6% (Delta = -0.80 +/- 0.10pp) while IVF-PQ degrades -3.23pp. A shuffled-i.i.d. control on SIFT-1M shows IVF-PQ losing -3.9pp without distribution shift. At higher PQ bit budgets (~1.5x IVF-TQ memory), absolute recall favors PQ as expected from rate-distortion (+6.1pp Deep-10M; +2.0pp SIFT-10M); the durable IVF-TQ benefit is operational (no codebook to retrain), robust across memory regimes.Prior art: IVF around a codebook-free residual quantizer is architecturally not new -- IVF-RaBitQ ships in Milvus, cuVS, LanceDB, Weaviate; Shi et al. (2026) is concurrent GPU work. TurboQuant itself tests only flat-rotation ANN.Contributions: (i) A multi-seed streaming-operational story for codebook-free IVF: 10M-scale evidence across PQ memory budgets. (ii) A uniform-over-sphere IP-error bound for the TQ residual quantizer with one fixed rotation (proof sketch in v1; rigorous in v2). (iii) Adaptive IVF-TQ: a partition-only refresh recovering 67% -> 97.8% under worst-case rotation shift with re-ranking (90.3% without).Code, data: https://github.com/tarun-ks/turboquant_search",https://github.com/tarun-ks/turboquant_search,
"Croissant Baker: Metadata Generation for Discoverable, Governable, and Reusable ML Datasets","Rafi Al Attrach, Rajna Fani, Sebastian Lobentanzer, Joan Giner-Miguelez, Debanshu Das, Varuni H. K., Nobin Sarwar, Rajat Ghosh, Anwai Archit, Surbhi Motghare, Christina Conrad Parry, Luis Oala, Lara Grosso, Joaquin Vanschoren, Steffen Vogler, Sujata Goswami, Eric S. Rosenthal, Marzyeh Ghassemi, Matthew McDermott, Tom Pollard",2026-05-14,2605.15079v1,http://arxiv.org/abs/2605.15079v1,https://arxiv.org/pdf/2605.15079v1,databases,cs.LG,"Croissant has emerged as the metadata standard for machine learning datasets, providing a structured, JSON-LD-based format that makes dataset discovery, automated ingestion, and reproducible analysis machine-checkable across ML platforms. Adoption has accelerated, and NeurIPS now requires Croissant metadata in every submission to its dataset tracks. Yet in practice Croissant generation usually starts with uploading data to a public platform, a path infeasible for governed and large local repositories that hold much of the high-value data ML increasingly relies on. We release Croissant Baker, a local-first, open-source command-line tool that generates validated Croissant metadata directly from a dataset directory through a modular handler registry. We evaluate Croissant Baker on over 140 datasets, scaling to MIMIC-IV at 886 million rows and 374 Parquet files. On held-out comparisons against producer-authored or standards-derived ground truth, Croissant Baker reaches 97-100% agreement across multiple domains.",https://github.com/MIT-LCP/croissant-baker,"23 pages, 5 figures, 11 tables. Project: https://lcp.mit.edu/croissant-baker/ Code: https://github.com/MIT-LCP/croissant-baker"
Data-aware candidate selection in NL2SQL translation via small separating instances,"Stanislav Kikot, Alexander Shulgin, Yanwei Xu",2026-05-12,2605.12319v1,http://arxiv.org/abs/2605.12319v1,https://arxiv.org/pdf/2605.12319v1,databases,cs.DB,We propose a data-aware candidate selection method for NL2SQL translation based on separating instances and provenance. We implement this approach and evaluate it against three natural baselines on a subset of BIRD-DEV. Experiments show that our method significantly outperforms baselines when only two or three candidates are given and no consistency score is available. The code of our prototype can be found at https://github.com/staskikotx/SISelection,https://github.com/staskikotx/SISelection,8 pages
EpiCastBench: Datasets and Benchmarks for Multivariate Epidemic Forecasting,"Madhurima Panja, Danny D'Agostino, Huitao Li, Tanujit Chakraborty, Nan Liu",2026-05-12,2605.11598v1,http://arxiv.org/abs/2605.11598v1,https://arxiv.org/pdf/2605.11598v1,databases,cs.LG,"The increasing adoption of data-driven decision-making in public health has established epidemic forecasting as a critical area of research. Recent advances in multivariate forecasting models better capture complex temporal dependencies than conventional univariate approaches, which model individual series independently. Despite this potential, the development of robust epidemic forecasting methods is constrained by the lack of high-quality benchmarks comprising diverse multivariate datasets across infectious diseases and geographical regions. To address this gap, we present EpiCastBench, a large-scale benchmarking framework featuring 40 curated (correlated) multivariate epidemic datasets. These publicly available datasets span a wide range of infectious diseases and exhibit diverse characteristics in terms of temporal granularity, series length, and sparsity. We analyze these datasets to identify their global features and structural patterns. To ensure reproducibility and fair comparison, we establish standardized evaluation settings, including a unified forecasting horizon, consistent preprocessing pipelines, diverse performance metrics, and statistical significance testing. By leveraging this framework, we conduct a comprehensive evaluation of 15 multivariate forecasting models spanning statistical baselines to state-of-the-art deep learning and foundation models. All datasets and code are publicly available on Kaggle (https://www.kaggle.com/datasets/aimltsf/epicastbench) and GitHub (https://github.com/aimltsf/EpiCastBench).",https://github.com/aimltsf/EpiCastBench,
HOME-KGQA: A Benchmark Dataset for Multimodal Knowledge Graph Question Answering on Household Daily Activities,"Shusaku Egami, Aoi Ohta, Tomoki Tsujimura, Masaki Asada, Tatsuya Ishigaki, Ken Fukuda, Masahiro Hamasaki, Hiroya Takamura",2026-05-10,2605.09348v1,http://arxiv.org/abs/2605.09348v1,https://arxiv.org/pdf/2605.09348v1,databases,cs.CL,"Large Language Models (LLMs) provide flexible natural language processing capabilities, while knowledge graphs (KGs) offer explicit and structured knowledge. Integrating these two in a complementary manner enables the development of reliable and verifiable AI systems. In particular, knowledge graph question answering (KGQA) has attracted attention as a means to reduce LLM hallucinations and to leverage knowledge beyond the training data. However, existing KGQA benchmark datasets are biased toward encyclopedic knowledge, limited to a single modality, and lack fine-grained spatiotemporal data, which limits their applicability to real-world scenarios targeted by Embodied AI. We introduce HOME-KGQA, a novel KGQA benchmark dataset built on a multimodal KG of daily household activities. HOME-KGQA consists of complex, multi-hop natural language questions paired with graph database query languages. Compared to existing benchmarks, it includes more challenging questions that involve multi-level spatiotemporal reasoning, multimodal grounding, and aggregate functions. Experimental results show that the LLM-based KGQA methods fail to achieve performance comparable to that on existing datasets when evaluated on HOME-KGQA. This highlights significant challenges that should be addressed for the real-world deployment of KGQA systems. Our dataset is available at https://github.com/aistairc/home-kgqa",https://github.com/aistairc/home-kgqa,"12 pages, 4 figures, 7 tables, accepted at LREC2026"
"Detect, Localize, and Explain: Interactive Hierarchical Log Anomaly Analytics with LLM Augmentation","Lei Ma, Suhani Chaudhary, Ethan Shanbaum, Athanasios Tassiadamis, Peter M. VanNostrand, Dennis M. Hofmann, Haowen Xu, Elke Rundensteiner",2026-05-09,2605.09222v1,http://arxiv.org/abs/2605.09222v1,https://arxiv.org/pdf/2605.09222v1,databases,cs.DB,"Logs are ubiquitous in modern systems. Unfortunately, their unstructured nature in flat sequences limits understanding of execution behaviors, hindering effective anomaly diagnosis. To address this, Krone introduces a novel hierarchical log abstraction that transforms flat log sequences into semantically coherent units across entity, action, and status levels. Building on this abstraction, Krone introduces a hierarchical orchestration framework that decomposes flat log sequences into hierarchical execution units and performs modular detection over them. It executes and optimizes the modular detection tasks across levels, enabling precise anomaly detection, localization, and explanation with selective invocation of LLM-based reasoning. In this work, we present Krone-viz, an interactive visualization system based on Krone, which makes hierarchical log analysis interpretable and actionable for software engineers and system operators. Demonstrated on the widely used HDFS benchmark dataset, Krone-viz supports: 1) examining hierarchical decompositions of flat log sequences, 2) inspecting detection results and abnormal segments identified by Krone with LLM-generated explanations, and 3) reusing, reviewing, and revising knowledge generated by LLMs with human-in-the-loop guardrails. The code of Krone-viz is available at https://github.com/LeiMa0324/KRONE_Demo_official, and we deploy a live demo at https://leima0324.github.io/KRONE_Demo_official.",https://github.com/LeiMa0324/KRONE_Demo_official,
Open Ontologies: Tool-Augmented Ontology Engineering with Stable Matching Alignment,Fabio Rovai,2026-05-09,2605.09184v1,http://arxiv.org/abs/2605.09184v1,https://arxiv.org/pdf/2605.09184v1,databases,cs.AI,"We present Open Ontologies, an open-source ontology engineering system implemented in Rust that integrates LLM-driven construction with formal OWL reasoning and ontology alignment via the Model Context Protocol. Our primary finding is that stable 1-to-1 matching is the dominant factor in ontology alignment quality: on the OAEI Anatomy track, it achieves F1 = 0.832 (P = 0.963, R = 0.733), competitive with state-of-the-art systems and exceeding all in precision. Ablation across five weight configurations shows that signal weights are irrelevant when stable matching is applied (F1 varies by less than 0.004), while removing stable matching drops F1 to 0.728. On the Conference track, the same method achieves F1 = 0.438. On tool-augmented ontology interaction, we find a surprising result: an LLM reading a raw OWL file (F1 = 0.323) performs worse than the same LLM with no file at all (F1 = 0.431), while structured MCP tool access achieves F1 = 0.717. This demonstrates that tool structure provides a qualitatively different mode of access that the LLM cannot replicate by reading raw syntax. The system ships as a single binary under the MIT licence.",https://github.com/fabio-rovai/open-ontologies,"10 pages, 6 tables. Code: https://github.com/fabio-rovai/open-ontologies"
FINER-SQL: Boosting Small Language Models for Text-to-SQL,"Thanh Dat Hoang, Thanh Trung Huynh, Matthias Weidlich, Thanh Tam Nguyen, Tong Chen, Hongzhi Yin, Quoc Viet Hung Nguyen",2026-05-05,2605.03465v1,http://arxiv.org/abs/2605.03465v1,https://arxiv.org/pdf/2605.03465v1,databases,cs.DB,"Large language models have driven major advances in Text-to-SQL generation. However, they suffer from high computational cost, long latency, and data privacy concerns, which make them impractical for many real-world applications. A natural alternative is to use small language models (SLMs), which enable efficient and private on-premise deployment. Yet, SLMs often struggle with weak reasoning and poor instruction following. Conventional reinforcement learning methods based on sparse binary rewards (0/1) provide little learning signal when the generated SQLs are incorrect, leading to unstable or collapsed training. To overcome these issues, we propose FINER-SQL, a scalable and reusable reinforcement learning framework that enhances SLMs through fine-grained execution feedback. Built on group relative policy optimization, FINER-SQL replaces sparse supervision with dense and interpretable rewards that offer continuous feedback even for incorrect SQLs. It introduces two key reward functions: a memory reward, which aligns reasoning with verified traces for semantic stability, and an atomic reward, which measures operation-level overlap to grant partial credit for structurally correct but incomplete SQLs. This approach transforms discrete correctness into continuous learning, enabling stable, critic-free optimization. Experiments on the BIRD and Spider benchmarks show that FINER-SQL achieves up to 67.73\% and 85\% execution accuracy with a 3B model -- matching much larger LLMs while reducing inference latency to 5.57~s/sample. These results highlight a cost-efficient and privacy-preserving path toward high-performance Text-to-SQL generation. Our code is available at https://github.com/thanhdath/finer-sql.",https://github.com/thanhdath/finer-sql,
