title,authors,published,arxiv_id,url,pdf_url,category,primary_category,abstract,code_links,comment
LEMUR: A Corpus for Robust Fine-Tuning of Multilingual Law Embedding Models for Retrieval,"Narges Baba Ahmadi, Jan Strich, Martin Semmann, Chris Biemann",2026-02-10,2602.09570v1,http://arxiv.org/abs/2602.09570v1,https://arxiv.org/pdf/2602.09570v1,information_retrieval,cs.CL,"Large language models (LLMs) are increasingly used to access legal information. Yet, their deployment in multilingual legal settings is constrained by unreliable retrieval and the lack of domain-adapted, open-embedding models. In particular, existing multilingual legal corpora are not designed for semantic retrieval, and PDF-based legislative sources introduce substantial noise due to imperfect text extraction. To address these challenges, we introduce LEMUR, a large-scale multilingual corpus of EU environmental legislation constructed from 24,953 official EUR-Lex PDF documents covering 25 languages. We quantify the fidelity of PDF-to-text conversion by measuring lexical consistency against authoritative HTML versions using the Lexical Content Score (LCS). Building on LEMUR, we fine-tune three state-of-the-art multilingual embedding models using contrastive objectives in both monolingual and bilingual settings, reflecting realistic legal-retrieval scenarios. Experiments across low- and high-resource languages demonstrate that legal-domain fine-tuning consistently improves Top-k retrieval accuracy relative to strong baselines, with particularly pronounced gains for low-resource languages. Cross-lingual evaluations show that these improvements transfer to unseen languages, indicating that fine-tuning primarily enhances language-independent, content-level legal representations rather than language-specific cues. We publish code\footnote{\href{https://github.com/nargesbh/eur_lex}{GitHub Repository}} and data\footnote{\href{https://huggingface.co/datasets/G4KMU/LEMUR}{Hugging Face Dataset}}.",https://github.com/nargesbh/eur_lex,Accepted at EACL SRW 26
Comprehensive Comparison of RAG Methods Across Multi-Domain Conversational QA,"Klejda Alushi, Jan Strich, Chris Biemann, Martin Semmann",2026-02-10,2602.09552v1,http://arxiv.org/abs/2602.09552v1,https://arxiv.org/pdf/2602.09552v1,information_retrieval,cs.CL,"Conversational question answering increasingly relies on retrieval-augmented generation (RAG) to ground large language models (LLMs) in external knowledge. Yet, most existing studies evaluate RAG methods in isolation and primarily focus on single-turn settings. This paper addresses the lack of a systematic comparison of RAG methods for multi-turn conversational QA, where dialogue history, coreference, and shifting user intent substantially complicate retrieval. We present a comprehensive empirical study of vanilla and advanced RAG methods across eight diverse conversational QA datasets spanning multiple domains. Using a unified experimental setup, we evaluate retrieval quality and answer generation using generator and retrieval metrics, and analyze how performance evolves across conversation turns. Our results show that robust yet straightforward methods, such as reranking, hybrid BM25, and HyDE, consistently outperform vanilla RAG. In contrast, several advanced techniques fail to yield gains and can even degrade performance below the No-RAG baseline. We further demonstrate that dataset characteristics and dialogue length strongly influence retrieval effectiveness, explaining why no single RAG strategy dominates across settings. Overall, our findings indicate that effective conversational RAG depends less on method complexity than on alignment between the retrieval strategy and the dataset structure. We publish the code used.\footnote{\href{https://github.com/Klejda-A/exp-rag.git}{GitHub Repository}}",https://github.com/Klejda-A/exp-rag,Accepted to EACL SRW 26
Personalized Parameter-Efficient Fine-Tuning of Foundation Models for Multimodal Recommendation,"Sunwoo Kim, Hyunjin Hwang, Kijung Shin",2026-02-10,2602.09445v1,http://arxiv.org/abs/2602.09445v1,https://arxiv.org/pdf/2602.09445v1,information_retrieval,cs.IR,"In recent years, substantial research has integrated multimodal item metadata into recommender systems, often by using pre-trained multimodal foundation models to encode such data. Since these models are not originally trained for recommendation tasks, recent works efficiently adapt them via parameter-efficient fine-tuning (PEFT). However, even with PEFT, item embeddings from multimodal foundation models remain user-blind: item embeddings are not conditioned on user interests, despite the fact that users with diverse interests attend to different item aspects. To address this limitation, we propose PerPEFT, a personalized PEFT strategy for multimodal recommendation. Specifically, PerPEFT groups users by interest and assigns a distinct PEFT module to each group, enabling each module to capture the fine-grained item aspects most predictive of that group`s purchase decisions. We further introduce a specialized training technique that strengthens this user-group conditioning. Notably, PerPEFT is PEFT-agnostic and can be paired with any PEFT method applicable to multimodal foundation models. Through extensive experiments, we show that (1) PerPEFT outperforms the strongest baseline by up to 15.3% (NDCG@20) and (2) delivers consistent gains across diverse PEFT variants. It is noteworthy that, even with personalization, PEFT remains lightweight, adding only 1.3% of the parameter count of the foundation model. We provide our code and datasets at https://github.com/kswoo97/PerPEFT.",https://github.com/kswoo97/PerPEFT,To be published at The Web Conference 2026 (WWW 2026)
A Sketch+Text Composed Image Retrieval Dataset for Thangka,"Jinyu Xu, Yi Sun, Jiangling Zhang, Qing Xie, Daomin Ji, Zhifeng Bao, Jiachen Li, Yanchun Ma, Yongjian Liu",2026-02-09,2602.08411v1,http://arxiv.org/abs/2602.08411v1,https://arxiv.org/pdf/2602.08411v1,information_retrieval,cs.IR,"Composed Image Retrieval (CIR) enables image retrieval by combining multiple query modalities, but existing benchmarks predominantly focus on general-domain imagery and rely on reference images with short textual modifications. As a result, they provide limited support for retrieval scenarios that require fine-grained semantic reasoning, structured visual understanding, and domain-specific knowledge. In this work, we introduce CIRThan, a sketch+text Composed Image Retrieval dataset for Thangka imagery, a culturally grounded and knowledge-specific visual domain characterized by complex structures, dense symbolic elements, and domain-dependent semantic conventions. CIRThan contains 2,287 high-quality Thangka images, each paired with a human-drawn sketch and hierarchical textual descriptions at three semantic levels, enabling composed queries that jointly express structural intent and multi-level semantic specification. We provide standardized data splits, comprehensive dataset analysis, and benchmark evaluations of representative supervised and zero-shot CIR methods. Experimental results reveal that existing CIR approaches, largely developed for general-domain imagery, struggle to effectively align sketch-based abstractions and hierarchical textual semantics with fine-grained Thangka images, particularly without in-domain supervision. We believe CIRThan offers a valuable benchmark for advancing sketch+text CIR, hierarchical semantic modeling, and multimodal retrieval in cultural heritage and other knowledge-specific visual domains. The dataset is publicly available at https://github.com/jinyuxu-whut/CIRThan.",https://github.com/jinyuxu-whut/CIRThan,9 pages
IRB: Automated Generation of Robust Factuality Benchmarks,"Lam Thanh Do, Bhagyashree Taleka, Hozaifa Ammar Bhutta, Vikram Sharma Mailthody, Kevin Chen-Chuan Chang, Wen-mei Hwu",2026-02-08,2602.08070v1,http://arxiv.org/abs/2602.08070v1,https://arxiv.org/pdf/2602.08070v1,information_retrieval,cs.IR,"Static benchmarks for RAG systems often suffer from rapid saturation and require significant manual effort to maintain robustness. To address this, we present IRB, a framework for automatically generating benchmarks to evaluate the factuality of RAG systems. IRB employs a structured generation pipeline utilizing \textit{factual scaffold} and \textit{algorithmic scaffold}. We utilize IRB to construct a benchmark and evaluate frontier LLMs and retrievers. Our results demonstrate that IRB poses a significant challenge for frontier LLMs in the closed-book setting. Furthermore, our evaluation suggests that reasoning LLMs are more reliable, and that improving the retrieval component may yield more cost-effective gains in RAG system correctness than scaling the generator.",https://github.com/Hozaifa-Bhutta/IRB,Code: https://github.com/Hozaifa-Bhutta/IRB
SimGR: Escaping the Pitfalls of Generative Decoding in LLM-based Recommendation,"Yuanbo Zhao, Ruochen Liu, Senzhang Wang, Jun Yin, Yuxin Dong, Huan Gong, Hao Chen, Shirui Pan, Chengqi Zhang",2026-02-08,2602.07847v1,http://arxiv.org/abs/2602.07847v1,https://arxiv.org/pdf/2602.07847v1,information_retrieval,cs.IR,"A core objective in recommender systems is to accurately model the distribution of user preferences over items to enable personalized recommendations. Recently, driven by the strong generative capabilities of large language models (LLMs), LLM-based generative recommendation has become increasingly popular. However, we observe that existing methods inevitably introduce systematic bias when estimating item-level preference distributions. Specifically, autoregressive generation suffers from incomplete coverage due to beam search pruning, while parallel generation distorts probabilities by assuming token independence. We attribute this issue to a fundamental modeling mismatch: these methods approximate item-level distributions via token-level generation, which inherently induces approximation errors. Through both theoretical analysis and empirical validation, we demonstrate that token-level generation cannot faithfully substitute item-level generation, leading to biased item distributions. To address this, we propose \textbf{Sim}ply \textbf{G}enerative \textbf{R}ecommendation (\textbf{SimGR}), a framework that directly models item-level preference distributions in a shared latent space and ranks items by similarity, thereby aligning the modeling objective with recommendation and mitigating distributional distortion. Extensive experiments across multiple datasets and LLM backbones show that SimGR consistently outperforms existing generative recommenders. Our code is available at https://anonymous.4open.science/r/SimGR-C408/",,
ViHERMES: A Graph-Grounded Multihop Question Answering Benchmark and System for Vietnamese Healthcare Regulations,"Long S. T. Nguyen, Quan M. Bui, Tin T. Ngo, Quynh T. N. Vo, Dung N. H. Le, Tho T. Quan",2026-02-07,2602.07361v1,http://arxiv.org/abs/2602.07361v1,https://arxiv.org/pdf/2602.07361v1,information_retrieval,cs.CL,"Question Answering (QA) over regulatory documents is inherently challenging due to the need for multihop reasoning across legally interdependent texts, a requirement that is particularly pronounced in the healthcare domain where regulations are hierarchically structured and frequently revised through amendments and cross-references. Despite recent progress in retrieval-augmented and graph-based QA methods, systematic evaluation in this setting remains limited, especially for low-resource languages such as Vietnamese, due to the lack of benchmark datasets that explicitly support multihop reasoning over healthcare regulations. In this work, we introduce the Vietnamese Healthcare Regulations-Multihop Reasoning Dataset (ViHERMES), a benchmark designed for multihop QA over Vietnamese healthcare regulatory documents. ViHERMES consists of high-quality question-answer pairs that require reasoning across multiple regulations and capture diverse dependency patterns, including amendment tracing, cross-document comparison, and procedural synthesis. To construct the dataset, we propose a controlled multihop QA generation pipeline based on semantic clustering and graph-inspired data mining, followed by large language model-based generation with structured evidence and reasoning annotations. We further present a graph-aware retrieval framework that models formal legal relations at the level of legal units and supports principled context expansion for legally valid and coherent answers. Experimental results demonstrate that ViHERMES provides a challenging benchmark for evaluating multihop regulatory QA systems and that the proposed graph-aware approach consistently outperforms strong retrieval-based baselines. The ViHERMES dataset and system implementation are publicly available at https://github.com/ura-hcmut/ViHERMES.",https://github.com/ura-hcmut/ViHERMES,Accepted at ACIIDS 2026
Sequences as Nodes for Contrastive Multimodal Graph Recommendation,"Bucher Sahyouni, Matthew Vowels, Liqun Chen, Simon Hadfield",2026-02-06,2602.07208v1,http://arxiv.org/abs/2602.07208v1,https://arxiv.org/pdf/2602.07208v1,information_retrieval,cs.IR,"To tackle cold-start and data sparsity issues in recommender systems, numerous multimodal, sequential, and contrastive techniques have been proposed. While these augmentations can boost recommendation performance, they tend to add noise and disrupt useful semantics. To address this, we propose MuSICRec (Multimodal Sequence-Item Contrastive Recommender), a multi-view graph-based recommender that combines collaborative, sequential, and multimodal signals. We build a sequence-item (SI) view by attention pooling over the user's interacted items to form sequence nodes. We propagate over the SI graph, obtaining a second view organically as an alternative to artificial data augmentation, while simultaneously injecting sequential context signals. Additionally, to mitigate modality noise and align the multimodal information, the contribution of text and visual features is modulated according to an ID-guided gate.
  We evaluate under a strict leave-two-out split against a broad range of sequential, multimodal, and contrastive baselines. On the Amazon Baby, Sports, and Electronics datasets, MuSICRec outperforms state-of-the-art baselines across all model types. We observe the largest gains for short-history users, mitigating sparsity and cold-start challenges. Our code is available at https://anonymous.4open.science/r/MuSICRec-3CEE/ and will be made publicly available.",,
Reasoning-Augmented Representations for Multimodal Retrieval,"Jianrui Zhang, Anirudh Sundara Rajan, Brandon Han, Soochahn Lee, Sukanta Ganguly, Yong Jae Lee",2026-02-06,2602.07125v1,http://arxiv.org/abs/2602.07125v1,https://arxiv.org/pdf/2602.07125v1,information_retrieval,cs.IR,"Universal Multimodal Retrieval (UMR) seeks any-to-any search across text and vision, yet modern embedding models remain brittle when queries require latent reasoning (e.g., resolving underspecified references or matching compositional constraints). We argue this brittleness is often data-induced: when images carry ""silent"" evidence and queries leave key semantics implicit, a single embedding pass must both reason and compress, encouraging spurious feature matching. We propose a data-centric framework that decouples these roles by externalizing reasoning before retrieval. Using a strong Vision--Language Model, we make implicit semantics explicit by densely captioning visual evidence in corpus entries, resolving ambiguous multimodal references in queries, and rewriting verbose instructions into concise retrieval constraints. Inference-time enhancement alone is insufficient; the retriever must be trained on these semantically dense representations to avoid distribution shift and fully exploit the added signal. Across M-BEIR, our reasoning-augmented training method yields consistent gains over strong baselines, with ablations showing that corpus enhancement chiefly benefits knowledge-intensive queries while query enhancement is critical for compositional modification requests. We publicly release our code at https://github.com/AugmentedRetrieval/ReasoningAugmentedRetrieval.",https://github.com/AugmentedRetrieval/ReasoningAugmentedRetrieval,
R2LED: Equipping Retrieval and Refinement in Lifelong User Modeling with Semantic IDs for CTR Prediction,"Qidong Liu, Gengnan Wang, Zhichen Liu, Moranxin Wang, Zijian Zhang, Xiao Han, Ni Zhang, Tao Qin, Chen Li",2026-02-06,2602.06622v1,http://arxiv.org/abs/2602.06622v1,https://arxiv.org/pdf/2602.06622v1,information_retrieval,cs.IR,"Lifelong user modeling, which leverages users' long-term behavior sequences for CTR prediction, has been widely applied in personalized services. Existing methods generally adopted a two-stage ""retrieval-refinement"" strategy to balance effectiveness and efficiency. However, they still suffer from (i) noisy retrieval due to skewed data distribution and (ii) lack of semantic understanding in refinement. While semantic enhancement, e.g., LLMs modeling or semantic embeddings, offers potential solutions to these two challenges, these approaches face impractical inference costs or insufficient representation granularity. Obsorbing multi-granularity and lightness merits of semantic identity (SID), we propose a novel paradigm that equips retrieval and refinement in Lifelong User Modeling with SEmantic IDs (R2LED) to address these issues. First, we introduce a Multi-route Mixed Retrieval for the retrieval stage. On the one hand, it captures users' interests from various granularities by several parallel recall routes. On the other hand, a mixed retrieval mechanism is proposed to efficiently retrieve candidates from both collaborative and semantic views, reducing noise. Then, for refinement, we design a Bi-level Fusion Refinement, including a target-aware cross-attention for route-level fusion and a gate mechanism for SID-level fusion. It can bridge the gap between semantic and collaborative spaces, exerting the merits of SID. The comprehensive experimental results on two public datasets demonstrate the superiority of our method in both performance and efficiency. To facilitate the reproduction, we have released the code online https://github.com/abananbao/R2LED.",https://github.com/abananbao/R2LED,
MuCo: Multi-turn Contrastive Learning for Multimodal Embedding Model,"Geonmo Gu, Byeongho Heo, Jaemyung Yu, Jaehui Hwang, Taekyung Kim, Sangmin Lee, HeeJae Jun, Yoohoon Kang, Sangdoo Yun, Dongyoon Han",2026-02-06,2602.06393v1,http://arxiv.org/abs/2602.06393v1,https://arxiv.org/pdf/2602.06393v1,information_retrieval,cs.IR,"Universal Multimodal embedding models built on Multimodal Large Language Models (MLLMs) have traditionally employed contrastive learning, which aligns representations of query-target pairs across different modalities. Yet, despite its empirical success, they are primarily built on a ""single-turn"" formulation where each query-target pair is treated as an independent data point. This paradigm leads to computational inefficiency when scaling, as it requires a separate forward pass for each pair and overlooks potential contextual relationships between multiple queries that can relate to the same context. In this work, we introduce Multi-Turn Contrastive Learning (MuCo), a dialogue-inspired framework that revisits this process. MuCo leverages the conversational nature of MLLMs to process multiple, related query-target pairs associated with a single image within a single forward pass. This allows us to extract a set of multiple query and target embeddings simultaneously, conditioned on a shared context representation, amplifying the effective batch size and overall training efficiency. Experiments exhibit MuCo with a newly curated 5M multimodal multi-turn dataset (M3T), which yields state-of-the-art retrieval performance on MMEB and M-BEIR benchmarks, while markedly enhancing both training efficiency and representation coherence across modalities. Code and M3T are available at https://github.com/naver-ai/muco",https://github.com/naver-ai/muco,22 pages
SciDef: Automating Definition Extraction from Academic Literature with Large Language Models,"Filip Kučera, Christoph Mandl, Isao Echizen, Radu Timofte, Timo Spinde",2026-02-05,2602.05413v1,http://arxiv.org/abs/2602.05413v1,https://arxiv.org/pdf/2602.05413v1,information_retrieval,cs.IR,"Definitions are the foundation for any scientific work, but with a significant increase in publication numbers, gathering definitions relevant to any keyword has become challenging. We therefore introduce SciDef, an LLM-based pipeline for automated definition extraction. We test SciDef on DefExtra & DefSim, novel datasets of human-extracted definitions and definition-pairs' similarity, respectively. Evaluating 16 language models across prompting strategies, we demonstrate that multi-step and DSPy-optimized prompting improve extraction performance. To evaluate extraction, we test various metrics and show that an NLI-based method yields the most reliable results. We show that LLMs are largely able to extract definitions from scientific literature (86.4% of definitions from our test-set); yet future work should focus not just on finding definitions, but on identifying relevant ones, as models tend to over-generate them.
  Code & datasets are available at https://github.com/Media-Bias-Group/SciDef.",https://github.com/Media-Bias-Group/SciDef,"Under Review - Submitted to SIGIR 2026 Resources Track; 8 pages, 6 figures, 4 tables"
Multi-Source Retrieval and Reasoning for Legal Sentencing Prediction,"Junjie Chen, Haitao Li, Qilei Zhang, Zhenghua Li, Ya Zhang, Quan Zhou, Cheng Luo, Yiqun Liu, Dongsheng Guo, Qingyao Ai",2026-02-04,2602.04690v1,http://arxiv.org/abs/2602.04690v1,https://arxiv.org/pdf/2602.04690v1,information_retrieval,cs.IR,"Legal judgment prediction (LJP) aims to predict judicial outcomes from case facts and typically includes law article, charge, and sentencing prediction. While recent methods perform well on the first two subtasks, legal sentencing prediction (LSP) remains difficult due to its need for fine-grained objective knowledge and flexible subjective reasoning. To address these limitations, we propose $MSR^2$, a framework that integrates multi-source retrieval and reasoning in LLMs with reinforcement learning. $MSR^2$ enables LLMs to perform multi-source retrieval based on reasoning needs and applies a process-level reward to guide intermediate subjective reasoning steps. Experiments on two real-world datasets show that $MSR^2$ improves both accuracy and interpretability in LSP, providing a promising step toward practical legal AI. Our code is available at https://anonymous.4open.science/r/MSR2-FC3B.",,
SDR-CIR: Semantic Debias Retrieval Framework for Training-Free Zero-Shot Composed Image Retrieval,"Yi Sun, Jinyu Xu, Qing Xie, Jiachen Li, Yanchun Ma, Yongjian Liu",2026-02-04,2602.04451v2,http://arxiv.org/abs/2602.04451v2,https://arxiv.org/pdf/2602.04451v2,information_retrieval,cs.IR,"Composed Image Retrieval (CIR) aims to retrieve a target image from a query composed of a reference image and modification text. Recent training-free zero-shot methods often employ Multimodal Large Language Models (MLLMs) with Chain-of-Thought (CoT) to compose a target image description for retrieval. However, due to the fuzzy matching nature of ZS-CIR, the generated description is prone to semantic bias relative to the target image. We propose SDR-CIR, a training-free Semantic Debias Ranking method based on CoT reasoning. First, Selective CoT guides the MLLM to extract visual content relevant to the modification text during image understanding, thereby reducing visual noise at the source. We then introduce a Semantic Debias Ranking with two steps, Anchor and Debias, to mitigate semantic bias. In the Anchor step, we fuse reference image features with target description features to reinforce useful semantics and supplement omitted cues. In the Debias step, we explicitly model the visual semantic contribution of the reference image to the description and incorporate it into the similarity score as a penalty term. By supplementing omitted cues while suppressing redundancy, SDR-CIR mitigates semantic bias and improves retrieval performance. Experiments on three standard CIR benchmarks show that SDR-CIR achieves state-of-the-art results among one-stage methods while maintaining high efficiency. The code is publicly available at https://github.com/suny105/SDR-CIR.",https://github.com/suny105/SDR-CIR,Accepted by WWW 2026
