title,authors,published,arxiv_id,url,pdf_url,category,primary_category,abstract,code_links,comment
Efficient Mining of Low-Utility Sequential Patterns,"Jian Zhu, Zhidong Lin, Wensheng Gan, Ruichu Cai, Zhifeng Hao, Philip S. Yu",2025-10-11,2510.10243v1,http://arxiv.org/abs/2510.10243v1,http://arxiv.org/pdf/2510.10243v1,databases,cs.DB,"Discovering valuable insights from rich data is a crucial task for
exploratory data analysis. Sequential pattern mining (SPM) has found widespread
applications across various domains. In recent years, low-utility sequential
pattern mining (LUSPM) has shown strong potential in applications such as
intrusion detection and genomic sequence analysis. However, existing research
in utility-based SPM focuses on high-utility sequential patterns, and the
definitions and strategies used in high-utility SPM cannot be directly applied
to LUSPM. Moreover, no algorithms have yet been developed specifically for
mining low-utility sequential patterns. To address these problems, we formalize
the LUSPM problem, redefine sequence utility, and introduce a compact data
structure called the sequence-utility chain to efficiently record utility
information. Furthermore, we propose three novel algorithm--LUSPM_b, LUSPM_s,
and LUSPM_e--to discover the complete set of low-utility sequential patterns.
LUSPM_b serves as an exhaustive baseline, while LUSPM_s and LUSPM_e build upon
it, generating subsequences through shrinkage and extension operations,
respectively. In addition, we introduce the maximal non-mutually contained
sequence set and incorporate multiple pruning strategies, which significantly
reduce redundant operations in both LUSPM_s and LUSPM_e. Finally, extensive
experimental results demonstrate that both LUSPM_s and LUSPM_e substantially
outperform LUSPM_b and exhibit excellent scalability. Notably, LUSPM_e achieves
superior efficiency, requiring less runtime and memory consumption than
LUSPM_s. Our code is available at https://github.com/Zhidong-Lin/LUSPM.",https://github.com/Zhidong-Lin/LUSPM,"Preprint, 4 tables, 9 figures"
Knowledge Graph-Guided Multi-Agent Distillation for Reliable Industrial Question Answering with Datasets,"Jiqun Pan, Zhenke Duan, Jiani Tu, Anzhi Cheng, Yanqing Wang",2025-10-03,2510.06240v1,http://arxiv.org/abs/2510.06240v1,http://arxiv.org/pdf/2510.06240v1,databases,cs.CL,"Industrial question-answering (QA) systems require higher safety and
reliability than general-purpose dialogue models, as errors in high-risk
scenarios such as equipment fault diagnosis can have severe consequences.
Although multi-agent large language models enhance reasoning depth, they suffer
from uncontrolled iterations and unverifiable outputs, and conventional
distillation methods struggle to transfer collaborative reasoning capabilities
to lightweight, deployable student models. To address these challenges, we
propose Knowledge Graph-guided Multi-Agent System Distillation (KG-MASD). Our
approach formulates distillation as a Markov Decision Process and incorporates
a knowledge graph as a verifiable structured prior to enrich state
representation and ensure convergence. By integrating collaborative reasoning
with knowledge grounding, KG-MASD generates high-confidence instruction-tuning
data and jointly distills reasoning depth and verifiability into compact
student models suitable for edge deployment. Experiments on an industrial QA
dataset show that KG-MASD improves accuracy by 2.4 per cent to 20.1 per cent
over baselines and significantly enhances reliability, enabling trustworthy AI
deployment in safety-critical industrial scenarios. Code and data are available
at https://github.com/erwinmsmith/KG-MAD/.",https://github.com/erwinmsmith/KG-MAD,"41 pages, 12 figures, 6 tables"
EMR-AGENT: Automating Cohort and Feature Extraction from EMR Databases,"Kwanhyung Lee, Sungsoo Hong, Joonhyung Park, Jeonghyeop Lim, Juhwan Choi, Donghwee Yoon, Eunho Yang",2025-10-01,2510.00549v2,http://arxiv.org/abs/2510.00549v2,http://arxiv.org/pdf/2510.00549v2,databases,cs.DB,"Machine learning models for clinical prediction rely on structured data
extracted from Electronic Medical Records (EMRs), yet this process remains
dominated by hardcoded, database-specific pipelines for cohort definition,
feature selection, and code mapping. These manual efforts limit scalability,
reproducibility, and cross-institutional generalization. To address this, we
introduce EMR-AGENT (Automated Generalized Extraction and Navigation Tool), an
agent-based framework that replaces manual rule writing with dynamic, language
model-driven interaction to extract and standardize structured clinical data.
Our framework automates cohort selection, feature extraction, and code mapping
through interactive querying of databases. Our modular agents iteratively
observe query results and reason over schema and documentation, using SQL not
just for data retrieval but also as a tool for database observation and
decision making. This eliminates the need for hand-crafted, schema-specific
logic. To enable rigorous evaluation, we develop a benchmarking codebase for
three EMR databases (MIMIC-III, eICU, SICdb), including both seen and unseen
schema settings. Our results demonstrate strong performance and generalization
across these databases, highlighting the feasibility of automating a process
previously thought to require expert-driven design. The code will be released
publicly at https://github.com/AITRICS/EMR-AGENT/tree/main. For a
demonstration, please visit our anonymous demo page:
https://anonymoususer-max600.github.io/EMR_AGENT/",https://github.com/AITRICS/EMR-AGENT,currently under submission to ICLR 2026
Graph2Region: Efficient Graph Similarity Learning with Structure and Scale Restoration,"Zhouyang Liu, Yixin Chen, Ning Liu, Jiezhong He, Dongsheng Li",2025-10-01,2510.00394v1,http://arxiv.org/abs/2510.00394v1,http://arxiv.org/pdf/2510.00394v1,databases,cs.LG,"Graph similarity is critical in graph-related tasks such as graph retrieval,
where metrics like maximum common subgraph (MCS) and graph edit distance (GED)
are commonly used. However, exact computations of these metrics are known to be
NP-Hard. Recent neural network-based approaches approximate the similarity
score in embedding spaces to alleviate the computational burden, but they
either involve expensive pairwise node comparisons or fail to effectively
utilize structural and scale information of graphs. To tackle these issues, we
propose a novel geometric-based graph embedding method called Graph2Region
(G2R). G2R represents nodes as closed regions and recovers their adjacency
patterns within graphs in the embedding space. By incorporating the node
features and adjacency patterns of graphs, G2R summarizes graph regions, i.e.,
graph embeddings, where the shape captures the underlying graph structures and
the volume reflects the graph size. Consequently, the overlap between graph
regions can serve as an approximation of MCS, signifying similar node regions
and adjacency patterns. We further analyze the relationship between MCS and GED
and propose using disjoint parts as a proxy for GED similarity. This analysis
enables concurrent computation of MCS and GED, incorporating local and global
structural information. Experimental evaluation highlights G2R's competitive
performance in graph similarity computation. It achieves up to a 60.0\%
relative accuracy improvement over state-of-the-art methods in MCS similarity
learning, while maintaining efficiency in both training and inference.
Moreover, G2R showcases remarkable capability in predicting both MCS and GED
similarities simultaneously, providing a holistic assessment of graph
similarity. Code available at https://github.com/liuzhouyang/Graph2Region.",https://github.com/liuzhouyang/Graph2Region,Accepted by IEEE Transactions on Knowledge and Data Engineering
"ActorDB: A Unified Database Model Integrating Single-Writer Actors, Incremental View Maintenance, and Zero-Trust Messaging",Jun Kawasaki,2025-09-29,2509.25285v1,http://arxiv.org/abs/2509.25285v1,http://arxiv.org/pdf/2509.25285v1,databases,cs.DB,"This paper presents ActorDB ( Dekigoto ) , a novel database architecture that
tightly integrates a single-writer actor model for writes, Incremental View
Maintenance (IVM), and a zero-trust security model as a core component. The
primary contribution of this work is the unification of these powerful but
complex concepts into a single, cohesive system designed to reduce
architectural complexity for developers of modern, data-intensive applications.
We argue that by providing these capabilities out-of-the-box, ActorDB can offer
a more robust, secure, and developer-friendly platform compared to solutions
that require manual integration of separate systems for actor persistence,
stream processing, and security. We present the core architecture, discuss the
critical trade-offs in its design, and define the performance criteria for a
Minimum Viable Product (MVP) to validate our approach.",https://github.com/com-junkawasaki/dekigoto,"7 pages, 1 table, 1 figures. Code and data available at
  https://github.com/com-junkawasaki/dekigoto"
Multilingual Text-to-SQL: Benchmarking the Limits of Language Models with Collaborative Language Agents,"Khanh Trinh Pham, Thu Huong Nguyen, Jun Jo, Quoc Viet Hung Nguyen, Thanh Tam Nguyen",2025-09-29,2509.24405v1,http://arxiv.org/abs/2509.24405v1,http://arxiv.org/pdf/2509.24405v1,databases,cs.CL,"Text-to-SQL enables natural access to databases, yet most benchmarks are
English-only, limiting multilingual progress. We introduce MultiSpider 2.0,
extending Spider 2.0 to eight languages (English, German, French, Spanish,
Portuguese, Japanese, Chinese, Vietnamese). It preserves Spider 2.0's
structural difficulty while adding linguistic and dialectal variability,
demanding deeper reasoning for complex SQL. On this benchmark, state-of-the-art
LLMs (such as DeepSeek-R1 and OpenAI o1) reach only 4\% execution accuracy when
relying on intrinsic reasoning, versus 60\% on MultiSpider 1.0. Therefore, we
provide a collaboration-driven language agents baseline that iteratively
refines queries, improving accuracy to 15\%. These results reveal a substantial
multilingual gap and motivate methods that are robust across languages and
ready for real-world enterprise deployment. Our benchmark is available at
https://github.com/phkhanhtrinh23/Multilingual_Text_to_SQL.",https://github.com/phkhanhtrinh23/Multilingual_Text_to_SQL,
