title,authors,published,arxiv_id,url,pdf_url,category,primary_category,abstract,code_links,comment
PatenTEB: A Comprehensive Benchmark and Model Family for Patent Text Embedding,"Iliass Ayaou, Denis Cavallucci",2025-10-25,2510.22264v1,http://arxiv.org/abs/2510.22264v1,http://arxiv.org/pdf/2510.22264v1,information_retrieval,cs.CL,"Patent text embeddings enable prior art search, technology landscaping, and
patent analysis, yet existing benchmarks inadequately capture patent-specific
challenges. We introduce PatenTEB, a comprehensive benchmark comprising 15
tasks across retrieval, classification, paraphrase, and clustering, with 2.06
million examples. PatenTEB employs domain-stratified splits, domain specific
hard negative mining, and systematic coverage of asymmetric
fragment-to-document matching scenarios absent from general embedding
benchmarks. We develop the patembed model family through multi-task training,
spanning 67M to 344M parameters with context lengths up to 4096 tokens.
External validation shows strong generalization: patembed-base achieves
state-of-the-art on MTEB BigPatentClustering.v2 (0.494 V-measure vs. 0.445
previous best), while patembed-large achieves 0.377 NDCG@100 on DAPFAM.
Systematic ablations reveal that multi-task training improves external
generalization despite minor benchmark costs, and that domain-pretrained
initialization provides consistent advantages across task families. All
resources will be made available at https://github.com/iliass-y/patenteb.
Keywords: patent retrieval, sentence embeddings, multi-task learning,
asymmetric retrieval, benchmark evaluation, contrastive learning.",https://github.com/iliass-y/patenteb,
Hybrid-Vector Retrieval for Visually Rich Documents: Combining Single-Vector Efficiency and Multi-Vector Accuracy,"Juyeon Kim, Geon Lee, Dongwon Choi, Taeuk Kim, Kijung Shin",2025-10-25,2510.22215v1,http://arxiv.org/abs/2510.22215v1,http://arxiv.org/pdf/2510.22215v1,information_retrieval,cs.IR,"Retrieval over visually rich documents is essential for tasks such as legal
discovery, scientific search, and enterprise knowledge management. Existing
approaches fall into two paradigms: single-vector retrieval, which is efficient
but coarse, and multi-vector retrieval, which is accurate but computationally
expensive. To address this trade-off, we propose HEAVEN, a two-stage
hybrid-vector framework. In the first stage, HEAVEN efficiently retrieves
candidate pages using a single-vector method over Visually-Summarized Pages
(VS-Pages), which assemble representative visual layouts from multiple pages.
In the second stage, it reranks candidates with a multi-vector method while
filtering query tokens by linguistic importance to reduce redundant
computations. To evaluate retrieval systems under realistic conditions, we also
introduce ViMDOC, the first benchmark for visually rich, multi-document, and
long-document retrieval. Across four benchmarks, HEAVEN attains 99.87% of the
Recall@1 performance of multi-vector models on average while reducing per-query
computation by 99.82%, achieving efficiency and accuracy. Our code and datasets
are available at: https://github.com/juyeonnn/HEAVEN",https://github.com/juyeonnn/HEAVEN,
A Benchmark for Open-Domain Numerical Fact-Checking Enhanced by Claim Decomposition,"V Venktesh, Deepali Prabhu, Avishek Anand",2025-10-24,2510.22055v1,http://arxiv.org/abs/2510.22055v1,http://arxiv.org/pdf/2510.22055v1,information_retrieval,cs.IR,"Fact-checking numerical claims is critical as the presence of numbers provide
mirage of veracity despite being fake potentially causing catastrophic impacts
on society. The prior works in automatic fact verification do not primarily
focus on natural numerical claims. A typical human fact-checker first retrieves
relevant evidence addressing the different numerical aspects of the claim and
then reasons about them to predict the veracity of the claim. Hence, the search
process of a human fact-checker is a crucial skill that forms the foundation of
the verification process. Emulating a real-world setting is essential to aid in
the development of automated methods that encompass such skills. However,
existing benchmarks employ heuristic claim decomposition approaches augmented
with weakly supervised web search to collect evidences for verifying claims.
This sometimes results in less relevant evidences and noisy sources with
temporal leakage rendering a less realistic retrieval setting for claim
verification. Hence, we introduce QuanTemp++: a dataset consisting of natural
numerical claims, an open domain corpus, with the corresponding relevant
evidence for each claim. The evidences are collected through a claim
decomposition process approximately emulating the approach of human
fact-checker and veracity labels ensuring there is no temporal leakage. Given
this dataset, we also characterize the retrieval performance of key claim
decomposition paradigms. Finally, we observe their effect on the outcome of the
verification pipeline and draw insights. The code for data pipeline along with
link to data can be found at https://github.com/VenkteshV/QuanTemp_Plus",https://github.com/VenkteshV/QuanTemp_Plus,16 pages
DeepAgent: A General Reasoning Agent with Scalable Toolsets,"Xiaoxi Li, Wenxiang Jiao, Jiarui Jin, Guanting Dong, Jiajie Jin, Yinuo Wang, Hao Wang, Yutao Zhu, Ji-Rong Wen, Yuan Lu, Zhicheng Dou",2025-10-24,2510.21618v1,http://arxiv.org/abs/2510.21618v1,http://arxiv.org/pdf/2510.21618v1,information_retrieval,cs.AI,"Large reasoning models have demonstrated strong problem-solving abilities,
yet real-world tasks often require external tools and long-horizon
interactions. Existing agent frameworks typically follow predefined workflows,
which limit autonomous and global task completion. In this paper, we introduce
DeepAgent, an end-to-end deep reasoning agent that performs autonomous
thinking, tool discovery, and action execution within a single, coherent
reasoning process. To address the challenges of long-horizon interactions,
particularly the context length explosion from multiple tool calls and the
accumulation of interaction history, we introduce an autonomous memory folding
mechanism that compresses past interactions into structured episodic, working,
and tool memories, reducing error accumulation while preserving critical
information. To teach general-purpose tool use efficiently and stably, we
develop an end-to-end reinforcement learning strategy, namely ToolPO, that
leverages LLM-simulated APIs and applies tool-call advantage attribution to
assign fine-grained credit to the tool invocation tokens. Extensive experiments
on eight benchmarks, including general tool-use tasks (ToolBench, API-Bank,
TMDB, Spotify, ToolHop) and downstream applications (ALFWorld, WebShop, GAIA,
HLE), demonstrate that DeepAgent consistently outperforms baselines across both
labeled-tool and open-set tool retrieval scenarios. This work takes a step
toward more general and capable agents for real-world applications. The code
and demo are available at https://github.com/RUC-NLPIR/DeepAgent.",https://github.com/RUC-NLPIR/DeepAgent,
Pctx: Tokenizing Personalized Context for Generative Recommendation,"Qiyong Zhong, Jiajie Su, Yunshan Ma, Julian McAuley, Yupeng Hou",2025-10-24,2510.21276v1,http://arxiv.org/abs/2510.21276v1,http://arxiv.org/pdf/2510.21276v1,information_retrieval,cs.IR,"Generative recommendation (GR) models tokenize each action into a few
discrete tokens (called semantic IDs) and autoregressively generate the next
tokens as predictions, showing advantages such as memory efficiency,
scalability, and the potential to unify retrieval and ranking. Despite these
benefits, existing tokenization methods are static and non-personalized. They
typically derive semantic IDs solely from item features, assuming a universal
item similarity that overlooks user-specific perspectives. However, under the
autoregressive paradigm, semantic IDs with the same prefixes always receive
similar probabilities, so a single fixed mapping implicitly enforces a
universal item similarity standard across all users. In practice, the same item
may be interpreted differently depending on user intentions and preferences. To
address this issue, we propose a personalized context-aware tokenizer that
incorporates a user's historical interactions when generating semantic IDs.
This design allows the same item to be tokenized into different semantic IDs
under different user contexts, enabling GR models to capture multiple
interpretive standards and produce more personalized predictions. Experiments
on three public datasets demonstrate up to 11.44% improvement in NDCG@10 over
non-personalized action tokenization baselines. Our code is available at
https://github.com/YoungZ365/Pctx.",https://github.com/YoungZ365/Pctx,
Rank-GRPO: Training LLM-based Conversational Recommender Systems with Reinforcement Learning,"Yaochen Zhu, Harald Steck, Dawen Liang, Yinhan He, Vito Ostuni, Jundong Li, Nathan Kallus",2025-10-23,2510.20150v2,http://arxiv.org/abs/2510.20150v2,http://arxiv.org/pdf/2510.20150v2,information_retrieval,cs.IR,"Large language models (LLMs) are reshaping the recommender system paradigm by
enabling users to express preferences and receive recommendations through
conversations. Yet, aligning LLMs to the recommendation task remains
challenging: pretrained LLMs often generate out-of-catalog items, violate
required output formats, and their ranking quality degrades sharply toward the
end of the generated list. To this end, we propose ConvRec-R1, a two-stage
framework for end-to-end training of LLM-based conversational recommender
systems. In Stage 1, we construct a behavioral-cloning dataset with a
Remap-Reflect-Adjust pipeline, which produces high-quality, catalog-grounded
demonstrations from powerful blackbox LLMs to warm-start the RL training. In
Stage 2, we propose Rank-GRPO, a principled extension of group relative policy
optimization (GRPO) tailored to tasks with rank-style outputs. Rank-GRPO treats
each rank in the recommendation list as the unit instead of token (too
fine-grained) or sequence (too coarse), redefining rewards to remove non-causal
credit assignment and introducing a rank-level importance ratio based on the
geometric mean of rank-wise token probabilities to stabilize policy updates.
Experiments on the public Reddit-v2 dataset show that ConvRec-R1 converges
faster and achieves higher Recall and NDCG than GRPO-style baselines. Code and
datasets are released at https://github.com/yaochenzhu/Rank-GRPO.",https://github.com/yaochenzhu/Rank-GRPO,
DiffGRM: Diffusion-based Generative Recommendation Model,"Zhao Liu, Yichen Zhu, Yiqing Yang, Guoping Tang, Rui Huang, Qiang Luo, Xiao Lv, Ruiming Tang, Kun Gai, Guorui Zhou",2025-10-21,2510.21805v1,http://arxiv.org/abs/2510.21805v1,http://arxiv.org/pdf/2510.21805v1,information_retrieval,cs.IR,"Generative recommendation (GR) is an emerging paradigm that represents each
item via a tokenizer as an n-digit semantic ID (SID) and predicts the next item
by autoregressively generating its SID conditioned on the user's history.
However, two structural properties of SIDs make ARMs ill-suited. First,
intra-item consistency: the n digits jointly specify one item, yet the
left-to-right causality trains each digit only under its prefix and blocks
bidirectional cross-digit evidence, collapsing supervision to a single causal
path. Second, inter-digit heterogeneity: digits differ in semantic granularity
and predictability, while the uniform next-token objective assigns equal weight
to all digits, overtraining easy digits and undertraining hard digits. To
address these two issues, we propose DiffGRM, a diffusion-based GR model that
replaces the autoregressive decoder with a masked discrete diffusion model
(MDM), thereby enabling bidirectional context and any-order parallel generation
of SID digits for recommendation. Specifically, we tailor DiffGRM in three
aspects: (1) tokenization with Parallel Semantic Encoding (PSE) to decouple
digits and balance per-digit information; (2) training with On-policy Coherent
Noising (OCN) that prioritizes uncertain digits via coherent masking to
concentrate supervision on high-value signals; and (3) inference with
Confidence-guided Parallel Denoising (CPD) that fills higher-confidence digits
first and generates diverse Top-K candidates. Experiments show consistent gains
over strong generative and discriminative recommendation baselines on multiple
datasets, improving NDCG@10 by 6.9%-15.5%. Code is available at
https://github.com/liuzhao09/DiffGRM.",https://github.com/liuzhao09/DiffGRM,"13 pages, 5 figures"
FACE: A General Framework for Mapping Collaborative Filtering Embeddings into LLM Tokens,"Chao Wang, Yixin Song, Jinhui Ye, Chuan Qin, Dazhong Shen, Lingfeng Liu, Xiang Wang, Yanyong Zhang",2025-10-17,2510.15729v1,http://arxiv.org/abs/2510.15729v1,http://arxiv.org/pdf/2510.15729v1,information_retrieval,cs.IR,"Recently, large language models (LLMs) have been explored for integration
with collaborative filtering (CF)-based recommendation systems, which are
crucial for personalizing user experiences. However, a key challenge is that
LLMs struggle to interpret the latent, non-semantic embeddings produced by CF
approaches, limiting recommendation effectiveness and further applications. To
address this, we propose FACE, a general interpretable framework that maps CF
embeddings into pre-trained LLM tokens. Specifically, we introduce a
disentangled projection module to decompose CF embeddings into concept-specific
vectors, followed by a quantized autoencoder to convert continuous embeddings
into LLM tokens (descriptors). Then, we design a contrastive alignment
objective to ensure that the tokens align with corresponding textual signals.
Hence, the model-agnostic FACE framework achieves semantic alignment without
fine-tuning LLMs and enhances recommendation performance by leveraging their
pre-trained capabilities. Empirical results on three real-world recommendation
datasets demonstrate performance improvements in benchmark models, with
interpretability studies confirming the interpretability of the descriptors.
Code is available in https://github.com/YixinRoll/FACE.",https://github.com/YixinRoll/FACE,Accepted by NeurIPS 2025
GraphMind: Interactive Novelty Assessment System for Accelerating Scientific Discovery,"Italo Luis da Silva, Hanqi Yan, Lin Gui, Yulan He",2025-10-17,2510.15706v1,http://arxiv.org/abs/2510.15706v1,http://arxiv.org/pdf/2510.15706v1,information_retrieval,cs.IR,"Large Language Models (LLMs) show strong reasoning and text generation
capabilities, prompting their use in scientific literature analysis, including
novelty assessment. While evaluating novelty of scientific papers is crucial
for peer review, it requires extensive knowledge of related work, something not
all reviewers have. While recent work on LLM-assisted scientific literature
analysis supports literature comparison, existing approaches offer limited
transparency and lack mechanisms for result traceability via an information
retrieval module. To address this gap, we introduce $\textbf{GraphMind}$, an
easy-to-use interactive web tool designed to assist users in evaluating the
novelty of scientific papers or drafted ideas. Specially, $\textbf{GraphMind}$
enables users to capture the main structure of a scientific paper, explore
related ideas through various perspectives, and assess novelty via providing
verifiable contextual insights. $\textbf{GraphMind}$ enables users to annotate
key elements of a paper, explore related papers through various relationships,
and assess novelty with contextual insight. This tool integrates external APIs
such as arXiv and Semantic Scholar with LLMs to support annotation, extraction,
retrieval and classification of papers. This combination provides users with a
rich, structured view of a scientific idea's core contributions and its
connections to existing work. $\textbf{GraphMind}$ is available at
https://oyarsa.github.io/graphmind and a demonstration video at
https://youtu.be/wKbjQpSvwJg. The source code is available at
https://github.com/oyarsa/graphmind.",https://github.com/oyarsa/graphmind,"9 pages, 6 figures, 3 tables, EMNLP 2025 Demo paper"
Mixture of Experts Approaches in Dense Retrieval Tasks,"Effrosyni Sokli, Pranav Kasela, Georgios Peikos, Gabriella Pasi",2025-10-17,2510.15683v1,http://arxiv.org/abs/2510.15683v1,http://arxiv.org/pdf/2510.15683v1,information_retrieval,cs.IR,"Dense Retrieval Models (DRMs) are a prominent development in Information
Retrieval (IR). A key challenge with these neural Transformer-based models is
that they often struggle to generalize beyond the specific tasks and domains
they were trained on. To address this challenge, prior research in IR
incorporated the Mixture-of-Experts (MoE) framework within each Transformer
layer of a DRM, which, though effective, substantially increased the number of
additional parameters. In this paper, we propose a more efficient design, which
introduces a single MoE block (SB-MoE) after the final Transformer layer. To
assess the retrieval effectiveness of SB-MoE, we perform an empirical
evaluation across three IR tasks. Our experiments involve two evaluation
setups, aiming to assess both in-domain effectiveness and the model's zero-shot
generalizability. In the first setup, we fine-tune SB-MoE with four different
underlying DRMs on seven IR benchmarks and evaluate them on their respective
test sets. In the second setup, we fine-tune SB-MoE on MSMARCO and perform
zero-shot evaluation on thirteen BEIR datasets. Additionally, we perform
further experiments to analyze the model's dependency on its hyperparameters
(i.e., the number of employed and activated experts) and investigate how this
variation affects SB-MoE's performance. The obtained results show that SB-MoE
is particularly effective for DRMs with lightweight base models, such as
TinyBERT and BERT-Small, consistently exceeding standard model fine-tuning
across benchmarks. For DRMs with more parameters, such as BERT-Base and
Contriever, our model requires a larger number of training samples to achieve
improved retrieval performance. Our code is available online at:
https://github.com/FaySokli/SB-MoE.",https://github.com/FaySokli/SB-MoE,"8 pages, 4 figures, 3 tables, reproducible code available at
  https://github.com/FaySokli/SB-MoE , Accepted for publication in Proceedings
  of the 2025 IEEE/WIC International Conference on Web Intelligence and
  Intelligent Agent Technology (WI-IAT 2025)"
A Survey of Data Agents: Emerging Paradigm or Overstated Hype?,"Yizhang Zhu, Liangwei Wang, Chenyu Yang, Xiaotian Lin, Boyan Li, Wei Zhou, Xinyu Liu, Zhangyang Peng, Tianqi Luo, Yu Li, Chengliang Chai, Chong Chen, Shimin Di, Ju Fan, Ji Sun, Nan Tang, Fugee Tsung, Jiannan Wang, Chenglin Wu, Yanwei Xu, Shaolei Zhang, Yong Zhang, Xuanhe Zhou, Guoliang Li, Yuyu Luo",2025-10-27,2510.23587v1,http://arxiv.org/abs/2510.23587v1,http://arxiv.org/pdf/2510.23587v1,databases,cs.DB,"The rapid advancement of large language models (LLMs) has spurred the
emergence of data agents--autonomous systems designed to orchestrate Data + AI
ecosystems for tackling complex data-related tasks. However, the term ""data
agent"" currently suffers from terminological ambiguity and inconsistent
adoption, conflating simple query responders with sophisticated autonomous
architectures. This terminological ambiguity fosters mismatched user
expectations, accountability challenges, and barriers to industry growth.
Inspired by the SAE J3016 standard for driving automation, this survey
introduces the first systematic hierarchical taxonomy for data agents,
comprising six levels that delineate and trace progressive shifts in autonomy,
from manual operations (L0) to a vision of generative, fully autonomous data
agents (L5), thereby clarifying capability boundaries and responsibility
allocation. Through this lens, we offer a structured review of existing
research arranged by increasing autonomy, encompassing specialized data agents
for data management, preparation, and analysis, alongside emerging efforts
toward versatile, comprehensive systems with enhanced autonomy. We further
analyze critical evolutionary leaps and technical gaps for advancing data
agents, especially the ongoing L2-to-L3 transition, where data agents evolve
from procedural execution to autonomous orchestration. Finally, we conclude
with a forward-looking roadmap, envisioning the advent of proactive, generative
data agents.",https://github.com/HKUSTDial/awesome-data-agents,"Please refer to our paper list and companion materials at:
  https://github.com/HKUSTDial/awesome-data-agents"
DynaQuery: A Self-Adapting Framework for Querying Structured and Multimodal Data,Aymane Hassini,2025-10-20,2510.18029v1,http://arxiv.org/abs/2510.18029v1,http://arxiv.org/pdf/2510.18029v1,databases,cs.DB,"The rise of Large Language Models (LLMs) has accelerated the long-standing
goal of enabling natural language querying over complex, hybrid databases. Yet,
this ambition exposes a dual challenge: reasoning jointly over structured,
multi-relational schemas and the semantic content of linked unstructured
assets. To overcome this, we present DynaQuery - a unified, self-adapting
framework that serves as a practical blueprint for next-generation ""Unbound
Databases."" At the heart of DynaQuery lies the Schema Introspection and Linking
Engine (SILE), a novel systems primitive that elevates schema linking to a
first-class query planning phase. We conduct a rigorous, multi-benchmark
empirical evaluation of this structure-aware architecture against the prevalent
unstructured Retrieval-Augmented Generation (RAG) paradigm. Our results
demonstrate that the unstructured retrieval paradigm is architecturally
susceptible to catastrophic contextual failures, such as SCHEMA_HALLUCINATION,
leading to unreliable query generation. In contrast, our SILE-based design
establishes a substantially more robust foundation, nearly eliminating this
failure mode. Moreover, end-to-end validation on a complex, newly curated
benchmark uncovers a key generalization principle: the transition from pure
schema-awareness to holistic semantics-awareness. Taken together, our findings
provide a validated architectural basis for developing natural language
database interfaces that are robust, adaptable, and predictably consistent.",https://github.com/aymanehassini/DynaQuery,"15 pages, 2 figures, 10 tables. Source code and experimental
  artifacts are available at: https://github.com/aymanehassini/DynaQuery . The
  'DynaQuery-Eval-5K' benchmark, introduced in this work, is also publicly
  available at:
  https://www.kaggle.com/datasets/aymanehassini/dynaquery-eval-5k-benchmark"
DeepAnalyze: Agentic Large Language Models for Autonomous Data Science,"Shaolei Zhang, Ju Fan, Meihao Fan, Guoliang Li, Xiaoyong Du",2025-10-19,2510.16872v1,http://arxiv.org/abs/2510.16872v1,http://arxiv.org/pdf/2510.16872v1,databases,cs.AI,"Autonomous data science, from raw data sources to analyst-grade deep research
reports, has been a long-standing challenge, and is now becoming feasible with
the emergence of powerful large language models (LLMs). Recent workflow-based
data agents have shown promising results on specific data tasks but remain
fundamentally limited in achieving fully autonomous data science due to their
reliance on predefined workflows. In this paper, we introduce DeepAnalyze-8B,
the first agentic LLM designed for autonomous data science, capable of
automatically completing the end-toend pipeline from data sources to
analyst-grade deep research reports. To tackle high-complexity data science
tasks, we propose a curriculum-based agentic training paradigm that emulates
the learning trajectory of human data scientists, enabling LLMs to
progressively acquire and integrate multiple capabilities in real-world
environments. We also introduce a data-grounded trajectory synthesis framework
that constructs high-quality training data. Through agentic training,
DeepAnalyze learns to perform a broad spectrum of data tasks, ranging from data
question answering and specialized analytical tasks to open-ended data
research. Experiments demonstrate that, with only 8B parameters, DeepAnalyze
outperforms previous workflow-based agents built on most advanced proprietary
LLMs. The model, code, and training data of DeepAnalyze are open-sourced,
paving the way toward autonomous data science.",https://github.com/ruc-datalab/DeepAnalyze,"Code: https://github.com/ruc-datalab/DeepAnalyze Model:
  https://huggingface.co/RUC-DataLab/DeepAnalyze-8B"
