title,authors,published,arxiv_id,url,pdf_url,category,primary_category,abstract,code_links,comment
AutoPK: Leveraging LLMs and a Hybrid Similarity Metric for Advanced Retrieval of Pharmacokinetic Data from Complex Tables and Documents,"Hossein Sholehrasa, Amirhossein Ghanaatian, Doina Caragea, Lisa A. Tell, Jim E. Riviere, Majid Jaberi-Douraki",2025-09-26,2510.00039v1,http://arxiv.org/abs/2510.00039v1,http://arxiv.org/pdf/2510.00039v1,databases,cs.DB,"Pharmacokinetics (PK) plays a critical role in drug development and
regulatory decision-making for human and veterinary medicine, directly
affecting public health through drug safety and efficacy assessments. However,
PK data are often embedded in complex, heterogeneous tables with variable
structures and inconsistent terminologies, posing significant challenges for
automated PK data retrieval and standardization. AutoPK, a novel two-stage
framework for accurate and scalable extraction of PK data from complex
scientific tables. In the first stage, AutoPK identifies and extracts PK
parameter variants using large language models (LLMs), a hybrid similarity
metric, and LLM-based validation. The second stage filters relevant rows,
converts the table into a key-value text format, and uses an LLM to reconstruct
a standardized table. Evaluated on a real-world dataset of 605 PK tables,
including captions and footnotes, AutoPK shows significant improvements in
precision and recall over direct LLM baselines. For instance, AutoPK with LLaMA
3.1-70B achieved an F1-score of 0.92 on half-life and 0.91 on clearance
parameters, outperforming direct use of LLaMA 3.1-70B by margins of 0.10 and
0.21, respectively. Smaller models such as Gemma 3-27B and Phi 3-12B with
AutoPK achieved 2-7 fold F1 gains over their direct use, with Gemma's
hallucination rates reduced from 60-95% down to 8-14%. Notably, AutoPK enabled
open-source models like Gemma 3-27B to outperform commercial systems such as
GPT-4o Mini on several PK parameters. AutoPK enables scalable and
high-confidence PK data extraction, making it well-suited for critical
applications in veterinary pharmacology, drug safety monitoring, and public
health decision-making, while addressing heterogeneous table structures and
terminology and demonstrating generalizability across key PK parameters. Code
and data: https://github.com/hosseinsholehrasa/AutoPK",https://github.com/hosseinsholehrasa/AutoPK,Accepted at the 2025 IEEE 37th ICTAI
Play by the Type Rules: Inferring Constraints for LLM Functions in Declarative Programs,"Parker Glenn, Alfy Samuel, Daben Liu",2025-09-24,2509.20208v1,http://arxiv.org/abs/2509.20208v1,http://arxiv.org/pdf/2509.20208v1,databases,cs.CL,"Integrating LLM powered operators in declarative query languages allows for
the combination of cheap and interpretable functions with powerful,
generalizable language model reasoning. However, in order to benefit from the
optimized execution of a database query language like SQL, generated outputs
must align with the rules enforced by both type checkers and database contents.
Current approaches address this challenge with orchestrations consisting of
many LLM-based post-processing calls to ensure alignment between generated
outputs and database values, introducing performance bottlenecks. We perform a
study on the ability of various sized open-source language models to both parse
and execute functions within a query language based on SQL, showing that small
language models can excel as function executors over hybrid data sources. Then,
we propose an efficient solution to enforce the well-typedness of LLM
functions, demonstrating 7% accuracy improvement on a multi-hop question
answering dataset with 53% improvement in latency over comparable solutions. We
make our implementation available at https://github.com/parkervg/blendsql",https://github.com/parkervg/blendsql,
ORQ: Complex Analytics on Private Data with Strong Security Guarantees,"Eli Baum, Sam Buxbaum, Nitin Mathai, Muhammad Faisal, Vasiliki Kalavri, Mayank Varia, John Liagouris",2025-09-13,2509.10793v1,http://arxiv.org/abs/2509.10793v1,http://arxiv.org/pdf/2509.10793v1,databases,cs.CR,"We present ORQ, a system that enables collaborative analysis of large private
datasets using cryptographically secure multi-party computation (MPC). ORQ
protects data against semi-honest or malicious parties and can efficiently
evaluate relational queries with multi-way joins and aggregations that have
been considered notoriously expensive under MPC. To do so, ORQ eliminates the
quadratic cost of secure joins by leveraging the fact that, in practice, the
structure of many real queries allows us to join records and apply the
aggregations ""on the fly"" while keeping the result size bounded. On the system
side, ORQ contributes generic oblivious operators, a data-parallel vectorized
query engine, a communication layer that amortizes MPC network costs, and a
dataflow API for expressing relational analytics -- all built from the ground
up.
  We evaluate ORQ in LAN and WAN deployments on a diverse set of workloads,
including complex queries with multiple joins and custom aggregations. When
compared to state-of-the-art solutions, ORQ significantly reduces MPC execution
times and can process one order of magnitude larger datasets. For our most
challenging workload, the full TPC-H benchmark, we report results entirely
under MPC with Scale Factor 10 -- a scale that had previously been achieved
only with information leakage or the use of trusted third parties.",https://github.com/CASP-Systems-BU/orq,"14 pages, plus Appendix. To appear at SOSP 2025. Code published at
  https://github.com/CASP-Systems-BU/orq"
