title,authors,published,arxiv_id,url,pdf_url,category,primary_category,abstract,code_links,comment
MemoBrain: Executive Memory as an Agentic Brain for Reasoning,"Hongjin Qian, Zhao Cao, Zheng Liu",2026-01-12,2601.08079v1,http://arxiv.org/abs/2601.08079v1,https://arxiv.org/pdf/2601.08079v1,information_retrieval,cs.AI,"Complex reasoning in tool-augmented agent frameworks is inherently long-horizon, causing reasoning traces and transient tool artifacts to accumulate and strain the bounded working context of large language models. Without explicit memory mechanisms, such accumulation disrupts logical continuity and undermines task alignment. This positions memory not as an auxiliary efficiency concern, but as a core component for sustaining coherent, goal-directed reasoning over long horizons.
  We propose MemoBrain, an executive memory model for tool-augmented agents that constructs a dependency-aware memory over reasoning steps, capturing salient intermediate states and their logical relations. Operating as a co-pilot alongside the reasoning agent, MemoBrain organizes reasoning progress without blocking execution and actively manages the working context. Specifically, it prunes invalid steps, folds completed sub-trajectories, and preserves a compact, high-salience reasoning backbone under a fixed context budget. Together, these mechanisms enable explicit cognitive control over reasoning trajectories rather than passive context accumulation.
  We evaluate MemoBrain on challenging long-horizon benchmarks, including GAIA, WebWalker, and BrowseComp-Plus, demonstrating consistent improvements over strong baselines.",https://github.com/qhjqhj00/MemoBrain,Our codes are in https://github.com/qhjqhj00/MemoBrain
AptaFind: A lightweight local interface for automated aptamer curation from scientific literature,Geoffrey Taghon,2026-01-12,2601.07684v1,http://arxiv.org/abs/2601.07684v1,https://arxiv.org/pdf/2601.07684v1,information_retrieval,cs.IR,"Aptamer researchers face a literature landscape scattered across publications, supplements, and databases, with each search consuming hours that could be spent at the bench. AptaFind transforms this navigation problem through a three-tier intelligence architecture that recognizes research mining is a spectrum, not a binary success or failure. The system delivers direct sequence extraction when possible, curated research leads when extraction fails, and exhaustive literature discovery for additional confidence. By combining local language models for semantic understanding with deterministic algorithms for reliability, AptaFind operates without cloud dependencies or subscription barriers. Validation across 300 University of Texas Aptamer Database targets demonstrates 84 % with some literature found, 84 % with curated research leads, and 79 % with a direct sequence extraction, at a laptop-compute rate of over 900 targets an hour. The platform proves that even when direct sequence extraction fails, automation can still deliver the actionable intelligence researchers need by rapidly narrowing the search to high quality references.",https://github.com/usnistgov/aptafind,"for associated source code, see https://github.com/usnistgov/aptafind"
FinCARDS: Card-Based Analyst Reranking for Financial Document Question Answering,"Yixi Zhou, Fan Zhang, Yu Chen, Haipeng Zhang, Preslav Nakov, Zhuohan Xie",2026-01-11,2601.06992v1,http://arxiv.org/abs/2601.06992v1,https://arxiv.org/pdf/2601.06992v1,information_retrieval,cs.IR,"Financial question answering (QA) over long corporate filings requires evidence to satisfy strict constraints on entities, financial metrics, fiscal periods, and numeric values. However, existing LLM-based rerankers primarily optimize semantic relevance, leading to unstable rankings and opaque decisions on long documents. We propose FinCards, a structured reranking framework that reframes financial evidence selection as constraint satisfaction under a finance-aware schema. FinCards represents filing chunks and questions using aligned schema fields (entities, metrics, periods, and numeric spans), enabling deterministic field-level matching. Evidence is selected via a multi-stage tournament reranking with stability-aware aggregation, producing auditable decision traces. Across two corporate filing QA benchmarks, FinCards substantially improves early-rank retrieval over both lexical and LLM-based reranking baselines, while reducing ranking variance, without requiring model fine-tuning or unpredictable inference budgets. Our code is available at https://github.com/XanderZhou2022/FINCARDS.",https://github.com/XanderZhou2022/FINCARDS,"15 pages, including figures and tables"
EmbeddingRWKV: State-Centric Retrieval with Reusable States,"Haowen Hou, Jie Yang",2026-01-10,2601.07861v1,http://arxiv.org/abs/2601.07861v1,https://arxiv.org/pdf/2601.07861v1,information_retrieval,cs.CL,"Current Retrieval-Augmented Generation (RAG) systems typically employ a traditional two-stage pipeline: an embedding model for initial retrieval followed by a reranker for refinement. However, this paradigm suffers from significant inefficiency due to the lack of shared information between stages, leading to substantial redundant computation. To address this limitation, we propose \textbf{State-Centric Retrieval}, a unified retrieval paradigm that utilizes ""states"" as a bridge to connect embedding models and rerankers. First, we perform state representation learning by fine-tuning an RWKV-based LLM, transforming it into \textbf{EmbeddingRWKV}, a unified model that serves as both an embedding model and a state backbone for extracting compact, reusable states. Building upon these reusable states, we further design a state-based reranker to fully leverage precomputed information. During reranking, the model processes only query tokens, decoupling inference cost from document length and yielding a 5.4$\times$--44.8$\times$ speedup. Furthermore, we observe that retaining all intermediate layer states is unnecessary; with a uniform layer selection strategy, our model maintains 98.62\% of full-model performance using only 25\% of the layers. Extensive experiments demonstrate that State-Centric Retrieval achieves high-quality retrieval and reranking results while significantly enhancing overall system efficiency. Code is available at \href{https://github.com/howard-hou/EmbeddingRWKV}{our GitHub repository}.",https://github.com/howard-hou/EmbeddingRWKV,"23 pages, 3 figures, 6 tables"
Multi-Disciplinary Dataset Discovery from Citation-Verified Literature Contexts,"Zhiyin Tan, Changxu Duan",2026-01-08,2601.05099v1,http://arxiv.org/abs/2601.05099v1,https://arxiv.org/pdf/2601.05099v1,information_retrieval,cs.DL,"Identifying suitable datasets for a research question remains challenging because existing dataset search engines rely heavily on metadata quality and keyword overlap, which often fail to capture the semantic intent of scientific investigation. We introduce a literature-driven framework that discovers datasets from citation contexts in scientific papers, enabling retrieval grounded in actual research use rather than metadata availability. Our approach combines large-scale citation-context extraction, schema-guided dataset recognition with Large Language Models, and provenance-preserving entity resolution. We evaluate the system on eight survey-derived computer science queries and find that it achieves substantially higher recall than Google Dataset Search and DataCite Commons, with normalized recall ranging from an average of 47.47% to a highest value of 81.82%. Beyond recovering gold-standard datasets, the method also surfaces additional datasets not documented in the surveys. Expert assessments across five top-level Fields of Science indicate that a substantial portion of the additional datasets are considered high utility, and some are regarded as novel for the specific topics chosen by the experts. These findings establish citation-context mining as an effective and generalizable paradigm for dataset discovery, particularly in settings where datasets lack sufficient or reliable metadata. To support reproducibility and future extensions, we release our code, evaluation datasets, and results on GitHub (https://github.com/Fireblossom/citation-context-dataset-discovery).",https://github.com/Fireblossom/citation-context-dataset-discovery,Accepted at the 25th ACM/IEEE Joint Conference on Digital Libraries (JCDL 2025)
Pervasive Annotation Errors Break Text-to-SQL Benchmarks and Leaderboards,"Tengjun Jin, Yoojin Choi, Yuxuan Zhu, Daniel Kang",2026-01-13,2601.08778v2,http://arxiv.org/abs/2601.08778v2,https://arxiv.org/pdf/2601.08778v2,databases,cs.AI,"Researchers have proposed many text-to-SQL techniques to streamline data analytics and accelerate the development of database-driven applications. To compare these techniques and select the best one for deployment, the community depends on public benchmarks and their leaderboards. Since these benchmarks heavily rely on human annotations during question construction and answer evaluation, the validity of the annotations is crucial.
  In this paper, we conduct an empirical study that (i) benchmarks annotation error rates for two widely used text-to-SQL benchmarks, BIRD and Spider 2.0-Snow, and (ii) corrects a subset of the BIRD development (Dev) set to measure the impact of annotation errors on text-to-SQL agent performance and leaderboard rankings. Through expert analysis, we show that BIRD Mini-Dev and Spider 2.0-Snow have error rates of 52.8% and 62.8%, respectively. We re-evaluate all 16 open-source agents from the BIRD leaderboard on both the original and the corrected BIRD Dev subsets. We show that performance changes range from -7% to 31% (in relative terms) and rank changes range from $-9$ to $+9$ positions. We further assess whether these impacts generalize to the full BIRD Dev set. We find that the rankings of agents on the uncorrected subset correlate strongly with those on the full Dev set (Spearman's $r_s$=0.85, $p$=3.26e-5), whereas they correlate weakly with those on the corrected subset (Spearman's $r_s$=0.32, $p$=0.23). These findings show that annotation errors can significantly distort reported performance and rankings, potentially misguiding research directions or deployment choices. Our code and data are available at https://github.com/uiuc-kang-lab/text_to_sql_benchmarks.",https://github.com/uiuc-kang-lab/text_to_sql_benchmarks,"18 pages, 14 figures, 9 tables"
VISTA: Knowledge-Driven Interpretable Vessel Trajectory Imputation via Large Language Models,"Hengyu Liu, Tianyi Li, Haoyu Wang, Kristian Torp, Tiancheng Zhang, Yushuai Li, Christian S. Jensen",2026-01-11,2601.06940v1,http://arxiv.org/abs/2601.06940v1,https://arxiv.org/pdf/2601.06940v1,databases,cs.DB,"The Automatic Identification System provides critical information for maritime navigation and safety, yet its trajectories are often incomplete due to signal loss or deliberate tampering. Existing imputation methods emphasize trajectory recovery, paying limited attention to interpretability and failing to provide underlying knowledge that benefits downstream tasks such as anomaly detection and route planning. We propose knowledge-driven interpretable vessel trajectory imputation (VISTA), the first trajectory imputation framework that offers interpretability while simultaneously providing underlying knowledge to support downstream analysis. Specifically, we first define underlying knowledge as a combination of Structured Data-derived Knowledge (SDK) distilled from AIS data and Implicit LLM Knowledge acquired from large-scale Internet corpora. Second, to manage and leverage the SDK effectively at scale, we develop a data-knowledge-data loop that employs a Structured Data-derived Knowledge Graph for SDK extraction and knowledge-driven trajectory imputation. Third, to efficiently process large-scale AIS data, we introduce a workflow management layer that coordinates the end-to-end pipeline, enabling parallel knowledge extraction and trajectory imputation with anomaly handling and redundancy elimination. Experiments on two large AIS datasets show that VISTA is capable of state-of-the-art imputation accuracy and computational efficiency, improving over state-of-the-art baselines by 5%-94% and reducing time cost by 51%-93%, while producing interpretable knowledge cues that benefit downstream tasks. The source code and implementation details of VISTA are publicly available.",https://github.com/hyLiu1994/VISTA,"22 pages, 13 figures, 3 algorithms, 5 tables. Code available at https://github.com/hyLiu1994/VISTA"
"Algorithm Support for Graph Databases, Done Right","Daan de Graaf, Robert Brijder, Soham Chakraborty, George Fletcher, Bram van de Wall, Nikolay Yakovets",2026-01-10,2601.06705v1,http://arxiv.org/abs/2601.06705v1,https://arxiv.org/pdf/2601.06705v1,databases,cs.DB,"Graph database query languages cannot express algorithms like PageRank, forcing costly data wrangling, while existing solutions such as algorithm libraries, vertex-centric APIs, and recursive CTEs lack the necessary combination of expressiveness, performance, and usability. We present GraphAlg: a domain-specific language for graph algorithms that compiles to relational algebra, enabling seamless integration with query processing pipelines. Built on linear algebra foundations, GraphAlg provides intuitive matrix operations that are amenable to aggressive optimization including sparsity analysis, loop-invariant code motion, and in-place aggregation. Our implementation in AvantGraph demonstrates significant code complexity reduction compared to SQL/Python and Pregel while achieving excellent performance on LDBC Graphalytics benchmarks. GraphAlg establishes that graph databases can serve as unified platforms for both queries and analytics.",https://github.com/wildarch/graphalg,"for GraphAlg compiler source code, see https://github.com/wildarch/graphalg"
Octopus: A Lightweight Entity-Aware System for Multi-Table Data Discovery and Cell-Level Retrieval,"Wen-Zhi Li, Sainyam Galhotra",2026-01-05,2601.02304v1,http://arxiv.org/abs/2601.02304v1,https://arxiv.org/pdf/2601.02304v1,databases,cs.DB,"Tabular data constitute a dominant form of information in modern data lakes and repositories, yet discovering the relevant tables to answer user questions remains challenging. Existing data discovery systems assume that each question can be answered by a single table and often rely on resource-intensive offline preprocessing, such as model training or large-scale content indexing. In practice, however, many questions require information spread across multiple tables -- either independently or through joins -- and users often seek specific cell values rather than entire tables. In this paper, we present Octopus, a lightweight, entity-aware, and training-free system for multi-table data discovery and cell-level value retrieval. Instead of embedding entire questions, Octopus identifies fine-grained entities (column mentions and value mentions) from natural-language queries using an LLM parser. It then matches these entities to table headers through a compact embedding index and scans table contents directly for value occurrences, eliminating the need for heavy content indexing or costly offline stages. The resulting fine-grained alignment not only improves table retrieval accuracy but also facilitates efficient downstream NL2SQL execution by reducing token usage and redundant LLM calls. To evaluate Octopus, we introduce a new benchmark covering both table- and cell-level discovery under multi-table settings, including five datasets for independent discovery and two for join-based discovery. Experimental results show that Octopus consistently outperforms existing systems while achieving substantially lower computational and token costs. Code is available at https://github.com/wenzhilics/octopus.",https://github.com/wenzhilics/octopus,
Accelerating Storage-Based Training for Graph Neural Networks,"Myung-Hwan Jang, Jeong-Min Park, Yunyong Ko, Sang-Wook Kim",2026-01-04,2601.01473v2,http://arxiv.org/abs/2601.01473v2,https://arxiv.org/pdf/2601.01473v2,databases,cs.LG,"Graph neural networks (GNNs) have achieved breakthroughs in various real-world downstream tasks due to their powerful expressiveness. As the scale of real-world graphs has been continuously growing, a storage-based approach to GNN training has been studied, which leverages external storage (e.g., NVMe SSDs) to handle such web-scale graphs on a single machine. Although such storage-based GNN training methods have shown promising potential in large-scale GNN training, we observed that they suffer from a severe bottleneck in data preparation since they overlook a critical challenge: how to handle a large number of small storage I/Os. To address the challenge, in this paper, we propose a novel storage-based GNN training framework, named AGNES, that employs a method of block-wise storage I/O processing to fully utilize the I/O bandwidth of high-performance storage devices. Moreover, to further enhance the efficiency of each storage I/O, AGNES employs a simple yet effective strategy, hyperbatch-based processing based on the characteristics of real-world graphs. Comprehensive experiments on five real-world graphs reveal that AGNES consistently outperforms four state-of-the-art methods, by up to 4.1X faster than the best competitor. Our code is available at https://github.com/Bigdasgit/agnes-kdd26.",https://github.com/Bigdasgit/agnes-kdd26,"10 pages, 12 figures, 2 tables, ACM SIGKDD International Conference on Knowledge Discovery and Data Mining (KDD) 2026"
"RadixGraph: A Fast, Space-Optimized Data Structure for Dynamic Graph Storage (Extended Version)","Haoxuan Xie, Junfeng Liu, Siqiang Luo, Kai Wang",2026-01-04,2601.01444v1,http://arxiv.org/abs/2601.01444v1,https://arxiv.org/pdf/2601.01444v1,databases,cs.DB,"Dynamic graphs model many real-world applications, and as their sizes grow, efficiently storing and updating them becomes critical. We present RadixGraph, a fast and memory-efficient data structure for dynamic graph storage. RadixGraph features a carefully designed radix-tree-based vertex index that strikes an optimal trade-off between query efficiency and space among all pointer-array-based radix trees. For edge storage, it employs a hybrid snapshot-log architecture that enables amortized $O(1)$ update time. RadixGraph supports millions of concurrent updates per second while maintaining competitive performance for graph analytics. Experimental results show that RadixGraph outperforms the most performant baseline by up to $16.27\times$ across various datasets in ingesting graph updates, and reduces memory usage by an average of $40.1\%$. RadixGraph is open-source at https://github.com/ForwardStar/RadixGraph.",https://github.com/ForwardStar/RadixGraph,Accepted by SIGMOD 2026
Exploring the Heterogeneity of Tabular Data: A Diversity-aware Data Generator via LLMs,"Yafeng Tang, Xiaoou Ding, Jianzhuo Du, Zishuo Yan, Zhuang Ma, Zheng Liang, Zekai Qian, Hongzhi Wang",2025-12-26,2512.21915v1,http://arxiv.org/abs/2512.21915v1,https://arxiv.org/pdf/2512.21915v1,databases,cs.LG,"Tabular data generation has become increasingly essential for enabling robust machine learning applications, which require large-scale, high-quality data. Existing solutions leverage generative models to learn original data distributions. However, real-world data are naturally heterogeneous with diverse distributions, making it challenging to obtain a universally good model for diverse data generation. To address this limitation, we introduce Diversity-Aware Tabular data gEnerator (DATE), a framework that (i) prepares high-quality and distributionally distinct examples for in-context learning by effectively partitioning the original heterogeneous data into multiple diverse subsets; (ii) harnesses Large Language Models (LLMs) to explore the diversity of the partitioned distribution with decision tree reasoning as feedback, generating high-quality labeled data for each subset. However, the massive generated data inherently involves a trade-off between diversity and quality. To integrate this issue, existing solutions greedily select the validation-best data. However, we prove that the selection in heterogeneous settings does not possess the greedy-choice property, and design a Multi-Arm Bandit-based sampling algorithm that balances the diversity and quality of generated data. Extensive experiments on tabular classification and regression benchmarks demonstrate that DATE consistently outperforms state-of-the-art GAN-based and LLM-based methods. On average, DATE achieves a 23.75% reduction in error rate with just 100 generated data. Empirically, we demonstrate that data generated by DATE can improve the accuracy of Direct Preference Optimization (DPO) and enhance the reasoning capability of LLMs on the target data. Code is available at https://github.com/windblow32/DATE.",https://github.com/windblow32/DATE,This manuscript has been submitted to IEEE Transactions on Knowledge and Data Engineering (TKDE) for peer review
Valori: A Deterministic Memory Substrate for AI Systems,Varshith Gudur,2025-12-25,2512.22280v1,http://arxiv.org/abs/2512.22280v1,https://arxiv.org/pdf/2512.22280v1,databases,cs.LG,"Modern AI systems rely on vector embeddings stored and searched using floating-point arithmetic. While effective for approximate similarity search, this design introduces fundamental non-determinism: identical models, inputs, and code can produce different memory states and retrieval results across hardware architectures (e.g., x86 vs. ARM). This prevents replayability and safe deployment, leading to silent data divergence that prevents post-hoc verification and compromises audit trails in regulated sectors. We present Valori, a deterministic AI memory substrate that replaces floating-point memory operations with fixed-point arithmetic (Q16.16) and models memory as a replayable state machine. Valori guarantees bit-identical memory states, snapshots, and search results across platforms. We demonstrate that non-determinism arises before indexing or retrieval and show how Valori enforces determinism at the memory boundary. Our results suggest that deterministic memory is a necessary primitive for trustworthy AI systems. The reference implementation is open-source and available at https://github.com/varshith-Git/Valori-Kernel (archived at https://zenodo.org/records/18022660).",https://github.com/varshith-Git/Valori-Kernel,"7 pages, 1 figure. systems paper with empirical evaluation and determinism validation experiments. Code available at https://github.com/varshith-Git/Valori-Kernel"
