title,authors,published,arxiv_id,url,pdf_url,category,primary_category,abstract,code_links,comment
Improving BM25 Code Retrieval Under Fixed Generic Tokenization: Adaptive q-Log Odds as a Drop-In BM25 Fix,"Santosh Kumar Radha, Oktay Goktas",2026-05-18,2605.18561v1,http://arxiv.org/abs/2605.18561v1,https://arxiv.org/pdf/2605.18561v1,information_retrieval,cs.IR,"In retrieval-augmented coding, failures often begin when the relevant file is absent from the retrieved context. Under frozen generic tokenization, where a BM25 index has been built by a search system whose analyzer the practitioner does not control, this failure is routine: BM25's logarithmic RSJ-odds IDF under-separates the identifier tail that distinguishes one function from another. We replace the outer logarithm of the Robertson-Spärck-Jones odds with a q-logarithm. At q=1 the transform recovers BM25 exactly by L'Hôpital's rule, and for q<1 it is a Box-Cox transform of the RSJ odds with lambda = 1-q. On CoIR CodeSearchNet Go (182K documents), oracle-tuned NDCG@10 rises from 0.2575 to 0.4874 (absolute +0.2299; +89.3% relative; zero sign reversals in 10,000 paired-bootstrap resamples, reported as p <= 10^-4). The effect is graded across code languages and is near-zero on BEIR text. A one-parameter closed form estimates a corpus-level q from hapax density and stays near q=1 on corpora where BM25 is already optimal. The index-time cost is a single pass over the sparse score matrix and query latency is unchanged. A tokenizer ablation shows that identifier-aware tokenization largely removes the incremental gain from q-IDF.",https://github.com/santoshkumarradha/rarecode,"19 pages, 12 figures. Code and artifacts: https://github.com/santoshkumarradha/rarecode"
From Volume to Value: Preference-Aligned Memory Construction for On-Device RAG,"Changmin Lee, Jaemin Kim, Taesik Gong",2026-05-18,2605.18271v1,http://arxiv.org/abs/2605.18271v1,https://arxiv.org/pdf/2605.18271v1,information_retrieval,cs.CL,"With the rapid emergence of personal AI agents based on Large Language Models (LLMs), implementing them on-device has become essential for privacy and responsiveness. To handle the inherently personal and context-dependent nature of real-world requests, such agents must ground their generation in device-resident personal context. However, under tight memory budgets, the core bottleneck is what to store so that retrieval remains aligned with the user. We propose EPIC (Efficient Preference-aligned Index Construction), which focuses on user preferences as a compact and stable form of personal context and integrates them throughout the RAG pipeline. EPIC selectively retains preference-relevant information from raw data and aligns retrieval toward preference-aligned contexts. Across four benchmarks covering conversations, debates, explanations, and recommendations, EPIC reduces indexing memory by 2,404 times, improves preference-following accuracy by 20.17 percentage points, and achieves 33.33 times lower retrieval latency over the best-performing baseline. In our on-device experiment, EPIC maintains a memory footprint under 1 MB with 29.35 ms/query latency in streaming updates.",https://github.com/UbiquitousAILab/EPIC,Accepted to ICML 2026. Code and data are available at https://github.com/UbiquitousAILab/EPIC
SomaliWeb v1: A Quality-Filtered Somali Web Corpus with a Matched Tokenizer and a Public Language-Identification Benchmark,Khalid Yusuf Dahir,2026-05-18,2605.18232v1,http://arxiv.org/abs/2605.18232v1,https://arxiv.org/pdf/2605.18232v1,information_retrieval,cs.CL,"Somali is a Cushitic language of the Horn of Africa with ~25 million speakers, yet no documented dedicated Somali pretraining corpus with a companion tokenizer and language-identification benchmark has been publicly released. Existing Somali text appears either inside multilingual distributions (HPLT v2, CC100, MADLAD-400, OSCAR, mC4) or in small, undocumented Somali-only uploads on Hugging Face. We introduce SomaliWeb v1, a quality-filtered Somali corpus of 819,322 documents (~303M tokens) built from three upstream sources (HPLT v2, CC100, Somali Wikipedia) through a six-stage reproducible pipeline. We release (i) the corpus, (ii) a matched BPE-16K tokenizer, and (iii) the first public side-by-side Somali benchmark of three production language identifiers. Our measurements reveal concrete quality defects in existing distributions: HPLT v2's ""cleaned"" Somali release retains 17.3% byte-exact duplicates, 56.1% of its documents contain fixable mojibake, and 10.7% of its byte-unique documents are near-duplicates at Jaccard tau=0.80. Our BPE-16K tokenizer emits 40.2% fewer tokens than GPT-4's cl100k_base on FLORES-200 Somali devtest as a tokenizer-level measurement; downstream language-model perplexity comparisons are deferred to a follow-up release.",https://github.com/khaledyusuf44/somali-corpus,"16 pages, 6 figures, 6 tables. Code: https://github.com/khaledyusuf44/somali-corpus Dataset: https://huggingface.co/datasets/khaledyusuf44/somaliweb-v1"
Modality-Aware Identity Construction and Counterfactual Structure Learning for ID-Free Multimodal Recommendation,"Hongjian Ma, Wenxin Huang, Yan Zhang, Zhifei Li, Zheng Wang",2026-05-18,2605.18044v1,http://arxiv.org/abs/2605.18044v1,https://arxiv.org/pdf/2605.18044v1,information_retrieval,cs.IR,"Multimodal recommendation has attracted extensive attention by leveraging heterogeneous modality information to alleviate data sparsity and improve recommendation accuracy. Existing methods have attempted to replace ID embeddings with multimodal features and have achieved promising preliminary results. However, these methods still exhibit the following two limitations: (1) the reconstructed ID representations remain relatively static and fail to fully exploit multimodal semantics; and (2) the graph learning process is insufficient in mining latent long-tail semantic relations and is easily affected by popularity bias. To address these issues, we propose a novel method named Modality-Aware Identity Construction and Counterfactual Structure Learning for ID-free Multimodal Recommendation (MAIL). Specifically, we design a modality-aware identity construction module that dynamically modulates positional encodings with multimodal semantics to construct content-aware ID-free identity representations. Then, we propose a counterfactual structure learning paradigm that mines low-exposure semantic neighbors via popularity penalization and alleviates popularity bias. Extensive experiments are conducted on five public Amazon datasets. Experimental results show that MAIL achieves average improvements of 7.81% in Recall@10 and 12.81% in NDCG@10 compared with the baseline models. Our code is available at https://github.com/HubuKG/MAIL.",https://github.com/HubuKG/MAIL,"11 pages, 5 figures, submitted to IEEE Transactions on Multimedia"
DADF: A Distribution-Aware Debiasing Framework for Watch-Time Regression in Recommender Systems,"Yiqing Yang, Xinlong Zhao, Zhao Liu, Xiao Lv, Ruiming Tang, Han Li, Kun Gai",2026-05-18,2605.17863v1,http://arxiv.org/abs/2605.17863v1,https://arxiv.org/pdf/2605.17863v1,information_retrieval,cs.IR,"Watch-time prediction is a central regression task in short-video recommender systems, where labels are highly long-tailed and residual errors vary systematically across observed watch-time regions. In practice, a model may appear globally calibrated while still overestimating short views and underestimating long views, because opposite errors cancel out in aggregate. Existing methods mainly improve the first-stage watch-time predictor, but often leave such residual distributional bias insufficiently corrected. We propose DADF, a distribution-aware debiasing framework for watch-time regression. Instead of replacing a deployed predictor, DADF performs second-stage multiplicative residual correction on top of it. DADF combines three complementary designs: a dynamic distribution-aware transformation for stabilizing long-tailed correction targets, a debias-factor-aware module for modeling heterogeneous residual patterns using inference-time observable factors, especially video duration, and a multi-label-aware module that exploits auxiliary prediction signals from engagement heads. We evaluate DADF on public short-video benchmarks and a large-scale industrial ranking system. DADF consistently improves both pointwise accuracy and ranking quality across datasets and backbones. In the industrial setting, it achieves a 1.88 percentage-point WUAUC gain over the production baseline, reduces MAE by 12.57%, and yields a statistically significant 0.347% lift in average time spent per device in online A/B testing. These results demonstrate that DADF effectively mitigates local calibration bias and provides a practical plug-in solution for debiasing long-tailed continuous targets. The source code is available at https://github.com/liuzhao09/DADF.",https://github.com/liuzhao09/DADF,"12 pages, 7 figures, 3 tables"
MARQUIS: A Three-Stage Pipeline for Video Retrieval-Augmented Generation,"Debashish Chakraborty, Dengjia Zhang, Jialiang Jin, Hanting Liu, Katherine Guerrerio, Hanxiang Qin, Tyler Skow, Alexander Martin, Reno Kriz, Benjamin Van Durme",2026-05-17,2605.17640v1,http://arxiv.org/abs/2605.17640v1,https://arxiv.org/pdf/2605.17640v1,information_retrieval,cs.IR,"Retrieval-augmented generation from videos requires systems to retrieve relevant audiovisual evidence from large corpora and synthesize it into coherent, attributed text. Current approaches struggle at both ends: retrieval methods fail on complex, multi-faceted queries that cannot be captured by a single embedding, while generation methods lack the high-level reasoning needed to synthesize across multiple videos and face memory constraints over long, multi-video contexts. We present MARQUIS: a three-stage pipeline that addresses these limitations through (1) query expansion, fusion, and reranking, (2) calibrated structured evidence extraction, and (3) article generation from extracted evidence, optionally controlled by an RLM. On the MAGMaR2026 shared task, we improve retrieval performance from 0.195 to 0.759 (nDCG@10). For article generation, ITER-QA-BASE improves average human score from 3.09 to 3.83 over the CAG baseline, while MARQUIS-RLM achieves a human score of 3.30 and the strongest citation recall among non-QA systems.",https://github.com/debashishc/marquis,"Accepted as an oral presentation at the ACL 2026 Workshop MAGMaR Systems. 27 pages, 4 figures. Code can be found here: https://github.com/debashishc/marquis"
Beyond Catalogue Counts: the Dataset Visibility Asymmetry in Low-Resource Multilingual NLP,"Zhiyin Tan, Changxu Duan",2026-05-17,2605.17442v1,http://arxiv.org/abs/2605.17442v1,https://arxiv.org/pdf/2605.17442v1,information_retrieval,cs.CL,"Multilingual NLP often relies on dataset counts from centralized catalogues to characterize which languages are resource-rich or resource-poor. However, these catalogues record only one layer of dataset visibility: what has been registered or institutionally distributed. They do not necessarily reflect which datasets are created, cited, or reused in the research literature. To examine this gap, we combine a catalogue-based baseline with literature-backed evidence of dataset circulation. We introduce the Resource Density Index (RDI), defined as the number of catalogued datasets per one million speakers, and compute it for the 200 most widely spoken languages in Ethnologue. Among them, 118 languages (59%) have an average RDI of zero across the LRE Map and the Linguistic Data Consortium (LDC), and another 23 fall below 0.1, corresponding to at most one catalogued dataset per ten million speakers. We then apply an LLM-assisted citation-mining pipeline over the Semantic Scholar corpus to these 141 low-visibility languages. After manual validation and consolidation, we identify 609 unique datasets across 53 languages, of which 356 remain openly accessible through working public links. These results reveal a substantial visibility gap: many large-speaker languages appear data-poor in catalogue records yet show clear evidence of dataset activity in the research literature. Our findings suggest that multilingual data scarcity should be understood not only as a production problem, but also as a question of documentation, discoverability, and long-term accessibility. Code and data are publicly available at (https://github.com/zhiyintan/dataset-visibility-asymmetry).",https://github.com/zhiyintan/dataset-visibility-asymmetry,Accepted at the 15th edition of the Language Resources and Evaluation Conference (LREC 2026)
IVF-TQ: Streaming-Robust Approximate Nearest Neighbor Search via a Codebook-Free Residual Layer,Tarun Sharma,2026-05-17,2605.17415v1,http://arxiv.org/abs/2605.17415v1,https://arxiv.org/pdf/2605.17415v1,information_retrieval,cs.LG,"We propose IVF-TQ, an IVF index with a codebook-free residual layer: a fixed random rotation followed by precomputed Lloyd-Max scalar quantization depending only on (b, d). Only the IVF coarse partition is trained. Building on TurboQuant (Zandieh et al., 2025), the design substantially reduces a key failure mode of trained-codebook ANN indexes (PQ, OPQ, ScaNN): staleness under streaming ingestion.Empirical (3 seeds): Per-batch PQ retraining does not recover the streaming gap at any tested bit budget (paired-t p > 0.28 everywhere). On streaming Deep-10M, IVF-TQ holds at 87.4% -> 86.6% (Delta = -0.80 +/- 0.10pp) while IVF-PQ degrades -3.23pp. A shuffled-i.i.d. control on SIFT-1M shows IVF-PQ losing -3.9pp without distribution shift. At higher PQ bit budgets (~1.5x IVF-TQ memory), absolute recall favors PQ as expected from rate-distortion (+6.1pp Deep-10M; +2.0pp SIFT-10M); the durable IVF-TQ benefit is operational (no codebook to retrain), robust across memory regimes.Prior art: IVF around a codebook-free residual quantizer is architecturally not new -- IVF-RaBitQ ships in Milvus, cuVS, LanceDB, Weaviate; Shi et al. (2026) is concurrent GPU work. TurboQuant itself tests only flat-rotation ANN.Contributions: (i) A multi-seed streaming-operational story for codebook-free IVF: 10M-scale evidence across PQ memory budgets. (ii) A uniform-over-sphere IP-error bound for the TQ residual quantizer with one fixed rotation (proof sketch in v1; rigorous in v2). (iii) Adaptive IVF-TQ: a partition-only refresh recovering 67% -> 97.8% under worst-case rotation shift with re-ranking (90.3% without).Code, data: https://github.com/tarun-ks/turboquant_search",https://github.com/tarun-ks/turboquant_search,
Dual-Diffusional Generative Fashion Recommendation,"Mingzhe Yu, Lei Wu, Qianru Sun, Yunshan Ma",2026-05-17,2605.17357v1,http://arxiv.org/abs/2605.17357v1,https://arxiv.org/pdf/2605.17357v1,information_retrieval,cs.IR,"Personalized generative recommender systems have emerged as a promising solution for fashion recommendation. However, existing methods primarily rely on implicit visual embeddings from historical interactions, which often contain preference-irrelevant information and result in insufficient user behavior modeling. Moreover, these models typically generate only item images, providing limited interpretability. To address these limitations, we propose DualFashion, a Dual-Diffusional Generative Fashion Recommendation Architecture that jointly models image and text modalities for personalized and explainable recommendation. DualFashion adopts a dual-diffusion Transformer with image and text branches, where structured attribute-level captions and visual outfit information are jointly used as conditioning signals to model user behavior. The proposed architecture produces both fashion item images and textual descriptions, ensuring visual compatibility while providing explicit semantic interpretability. Furthermore, we introduce a text-augmented fine-tuning strategy that enhances generation diversity and enables effective cross-modal knowledge transfer without incurring heavy computational costs. Extensive experiments on iFashion and Polyvore-U across Personalized Fill-in-the-Blank and Generative Outfit Recommendation tasks demonstrate that DualFashion achieves strong performance in behavior modeling, interpretability, and efficiency compared to state-of-the-art methods. Our code and model checkpoints are available at https://github.com/LinkMingzhe/DualFashion.",https://github.com/LinkMingzhe/DualFashion,Accepted by SIGIR'26
RAGR: Review-Augmented Generative Recommendation,"Yingyi Zhang, Junyi Li, Yejing Wang, Wenlin Zhang, Xiaowei Qian, Sheng Zhang, Yue Feng, Yichao Wang, Yong Liu, Xiangyu Zhao, Xianneng Li",2026-05-17,2605.17267v1,http://arxiv.org/abs/2605.17267v1,https://arxiv.org/pdf/2605.17267v1,information_retrieval,cs.IR,"Sequential recommendation (SR) is traditionally formulated as next-item prediction over a chronological sequence of interacted items. Although recent generative recommendation (GR) methods introduce new machinery, such as semantic IDs, autoregressive decoding, and unified token spaces, they largely inherit the same item-only modeling assumption. We argue that this design constitutes a structural bottleneck, because user decision-making is not purely behavioral: while item interactions reveal what users choose, review feedback often explain why they choose it by exposing latent evaluative factors.
  Motivated by this observation, we propose Review-Augmented Generative Recommendation (RAGR), a novel GR framework that incorporates review feedback directly into the generative user sequence rather than treating reviews as auxiliary side information. Specifically, RAGR introduces a Review-Augmented User Sequence Modeling mechanism that interleaves item semantic IDs and review semantic IDs in chronological order to construct a mixed behavioral-semantic sequence, enabling review signals to participate directly in autoregressive next-token generation. To preserve the recommendation objective, we further introduce an Item-Centric Task Generation Alignment strategy based on direct preference optimization (DPO), which encourages the model to favor item tokens over review tokens at prediction positions. Experiments on three real-world datasets show that RAGR yields consistent and significant gains over strong GR backbones across all metrics. Our code and data are available at \url{https://github.com/Zhang-Yingyi/TKDE_RAGR}.",https://github.com/Zhang-Yingyi/TKDE_RAGR,
paper.json: A Coordination Convention for LLM-Agent-Actionable Papers,Arquimedes Canedo,2026-05-15,2605.16194v1,http://arxiv.org/abs/2605.16194v1,https://arxiv.org/pdf/2605.16194v1,information_retrieval,cs.DL,"LLM agents routinely serve as first (and sometimes only) readers of academic papers, skimming for sub-claims, extracting reproducibility steps, and generalizing scope. Standard prose papers produce recurring failures in this role: sub-claims that cannot be cited at sub-paper granularity, scope overextension beyond what the paper tests, and figure commands buried in codebases rather than the paper itself. We propose `paper.json`, a companion JSON file that travels with the PDF and addresses each failure with a lightweight convention: stable claim IDs (C1), an explicit does-not-claim list (C2), exact per-figure shell commands (C3), and stable definition IDs (C5). A fifth convention (C4) holds that minimum viable compliance, hand-written JSON alongside the PDF, is achievable in under an hour for a finished paper without touching the human-readable output. C1, C2, C3, and C5 are open invitations: an agent that reads a compliant paper and acts on it produces evidence for or against them. This paper is itself compliant: `uv run validator.py paper.json --against paper.typ` passes. Repo: https://github.com/arquicanedo/paper-json",https://github.com/arquicanedo/paper-json,
"Croissant Baker: Metadata Generation for Discoverable, Governable, and Reusable ML Datasets","Rafi Al Attrach, Rajna Fani, Sebastian Lobentanzer, Joan Giner-Miguelez, Debanshu Das, Varuni H. K., Nobin Sarwar, Rajat Ghosh, Anwai Archit, Surbhi Motghare, Christina Conrad Parry, Luis Oala, Lara Grosso, Joaquin Vanschoren, Steffen Vogler, Sujata Goswami, Eric S. Rosenthal, Marzyeh Ghassemi, Matthew McDermott, Tom Pollard",2026-05-14,2605.15079v1,http://arxiv.org/abs/2605.15079v1,https://arxiv.org/pdf/2605.15079v1,information_retrieval,cs.LG,"Croissant has emerged as the metadata standard for machine learning datasets, providing a structured, JSON-LD-based format that makes dataset discovery, automated ingestion, and reproducible analysis machine-checkable across ML platforms. Adoption has accelerated, and NeurIPS now requires Croissant metadata in every submission to its dataset tracks. Yet in practice Croissant generation usually starts with uploading data to a public platform, a path infeasible for governed and large local repositories that hold much of the high-value data ML increasingly relies on. We release Croissant Baker, a local-first, open-source command-line tool that generates validated Croissant metadata directly from a dataset directory through a modular handler registry. We evaluate Croissant Baker on over 140 datasets, scaling to MIMIC-IV at 886 million rows and 374 Parquet files. On held-out comparisons against producer-authored or standards-derived ground truth, Croissant Baker reaches 97-100% agreement across multiple domains.",https://github.com/MIT-LCP/croissant-baker,"23 pages, 5 figures, 11 tables. Project: https://lcp.mit.edu/croissant-baker/ Code: https://github.com/MIT-LCP/croissant-baker"
Towards Self-Evolving Agentic Literature Retrieval,"Yuwen Du, Tian Jin, Jing Kang, Xianghe Pang, Jingyi Chai, Tingjia Miao, Fenyi Liu, WenHao Wang, Sikai Yao, Yuzhi Zhang, Siheng Chen",2026-05-14,2605.14306v1,http://arxiv.org/abs/2605.14306v1,https://arxiv.org/pdf/2605.14306v1,information_retrieval,cs.IR,"As large language models reshape scientific research, literature retrieval faces a twofold challenge: ensuring source authenticity while maintaining a deep comprehension of academic search intents. While reliable, traditional keyword-centric search fails to capture complex research intents. Frontier LLMs can handle complex research intents, but their high cost and tendency to hallucinate remain key limitations. Here we introduce PaSaMaster, a self-evolving agentic literature retrieval system that produces relevance-scored paper rankings with evidence-grounded recommendations through iterative intent analysis, retrieval, and ranking. It is built on three key designs. First, it transforms literature retrieval from a one shot query--document matching problem into a search process that evolves over time, using ranked evidence to reveal gaps, refine intents, and guide follow-up searches. Second, it prevents hallucinated sources by treating retrieval as intent--paper relevance ranking rather than generation. Finally, PaSaMaster improves cost efficiency by separating planning from retrieval: a frontier LLM is used only for intent understanding, while large scale retrieval and relevance scoring are delegated to customized corpora and lightweight models. Evaluated on the PaSaMaster Benchmark across 38 scientific disciplines, our system exposes the severe inaccuracy and incompleteness of traditional keyword retrieval (improving F1-score by 15.6X) and the unreliability of generative LLMs (which exhibit hallucination rates up to 37.79%). Remarkably, PaSaMaster outperforms GPT-5.2 by 30.0% at a mere 1% of the computational cost while ensuring zero source hallucination: https://github.com/sjtu-sai-agents/PaSaMaster",https://github.com/sjtu-sai-agents/PaSaMaster,
