title,authors,published,arxiv_id,url,pdf_url,category,primary_category,abstract,code_links,comment
Confidence and Stability of Global and Pairwise Scores in NLP Evaluation,"Georgii Levtsov, Dmitry Ustalov",2025-07-02,2507.01633v1,http://arxiv.org/abs/2507.01633v1,http://arxiv.org/pdf/2507.01633v1,information_retrieval,cs.CL,"With the advent of highly capable instruction-tuned neural language models,
benchmarking in natural language processing (NLP) is increasingly shifting
towards pairwise comparison leaderboards, such as LMSYS Arena, from traditional
global pointwise scores (e.g., GLUE, BIG-bench, SWE-bench). This paper
empirically investigates the strengths and weaknesses of both global scores and
pairwise comparisons to aid decision-making in selecting appropriate model
evaluation strategies. Through computational experiments on synthetic and
real-world datasets using standard global metrics and the popular Bradley-Terry
model for pairwise comparisons, we found that while global scores provide more
reliable overall rankings, they can underestimate strong models with rare,
significant errors or low confidence. Conversely, pairwise comparisons are
particularly effective for identifying strong contenders among models with
lower global scores, especially where quality metrics are hard to define (e.g.,
text generation), though they require more comparisons to converge if ties are
frequent. Our code and data are available at
https://github.com/HSPyroblast/srw-ranking under a permissive license.",https://github.com/HSPyroblast/srw-ranking,"8 pages, accepted at ACL SRW 2025"
PDFMathTranslate: Scientific Document Translation Preserving Layouts,"Rongxin Ouyang, Chang Chu, Zhikuang Xin, Xiangyao Ma",2025-07-02,2507.03009v2,http://arxiv.org/abs/2507.03009v2,http://arxiv.org/pdf/2507.03009v2,information_retrieval,cs.CL,"Language barriers in scientific documents hinder the diffusion and
development of science and technologies. However, prior efforts in translating
such documents largely overlooked the information in layouts. To bridge the
gap, we introduce PDFMathTranslate, the world's first open-source software for
translating scientific documents while preserving layouts. Leveraging the most
recent advances in large language models and precise layout detection, we
contribute to the community with key improvements in precision, flexibility,
and efficiency. The work has been open-sourced at
https://github.com/byaidu/pdfmathtranslate with more than 222k downloads.",https://github.com/byaidu/pdfmathtranslate,"7 pages, 4 figures"
Uncertainty-Aware Complex Scientific Table Data Extraction,"Kehinde Ajayi, Yi He, Jian Wu",2025-07-02,2507.02009v2,http://arxiv.org/abs/2507.02009v2,http://arxiv.org/pdf/2507.02009v2,information_retrieval,cs.IR,"Table structure recognition (TSR) and optical character recognition (OCR)
play crucial roles in extracting structured data from tables in scientific
documents. However, existing extraction frameworks built on top of TSR and OCR
methods often fail to quantify the uncertainties of extracted results. To
obtain highly accurate data for scientific domains, all extracted data must be
manually verified, which can be time-consuming and labor-intensive. We propose
a framework that performs uncertainty-aware data extraction for complex
scientific tables, built on conformal prediction, a model-agnostic method for
uncertainty quantification (UQ). We explored various uncertainty scoring
methods to aggregate the uncertainties introduced by TSR and OCR. We rigorously
evaluated the framework using a standard benchmark and an in-house dataset
consisting of complex scientific tables in six scientific domains. The results
demonstrate the effectiveness of using UQ for extraction error detection, and
by manually verifying only 47% of extraction results, the data quality can be
improved by 30%. Our work quantitatively demonstrates the role of UQ with the
potential of improving the efficiency in the human-machine cooperation process
to obtain scientifically usable data from complex tables in scientific
documents. All code and data are available on GitHub at
https://github.com/lamps-lab/TSR-OCR-UQ/tree/main.",https://github.com/lamps-lab/TSR-OCR-UQ,
Why Multi-Interest Fairness Matters: Hypergraph Contrastive Multi-Interest Learning for Fair Conversational Recommender System,"Yongsen Zheng, Zongxuan Xie, Guohua Wang, Ziyao Liu, Liang Lin, Kwok-Yan Lam",2025-07-01,2507.02000v1,http://arxiv.org/abs/2507.02000v1,http://arxiv.org/pdf/2507.02000v1,information_retrieval,cs.IR,"Unfairness is a well-known challenge in Recommender Systems (RSs), often
resulting in biased outcomes that disadvantage users or items based on
attributes such as gender, race, age, or popularity. Although some approaches
have started to improve fairness recommendation in offline or static contexts,
the issue of unfairness often exacerbates over time, leading to significant
problems like the Matthew effect, filter bubbles, and echo chambers. To address
these challenges, we proposed a novel framework, Hypergraph Contrastive
Multi-Interest Learning for Fair Conversational Recommender System (HyFairCRS),
aiming to promote multi-interest diversity fairness in dynamic and interactive
Conversational Recommender Systems (CRSs). HyFairCRS first captures a wide
range of user interests by establishing diverse hypergraphs through contrastive
learning. These interests are then utilized in conversations to generate
informative responses and ensure fair item predictions within the dynamic
user-system feedback loop. Experiments on two CRS-based datasets show that
HyFairCRS achieves a new state-of-the-art performance while effectively
alleviating unfairness. Our code is available at
https://github.com/zysensmile/HyFairCRS.",https://github.com/zysensmile/HyFairCRS,
Schema-R1: A reasoning training approach for schema linking in Text-to-SQL Task,"Wuzhenghong Wen, Su Pan, yuwei Sun",2025-06-13,2506.11986v1,http://arxiv.org/abs/2506.11986v1,http://arxiv.org/pdf/2506.11986v1,databases,cs.AI,"Schema linking is a critical step in Text-to-SQL task, aiming to accurately
predict the table names and column names required for the SQL query based on
the given question. However, current fine-tuning approaches for schema linking
models employ a rote-learning paradigm, excessively optimizing for ground truth
schema linking outcomes while compromising reasoning ability. This limitation
arises because of the difficulty in acquiring a high-quality reasoning sample
for downstream tasks. To address this, we propose Schema-R1, a reasoning schema
linking model trained using reinforcement learning. Specifically, Schema-R1
consists of three key steps: constructing small batches of high-quality
reasoning samples, supervised fine-tuning for cold-start initialization, and
rule-based reinforcement learning training. The final results demonstrate that
our method effectively enhances the reasoning ability of the schema linking
model, achieving a 10\% improvement in filter accuracy compared to the existing
method. Our code is available at https://github.com/hongWin/Schema-R1/.",https://github.com/hongWin/Schema-R1,"11 pages, 3 figures, conference"
