title,authors,published,arxiv_id,url,pdf_url,category,primary_category,abstract,code_links,comment
EMR-AGENT: Automating Cohort and Feature Extraction from EMR Databases,"Kwanhyung Lee, Sungsoo Hong, Joonhyung Park, Jeonghyeop Lim, Juhwan Choi, Donghwee Yoon, Eunho Yang",2025-10-01,2510.00549v2,http://arxiv.org/abs/2510.00549v2,http://arxiv.org/pdf/2510.00549v2,databases,cs.DB,"Machine learning models for clinical prediction rely on structured data
extracted from Electronic Medical Records (EMRs), yet this process remains
dominated by hardcoded, database-specific pipelines for cohort definition,
feature selection, and code mapping. These manual efforts limit scalability,
reproducibility, and cross-institutional generalization. To address this, we
introduce EMR-AGENT (Automated Generalized Extraction and Navigation Tool), an
agent-based framework that replaces manual rule writing with dynamic, language
model-driven interaction to extract and standardize structured clinical data.
Our framework automates cohort selection, feature extraction, and code mapping
through interactive querying of databases. Our modular agents iteratively
observe query results and reason over schema and documentation, using SQL not
just for data retrieval but also as a tool for database observation and
decision making. This eliminates the need for hand-crafted, schema-specific
logic. To enable rigorous evaluation, we develop a benchmarking codebase for
three EMR databases (MIMIC-III, eICU, SICdb), including both seen and unseen
schema settings. Our results demonstrate strong performance and generalization
across these databases, highlighting the feasibility of automating a process
previously thought to require expert-driven design. The code will be released
publicly at https://github.com/AITRICS/EMR-AGENT/tree/main. For a
demonstration, please visit our anonymous demo page:
https://anonymoususer-max600.github.io/EMR_AGENT/",https://github.com/AITRICS/EMR-AGENT,currently under submission to ICLR 2026
Graph2Region: Efficient Graph Similarity Learning with Structure and Scale Restoration,"Zhouyang Liu, Yixin Chen, Ning Liu, Jiezhong He, Dongsheng Li",2025-10-01,2510.00394v1,http://arxiv.org/abs/2510.00394v1,http://arxiv.org/pdf/2510.00394v1,databases,cs.LG,"Graph similarity is critical in graph-related tasks such as graph retrieval,
where metrics like maximum common subgraph (MCS) and graph edit distance (GED)
are commonly used. However, exact computations of these metrics are known to be
NP-Hard. Recent neural network-based approaches approximate the similarity
score in embedding spaces to alleviate the computational burden, but they
either involve expensive pairwise node comparisons or fail to effectively
utilize structural and scale information of graphs. To tackle these issues, we
propose a novel geometric-based graph embedding method called Graph2Region
(G2R). G2R represents nodes as closed regions and recovers their adjacency
patterns within graphs in the embedding space. By incorporating the node
features and adjacency patterns of graphs, G2R summarizes graph regions, i.e.,
graph embeddings, where the shape captures the underlying graph structures and
the volume reflects the graph size. Consequently, the overlap between graph
regions can serve as an approximation of MCS, signifying similar node regions
and adjacency patterns. We further analyze the relationship between MCS and GED
and propose using disjoint parts as a proxy for GED similarity. This analysis
enables concurrent computation of MCS and GED, incorporating local and global
structural information. Experimental evaluation highlights G2R's competitive
performance in graph similarity computation. It achieves up to a 60.0\%
relative accuracy improvement over state-of-the-art methods in MCS similarity
learning, while maintaining efficiency in both training and inference.
Moreover, G2R showcases remarkable capability in predicting both MCS and GED
similarities simultaneously, providing a holistic assessment of graph
similarity. Code available at https://github.com/liuzhouyang/Graph2Region.",https://github.com/liuzhouyang/Graph2Region,Accepted by IEEE Transactions on Knowledge and Data Engineering
"ActorDB: A Unified Database Model Integrating Single-Writer Actors, Incremental View Maintenance, and Zero-Trust Messaging",Jun Kawasaki,2025-09-29,2509.25285v1,http://arxiv.org/abs/2509.25285v1,http://arxiv.org/pdf/2509.25285v1,databases,cs.DB,"This paper presents ActorDB ( Dekigoto ) , a novel database architecture that
tightly integrates a single-writer actor model for writes, Incremental View
Maintenance (IVM), and a zero-trust security model as a core component. The
primary contribution of this work is the unification of these powerful but
complex concepts into a single, cohesive system designed to reduce
architectural complexity for developers of modern, data-intensive applications.
We argue that by providing these capabilities out-of-the-box, ActorDB can offer
a more robust, secure, and developer-friendly platform compared to solutions
that require manual integration of separate systems for actor persistence,
stream processing, and security. We present the core architecture, discuss the
critical trade-offs in its design, and define the performance criteria for a
Minimum Viable Product (MVP) to validate our approach.",https://github.com/com-junkawasaki/dekigoto,"7 pages, 1 table, 1 figures. Code and data available at
  https://github.com/com-junkawasaki/dekigoto"
Multilingual Text-to-SQL: Benchmarking the Limits of Language Models with Collaborative Language Agents,"Khanh Trinh Pham, Thu Huong Nguyen, Jun Jo, Quoc Viet Hung Nguyen, Thanh Tam Nguyen",2025-09-29,2509.24405v1,http://arxiv.org/abs/2509.24405v1,http://arxiv.org/pdf/2509.24405v1,databases,cs.CL,"Text-to-SQL enables natural access to databases, yet most benchmarks are
English-only, limiting multilingual progress. We introduce MultiSpider 2.0,
extending Spider 2.0 to eight languages (English, German, French, Spanish,
Portuguese, Japanese, Chinese, Vietnamese). It preserves Spider 2.0's
structural difficulty while adding linguistic and dialectal variability,
demanding deeper reasoning for complex SQL. On this benchmark, state-of-the-art
LLMs (such as DeepSeek-R1 and OpenAI o1) reach only 4\% execution accuracy when
relying on intrinsic reasoning, versus 60\% on MultiSpider 1.0. Therefore, we
provide a collaboration-driven language agents baseline that iteratively
refines queries, improving accuracy to 15\%. These results reveal a substantial
multilingual gap and motivate methods that are robust across languages and
ready for real-world enterprise deployment. Our benchmark is available at
https://github.com/phkhanhtrinh23/Multilingual_Text_to_SQL.",https://github.com/phkhanhtrinh23/Multilingual_Text_to_SQL,
PARROT: A Benchmark for Evaluating LLMs in Cross-System SQL Translation,"Wei Zhou, Guoliang Li, Haoyu Wang, Yuxing Han, Xufei Wu, Fan Wu, Xuanhe Zhou",2025-09-27,2509.23338v1,http://arxiv.org/abs/2509.23338v1,http://arxiv.org/pdf/2509.23338v1,databases,cs.DB,"Large language models (LLMS) have shown increasing effectiveness in
Text-to-SQL tasks. However, another closely related problem, Cross-System SQL
Translation (a.k.a., SQL-to-SQL), which adapts a query written for one database
system (e.g., MySQL) into its equivalent one for another system (e.g.,
ClickHouse), is of great practical importance but remains underexplored.
Existing SQL benchmarks are not well-suited for SQL-to-SQL evaluation, which
(1) focus on a limited set of database systems (often just SQLite) and (2)
cannot capture many system-specific SQL dialects (e.g., customized functions,
data types, and syntax rules). Thus, in this paper, we introduce PARROT, a
Practical And Realistic BenchmaRk for CrOss-System SQL Translation. PARROT
comprises 598 translation pairs from 38 open-source benchmarks and real-world
business services, specifically prepared to challenge system-specific SQL
understanding (e.g., LLMS achieve lower than 38.53% accuracy on average). We
also provide multiple benchmark variants, including PARROT-Diverse with 28,003
translations (for extensive syntax testing) and PARROT-Simple with 5,306
representative samples (for focused stress testing), covering 22
production-grade database systems. To promote future research, we release a
public leaderboard and source code at: https://code4db.github.io/parrot-bench/.",https://github.com/weAIDB/PARROT,"To appear in NeurIPS 2025. Welcome your submission to challenge our
  leaderboard at: https://code4db.github.io/parrot-bench/. Also visit our code
  repository at: https://github.com/weAIDB/PARROT"
AutoPK: Leveraging LLMs and a Hybrid Similarity Metric for Advanced Retrieval of Pharmacokinetic Data from Complex Tables and Documents,"Hossein Sholehrasa, Amirhossein Ghanaatian, Doina Caragea, Lisa A. Tell, Jim E. Riviere, Majid Jaberi-Douraki",2025-09-26,2510.00039v1,http://arxiv.org/abs/2510.00039v1,http://arxiv.org/pdf/2510.00039v1,databases,cs.DB,"Pharmacokinetics (PK) plays a critical role in drug development and
regulatory decision-making for human and veterinary medicine, directly
affecting public health through drug safety and efficacy assessments. However,
PK data are often embedded in complex, heterogeneous tables with variable
structures and inconsistent terminologies, posing significant challenges for
automated PK data retrieval and standardization. AutoPK, a novel two-stage
framework for accurate and scalable extraction of PK data from complex
scientific tables. In the first stage, AutoPK identifies and extracts PK
parameter variants using large language models (LLMs), a hybrid similarity
metric, and LLM-based validation. The second stage filters relevant rows,
converts the table into a key-value text format, and uses an LLM to reconstruct
a standardized table. Evaluated on a real-world dataset of 605 PK tables,
including captions and footnotes, AutoPK shows significant improvements in
precision and recall over direct LLM baselines. For instance, AutoPK with LLaMA
3.1-70B achieved an F1-score of 0.92 on half-life and 0.91 on clearance
parameters, outperforming direct use of LLaMA 3.1-70B by margins of 0.10 and
0.21, respectively. Smaller models such as Gemma 3-27B and Phi 3-12B with
AutoPK achieved 2-7 fold F1 gains over their direct use, with Gemma's
hallucination rates reduced from 60-95% down to 8-14%. Notably, AutoPK enabled
open-source models like Gemma 3-27B to outperform commercial systems such as
GPT-4o Mini on several PK parameters. AutoPK enables scalable and
high-confidence PK data extraction, making it well-suited for critical
applications in veterinary pharmacology, drug safety monitoring, and public
health decision-making, while addressing heterogeneous table structures and
terminology and demonstrating generalizability across key PK parameters. Code
and data: https://github.com/hosseinsholehrasa/AutoPK",https://github.com/hosseinsholehrasa/AutoPK,Accepted at the 2025 IEEE 37th ICTAI
Play by the Type Rules: Inferring Constraints for LLM Functions in Declarative Programs,"Parker Glenn, Alfy Samuel, Daben Liu",2025-09-24,2509.20208v1,http://arxiv.org/abs/2509.20208v1,http://arxiv.org/pdf/2509.20208v1,databases,cs.CL,"Integrating LLM powered operators in declarative query languages allows for
the combination of cheap and interpretable functions with powerful,
generalizable language model reasoning. However, in order to benefit from the
optimized execution of a database query language like SQL, generated outputs
must align with the rules enforced by both type checkers and database contents.
Current approaches address this challenge with orchestrations consisting of
many LLM-based post-processing calls to ensure alignment between generated
outputs and database values, introducing performance bottlenecks. We perform a
study on the ability of various sized open-source language models to both parse
and execute functions within a query language based on SQL, showing that small
language models can excel as function executors over hybrid data sources. Then,
we propose an efficient solution to enforce the well-typedness of LLM
functions, demonstrating 7% accuracy improvement on a multi-hop question
answering dataset with 53% improvement in latency over comparable solutions. We
make our implementation available at https://github.com/parkervg/blendsql",https://github.com/parkervg/blendsql,
