title,authors,published,arxiv_id,url,pdf_url,category,primary_category,abstract,code_links,comment
From Citation Selection to Citation Absorption: A Measurement Framework for Generative Engine Optimization Across AI Search Platforms,"Zhang Kai, He Xinyue, Yao Jingang",2026-04-28,2604.25707v2,http://arxiv.org/abs/2604.25707v2,https://arxiv.org/pdf/2604.25707v2,information_retrieval,cs.IR,"Generative search engines increasingly determine whether online information is merely discoverable, cited as a source, or actually absorbed into generated answers. This paper proposes a two-stage measurement framework for Generative Engine Optimization (GEO): citation selection, where a platform triggers search and chooses sources, and citation absorption, where a cited page contributes language, evidence, structure, or factual support to the final answer. We analyze the public geo-citation-lab dataset covering 602 controlled prompts across ChatGPT, Google AI Overview/Gemini, and Perplexity; 21,143 valid search-layer citations; 23,745 citation-level feature records; 18,151 successfully fetched pages; and 72 extracted features. The central descriptive finding is that citation breadth and citation depth diverge. Perplexity and Google cite more sources on average, while ChatGPT cites fewer sources but shows substantially higher average citation influence among fetched pages. High-influence pages tend to be longer, more structured, semantically aligned, and richer in extractable evidence such as definitions, numerical facts, comparisons, and procedural steps. The results suggest that GEO should be measured beyond citation counts, with answer-level absorption treated as a separate outcome.",https://github.com/yaojingang/geo-citation-lab,"27 pages, 11 figures. ACM-style layout. Updated author list and author homepage metadata. Public dataset and analysis pipeline: https://github.com/yaojingang/geo-citation-lab"
Health System Scale Semantic Search Across Unstructured Clinical Notes,"Faith Wavinya Mutinda, Spandana Makeneni, Anna Lin, Shivaji Dutta, Irit R. Rasooly, Patrick Dibussolo, Shivani Kamath Belman, Hessam Shahriari, Kevin Murphy, Alex B. Ruan, Barbara H. Chaiyachati, Sanjay Chainani, Robert W. Grundmeier, Scott M. Haag, Jeffrey M. Miller, Heather M. Griffis, Ian M. Campbell",2026-04-28,2604.25605v1,http://arxiv.org/abs/2604.25605v1,https://arxiv.org/pdf/2604.25605v1,information_retrieval,cs.IR,"Introduction: Semantic search, which retrieves documents based on conceptual similarity rather than keyword matching, offers substantial advantages for retrieval of clinical information. However, deploying semantic search across entire health systems, comprising hundreds of millions of clinical notes, presents formidable engineering, cost, and governance challenges that have prevented adoption. Methods: We deployed a semantic search system at a large children's hospital indexing 166 million clinical notes (484 million vectors) from 1.68 million patients. The system uses instruction-tuned qwen3-embedding-0.6B embeddings, stores vectors in a managed database with storage-optimized indexing, maintains full-text metadata in a low-latency key-value store, and operates within a HIPAA-compliant governance framework. We evaluated the system through three experiments: optimization of embedding model and chunking strategy using a physician-authored benchmark dataset, characterization of full-scale performance (cost, latency, retrieval quality), and clinical utility assessment via comparison of chart abstraction efficiency across three tasks. Results: The system delivers sub-second query latency (median 237 ms single-user, 451 ms 20-user concurrency) with monthly costs of approximately USD 4,000. Qwen3 embeddings with 300-token chunk size achieved 94.6% accuracy on a clinical question-answering benchmark. In clinical utility evaluation across three abstraction tasks, semantic search reduced time-to-completion by 24 to 89% compared to clinician-performed chart review while maintaining comparable inter-rater agreement. Conclusion: Health-system-scale semantic search is both technically and operationally feasible. The system provides infrastructure supporting interactive search, cohort generation, and downstream LLM-powered clinical applications without requiring specialized informatics expertise.",https://github.com/Ian-Campbell-Lab/clinical-semantic-search,"for associated code, see https://github.com/Ian-Campbell-Lab/clinical-semantic-search"
EGREFINE: An Execution-Grounded Optimization Framework for Text-to-SQL Schema Refinement,"Jiaqian Wang, Yutao Qi, Wenjin Hou, Yu Pang, Rui Yang",2026-05-01,2605.00628v1,http://arxiv.org/abs/2605.00628v1,https://arxiv.org/pdf/2605.00628v1,databases,cs.DB,"Text-to-SQL enables non-expert users to query databases in natural language, yet real-world schemas often suffer from ambiguous, abbreviated, or inconsistent naming conventions that degrade model accuracy. Existing approaches treat schemas as fixed and address errors downstream. In this paper, we frame schema refinement as a constrained optimization problem: find a renaming function that maximizes downstream Text-to-SQL execution accuracy while preserving query equivalence through database views. We analyze the computational hardness of this problem, which motivates a column-wise greedy decomposition, and instantiate it as EGRefine: a four-phase pipeline that screens ambiguous columns, generates context-aware candidate names, verifies them through execution-grounded feedback, and materializes the result as non-destructive SQL views. The pipeline carries two structural properties: column-local non-degradation, ensured by the conservative selection rule in the verification phase, and database-level query equivalence, ensured by the view-based materialization phase. Together they make the resulting refinement safe by construction at the column level, with cross-column and prompt-level interactions handled empirically rather than analytically. Across controlled schema-degradation, real-world, and enterprise benchmarks, EGRefine recovers accuracy lost to schema naming noise where applicable and correctly abstains where the underlying task exceeds current Text-to-SQL capabilities, with refined schemas transferring across model families to enable refine-once, serve-many-models deployment. Code and data are publicly available at https://github.com/ai-jiaqian/EGRefine.",https://github.com/ai-jiaqian/EGRefine,"15 pages, 5 figures, 50 references.Code: https://github.com/ai-jiaqian/EGRefine"
Reliable Answers for Recurring Questions: Boosting Text-to-SQL Accuracy with Template Constrained Decoding,"Smit Jivani, Sarvam Maheshwari, Sunita Sarawagi",2026-04-30,2604.28028v1,http://arxiv.org/abs/2604.28028v1,https://arxiv.org/pdf/2604.28028v1,databases,cs.CL,"Large language models (LLMs) have revolutionized Text-to-SQL generation, allowing users to query structured data using natural language with growing ease. Yet, real-world deployment remains challenging, especially in complex or unseen schemas, due to inconsistent accuracy and the risk of generating invalid SQL. We introduce Template Constrained Decoding (TeCoD), a system that addresses these limitations by harnessing the recurrence of query patterns in labeled workloads. TeCoD converts historical NL-SQL pairs into reusable templates and introduces a robust template selection module that uses a fine-tuned natural language inference model to match or reject queries efficiently. Once the template is selected, TeCoD enforces it during SQL generation through grammar-constrained decoding, implemented via a novel partitioned strategy that ensures both syntactic validity and efficiency. Together, these components yield up to 36% higher execution accuracy than in-context learning (ICL) and 2.2x lower latency on matched queries.",https://github.com/SSLab-CSE-IITB/tecod,Project Code: https://github.com/SSLab-CSE-IITB/tecod
FineState-Bench: Benchmarking State-Conditioned Grounding for Fine-grained GUI State Setting,"Fengxian Ji, Jingpu Yang, Zirui Song, Yuanxi Wang, Zhexuan Cui, Yuke Li, Qian Jiang, Xiuying Chen",2026-04-30,2604.27974v1,http://arxiv.org/abs/2604.27974v1,https://arxiv.org/pdf/2604.27974v1,databases,cs.CV,"Despite the rapid progress of large vision-language models (LVLMs), fine-grained, state-conditioned GUI interaction remains challenging. Current evaluations offer limited coverage, imprecise target-state definitions, and an overreliance on final-task success, obscuring where and why agents fail. To address this gap, we introduce \textbf{FineState-Bench}, a benchmark that evaluates whether an agent can correctly ground an instruction to the intended UI control and reach the exact target state. FineState-Bench comprises 2,209 instances across desktop, web, and mobile platforms, spanning four interaction families and 23 UI component types, with each instance explicitly specifying an exact target state for fine-grained state setting. We further propose \textit{FineState-Metrics}, a four-stage diagnostic pipeline with stage-wise success rates: Localization Success Rate (SR@Loc), Interaction Success Rate (SR@Int), Exact State Success Rate at Locate (ES-SR@Loc), and Exact State Success Rate at Interact (ES-SR@Int), and a plug-and-play \textit{Visual Diagnostic Assistant} (VDA) that generates a Description and a bounding-box Localization Hint to diagnose visual grounding reason via controlled w/ vs.\ w/o comparisons. On FineState-Bench, exact goal-state success remains low: ES-SR@Int peaks at 32.8\% on Web and 22.8\% on average across platforms. With VDA localization hints, Gemini-2.5-Flash gains +14.9 ES-SR@Int points, suggesting substantial headroom from improved visual grounding, yet overall accuracy is still insufficient for reliable fine-grained state-conditioned interaction \href{https://github.com/FengxianJi/FineState-Bench}{Github.}",https://github.com/FengxianJi/FineState-Bench,
Graphify: Automated Synthesis of Type-Safe Graph Backends via $O(S)$ GraphQL-to-Gremlin Transpilation,Johannes Graf,2026-04-29,2604.27223v1,http://arxiv.org/abs/2604.27223v1,https://arxiv.org/pdf/2604.27223v1,databases,cs.DB,"Graph databases offer unparalleled flexibility for managing interconnected data, yet the lack of strict schema enforcement often leads to runtime uncertainties and complex query development. This paper introduces Graphify, an end-to-end framework that enables developers to visually model graph data schemas and automatically synthesize a fully functional, type-safe backend. This paper proposes a formal mapping of GraphQL artifacts to the Gremlin traversal machine, supporting complete CRUD operations and arbitrarily nested queries. The system generates a transpiler capable of converting complex GraphQL requests into a single, optimized Gremlin query, including advanced features such as nested logical predicates, multi-key sorting, and pagination. At the core of the framework is a recursive state machine algorithm that processes GraphQL Abstract Syntax Trees (ASTs) with linear time complexity $O(S)$ relative to the number of selected fields. This paper demonstrates the practical efficiency and theoretical robustness of the approach through formal complexity analysis and empirical evaluation using the MovieLens 100k dataset. The result is a system that enables the generation of graph interfaces in minutes, bridging the gap between flexible graph storage and type-safe API consumption.",https://github.com/Graf-J/Graphify,"18 pages, 5 figures. Introduces a formal mapping between GraphQL and Gremlin with $O(S)$ time complexity. Includes empirical evaluation on MovieLens 100k. Open-source implementation available at https://github.com/Graf-J/Graphify"
Health System Scale Semantic Search Across Unstructured Clinical Notes,"Faith Wavinya Mutinda, Spandana Makeneni, Anna Lin, Shivaji Dutta, Irit R. Rasooly, Patrick Dibussolo, Shivani Kamath Belman, Hessam Shahriari, Kevin Murphy, Alex B. Ruan, Barbara H. Chaiyachati, Sanjay Chainani, Robert W. Grundmeier, Scott M. Haag, Jeffrey M. Miller, Heather M. Griffis, Ian M. Campbell",2026-04-28,2604.25605v1,http://arxiv.org/abs/2604.25605v1,https://arxiv.org/pdf/2604.25605v1,databases,cs.IR,"Introduction: Semantic search, which retrieves documents based on conceptual similarity rather than keyword matching, offers substantial advantages for retrieval of clinical information. However, deploying semantic search across entire health systems, comprising hundreds of millions of clinical notes, presents formidable engineering, cost, and governance challenges that have prevented adoption. Methods: We deployed a semantic search system at a large children's hospital indexing 166 million clinical notes (484 million vectors) from 1.68 million patients. The system uses instruction-tuned qwen3-embedding-0.6B embeddings, stores vectors in a managed database with storage-optimized indexing, maintains full-text metadata in a low-latency key-value store, and operates within a HIPAA-compliant governance framework. We evaluated the system through three experiments: optimization of embedding model and chunking strategy using a physician-authored benchmark dataset, characterization of full-scale performance (cost, latency, retrieval quality), and clinical utility assessment via comparison of chart abstraction efficiency across three tasks. Results: The system delivers sub-second query latency (median 237 ms single-user, 451 ms 20-user concurrency) with monthly costs of approximately USD 4,000. Qwen3 embeddings with 300-token chunk size achieved 94.6% accuracy on a clinical question-answering benchmark. In clinical utility evaluation across three abstraction tasks, semantic search reduced time-to-completion by 24 to 89% compared to clinician-performed chart review while maintaining comparable inter-rater agreement. Conclusion: Health-system-scale semantic search is both technically and operationally feasible. The system provides infrastructure supporting interactive search, cohort generation, and downstream LLM-powered clinical applications without requiring specialized informatics expertise.",https://github.com/Ian-Campbell-Lab/clinical-semantic-search,"for associated code, see https://github.com/Ian-Campbell-Lab/clinical-semantic-search"
A Demonstration of SQLyzr: A Platform for Fine-Grained Text-to-SQL Evaluation and Analysis,"Sepideh Abedini, M. Tamer Özsu",2026-04-23,2604.21214v3,http://arxiv.org/abs/2604.21214v3,https://arxiv.org/pdf/2604.21214v3,databases,cs.DB,"Text-to-SQL models have significantly improved with the adoption of Large Language Models (LLMs), leading to their increasing use in real-world applications. Although many benchmarks exist for evaluating the performance of text-to-SQL models, they often rely on a single aggregate score, lack evaluation under realistic settings, and provide limited insight into model behaviour across different query types. In this work, we present SQLyzr, a comprehensive benchmark and evaluation platform for text-to-SQL models. SQLyzr incorporates a diverse set of evaluation metrics that capture multiple aspects of generated queries, while enabling more realistic evaluation through workload alignment with real-world SQL usage patterns and database scaling. It further supports fine-grained query classification, error analysis, and workload augmentation, allowing users to better diagnose and improve text-to-SQL models. This demonstration showcases these capabilities through an interactive experience. Through SQLyzr's graphical interface, users can customize evaluation settings, analyze fine-grained reports, and explore additional features of the platform. We envision that SQLyzr facilitates the evaluation and iterative improvement of text-to-SQL models by addressing key limitations of existing benchmarks. The source code of SQLyzr is available at https://github.com/sepideh-abedini/SQLyzr.",https://github.com/sepideh-abedini/SQLyzr,
3DPipe: A Pipelined GPU Framework for Scalable Generalized Spatial Join over Polyhedral Objects,"Lyuheng Yuan, Da Yan, Akhlaque Ahmad, Fusheng Wang",2026-04-21,2604.19982v1,http://arxiv.org/abs/2604.19982v1,https://arxiv.org/pdf/2604.19982v1,databases,cs.DB,"Spatial join is a fundamental operation in spatial databases. With the rapid growth of 3D data in applications such as LiDAR-based object detection and 3D digital pathology, there is an increasing need to support spatial join over 3D datasets. However, existing techniques are largely designed for 2D data, leaving 3D spatial join underexplored and computationally expensive. We present 3DPipe, a pipelined GPU framework for scalable spatial join over polyhedral objects. 3DPipe exploits GPU parallelism across both filtering and refinement stages, incorporates a multi-level pruning strategy for efficient candidate reduction, and employs chunked streaming to handle datasets exceeding GPU memory. Its pipelined execution overlaps CPU data preparation, host-device data transfer, and GPU computation to improve throughput. Experiments show that 3DPipe achieves up to 9.0$\times$ speedup over the state-of-the-art GPU solution, TDBase, while maintaining excellent scalability. 3DPipe is open-sourced at https://github.com/lyuheng/3dpipe.",https://github.com/lyuheng/3dpipe,
NeuroLip: An Event-driven Spatiotemporal Learning Framework for Cross-Scene Lip-Motion-based Visual Speaker Recognition,"Junguang Yao, Wenye Liu, Stjepan Picek, Yue Zheng",2026-04-17,2604.15718v1,http://arxiv.org/abs/2604.15718v1,https://arxiv.org/pdf/2604.15718v1,databases,cs.CV,"Visual speaker recognition based on lip motion offers a silent, hands-free, and behavior-driven biometric solution that remains effective even when acoustic cues are unavailable. Compared to traditional methods that rely heavily on appearance-dependent representations, lip motion encodes subject-specific behavioral dynamics driven by consistent articulation patterns and muscle coordination, offering inherent stability across environmental changes. However, capturing these robust, fine-grained dynamics is challenging for conventional frame-based cameras due to motion blur and low dynamic range. To exploit the intrinsic stability of lip motion and address these sensing limitations, we propose NeuroLip, an event-based framework that captures fine-grained lip dynamics under a strict yet practical cross-scene protocol: training is performed under a single controlled condition, while recognition must generalize to unseen viewing and lighting conditions. NeuroLip features a 1) Temporal-aware Voxel Encoding module with adaptive event weighting, 2) Structure-aware Spatial Enhancer that amplifies discriminative behavioral patterns by suppressing noise while preserving vertically structured motion information, and 3) Polarity Consistency Regularization mechanism to retain motion-direction cues encoded in event polarities. To facilitate systematic evaluation, we introduce DVSpeaker, a comprehensive event-based lip-motion dataset comprising 50 subjects recorded under four distinct viewpoint and illumination scenarios. Extensive experiments demonstrate that NeuroLip achieves near-perfect matched-scene accuracy and robust cross-scene generalization, attaining over 71% accuracy on unseen viewpoints and nearly 76% under low-light conditions, outperforming representative existing methods by at least 8.54%. The dataset and code are publicly available at https://github.com/JiuZeongit/NeuroLip.",https://github.com/JiuZeongit/NeuroLip,
EvoRAG: Making Knowledge Graph-based RAG Automatically Evolve through Feedback-driven Backpropagation,"Zhenbo Fu, Yuanzhe Zhang, Qiange Wang, Hao Yuan, Yuehao Xu, Enze Yi, Yanfeng Zhang, Ge Yu",2026-04-17,2604.15676v1,http://arxiv.org/abs/2604.15676v1,https://arxiv.org/pdf/2604.15676v1,databases,cs.DB,"Knowledge Graph-based Retrieval-Augmented Generation (KG-RAG) has emerged as a promising paradigm for enhancing LLM reasoning by retrieving multi-hop paths from KGs. However, existing KG-RAG frameworks often underperform in real-world scenarios because the pre-captured knowledge dependencies are not tailored to the downstream task or its evolving requirements. These frameworks struggle to adapt to task-specific requirements and lack mechanisms to filter low-contribution knowledge during generation. We observe that feedback on generated responses offers effective supervision for improving KG quality, as it directly reflects user expectations and provides insights into the correctness and usefulness of the output. However, a key challenge lies in effectively linking response-level feedback to triplet-level contribution evaluation and knowledge updates in the KG.
  In this work, we propose EvoRAG, a self-evolving KG-RAG framework that leverages the feedback over generated responses to continuously refine the KG and enhance reasoning accuracy. EvoRAG introduces a feedback-driven backpropagation mechanism that attributes feedback to retrieved paths by measuring their utility for response and propagates this utility back to individual triplets, supporting fine-grained KG refinements towards more adaptive and accurate reasoning. Through EvoRAG, we establish a closed loop that couples feedback, LLM, and graph data, continuously enhancing the performance and robustness in real-world scenarios. Experimental results show that EvoRAG improves reasoning accuracy by $7.34\%$ over state-of-the-art KG-RAG frameworks. The source code has been made available at https://github.com/iDC-NEU/EvoRAG.",https://github.com/iDC-NEU/EvoRAG,
"Data Engineering Patterns for Cross-System Reconciliation in Regulated Enterprises: Architecture, Anomaly Detection, and Governance",Zhijun Qiu,2026-04-16,2604.15108v1,http://arxiv.org/abs/2604.15108v1,https://arxiv.org/pdf/2604.15108v1,databases,cs.DB,"Regulated enterprises in the United States -- banks, telecommunications providers, large technology companies -- operate across heterogeneous systems that were rarely designed to interoperate. ERP platforms, billing engines, supply chain tools, and financial reporting infrastructure coexist within the same organization, but they do not talk to each other well. The resulting fragmentation produces familiar problems: transactions recorded in one system but unreconciled in another, asset inventories drifting from their systems of record, and audit-readiness that depends on manual effort. The PCAOB's 2024 inspection cycle put a number on the consequences: a 39% aggregate Part I.A deficiency rate across all inspected firms. This paper introduces the GERA Framework (Governed Enterprise Reconciliation Architecture) -- a vendor-neutral, four-layer data architecture that integrates deterministic cross-system reconciliation, statistical anomaly detection (baseline Z-Score with robust alternatives), governed semantic standardization, and NIST CSF 2.0-aligned security controls into a single methodology. The architecture spans four layers (ingestion, staging, core models, and semantic serving), following the multi-layer pattern now common in modern data platforms. The patterns are demonstrated through U.S. broadband operations -- where billing reconciliation, inventory aging, and governance are tightly coupled -- and draw on the author's implementation experience across three regulated enterprise environments: a regional bank, a national broadband provider, and a Fortune 500 technology company's central finance organization. This is a practitioner reference -- an architectural framework paper documenting field-tested patterns -- not a controlled experiment or benchmark study. No proprietary systems, datasets, or internal implementations are disclosed.",https://github.com/andersonqiu/GERA-Framework,"13 pages, 3 figures, 1 table. Practitioner reference paper. Code and supplementary materials: https://github.com/andersonqiu/GERA-Framework"
SQL Query Engine: A Self-Healing LLM Pipeline for Natural Language to PostgreSQL Translation,Muhammad Adeel Ijaz,2026-04-15,2604.16511v1,http://arxiv.org/abs/2604.16511v1,https://arxiv.org/pdf/2604.16511v1,databases,cs.DB,"We present SQL Query Engine, an open-source, self-hosted service that translates natural language questions into validated PostgreSQL queries through a two-stage LLM pipeline. The first stage performs automatic schema introspection and SQL generation; a multi-strategy response parser extracts SQL from any LLM output format (JSON, code blocks, or raw text) without requiring structured output APIs. The second stage executes the query against PostgreSQL and, upon failure or empty results, enters an iterative self-healing loop in which the LLM diagnoses the error using full SQLSTATE codes and PostgreSQL diagnostic messages. Two mechanisms prevent regressions: early-accept returns successful queries immediately without LLM re-evaluation, and best-result tracking preserves the best partial result across retries. Schema context is cached per session in Redis, progress events stream via Redis Pub/Sub and SSE, and an OpenAI-compatible /v1/chat/completions endpoint lets existing tools work without modification. All database connections are read-only at the driver level. We evaluate across five LLM backends on a synthetic benchmark (75 questions, three databases) where the self-healing loop yields up to +9.3pp accuracy gains with zero regressions on the best model (Llama 4 Scout 17B, 57.3%), and on BIRD (437 questions, 11 databases migrated from SQLite to PostgreSQL) where the full pipeline reaches 49.0% execution accuracy (GPT-OSS-120B, +4.6pp). Source code: https://github.com/codeadeel/sqlqueryengine.",https://github.com/codeadeel/sqlqueryengine,"16 pages, 5 tables, 4 figures"
