title,authors,published,arxiv_id,url,pdf_url,category,primary_category,abstract,code_links,comment
LILaC: Late Interacting in Layered Component Graph for Open-domain Multimodal Multihop Retrieval,"Joohyung Yun, Doyup Lee, Wook-Shin Han",2026-02-04,2602.04263v1,http://arxiv.org/abs/2602.04263v1,https://arxiv.org/pdf/2602.04263v1,information_retrieval,cs.IR,"Multimodal document retrieval aims to retrieve query-relevant components from documents composed of textual, tabular, and visual elements. An effective multimodal retriever needs to handle two main challenges: (1) mitigate the effect of irrelevant contents caused by fixed, single-granular retrieval units, and (2) support multihop reasoning by effectively capturing semantic relationships among components within and across documents. To address these challenges, we propose LILaC, a multimodal retrieval framework featuring two core innovations. First, we introduce a layered component graph, explicitly representing multimodal information at two layers - each representing coarse and fine granularity - facilitating efficient yet precise reasoning. Second, we develop a late-interaction-based subgraph retrieval method, an edge-based approach that initially identifies coarse-grained nodes for efficient candidate generation, then performs fine-grained reasoning via late interaction. Extensive experiments demonstrate that LILaC achieves state-of-the-art retrieval performance on all five benchmarks, notably without additional fine-tuning. We make the artifacts publicly available at github.com/joohyung00/lilac.",https://github.com/joohyung00/lilac,Project page: https://lilac-emnlp2025.github.io/
SemPipes -- Optimizable Semantic Data Operators for Tabular Machine Learning Pipelines,"Olga Ovcharenko, Matthias Boehm, Sebastian Schelter",2026-02-04,2602.05134v1,http://arxiv.org/abs/2602.05134v1,https://arxiv.org/pdf/2602.05134v1,databases,cs.LG,"Real-world machine learning on tabular data relies on complex data preparation pipelines for prediction, data integration, augmentation, and debugging. Designing these pipelines requires substantial domain expertise and engineering effort, motivating the question of how large language models (LLMs) can support tabular ML through code synthesis. We introduce SemPipes, a novel declarative programming model that integrates LLM-powered semantic data operators into tabular ML pipelines. Semantic operators specify data transformations in natural language while delegating execution to a runtime system. During training, SemPipes synthesizes custom operator implementations based on data characteristics, operator instructions, and pipeline context. This design enables the automatic optimization of data operations in a pipeline via LLM-based code synthesis guided by evolutionary search. We evaluate SemPipes across diverse tabular ML tasks and show that semantic operators substantially improve end-to-end predictive performance for both expert-designed and agent-generated pipelines, while reducing pipeline complexity. We implement SemPipes in Python and release it at https://github.com/deem-data/sempipes/tree/v1.",https://github.com/deem-data/sempipes,
PluRel: Synthetic Data unlocks Scaling Laws for Relational Foundation Models,"Vignesh Kothapalli, Rishabh Ranjan, Valter Hudovernik, Vijay Prakash Dwivedi, Johannes Hoffart, Carlos Guestrin, Jure Leskovec",2026-02-03,2602.04029v1,http://arxiv.org/abs/2602.04029v1,https://arxiv.org/pdf/2602.04029v1,databases,cs.DB,"Relational Foundation Models (RFMs) facilitate data-driven decision-making by learning from complex multi-table databases. However, the diverse relational databases needed to train such models are rarely public due to privacy constraints. While there are methods to generate synthetic tabular data of arbitrary size, incorporating schema structure and primary--foreign key connectivity for multi-table generation remains challenging. Here we introduce PluRel, a framework to synthesize multi-tabular relational databases from scratch. In a step-by-step fashion, PluRel models (1) schemas with directed graphs, (2) inter-table primary-foreign key connectivity with bipartite graphs, and, (3) feature distributions in tables via conditional causal mechanisms. The design space across these stages supports the synthesis of a wide range of diverse databases, while being computationally lightweight. Using PluRel, we observe for the first time that (1) RFM pretraining loss exhibits power-law scaling with the number of synthetic databases and total pretraining tokens, (2) scaling the number of synthetic databases improves generalization to real databases, and (3) synthetic pretraining yields strong base models for continued pretraining on real databases. Overall, our framework and results position synthetic data scaling as a promising paradigm for RFMs.",https://github.com/snap-stanford/plurel,Code: https://github.com/snap-stanford/plurel
"MedBeads: An Agent-Native, Immutable Data Substrate for Trustworthy Medical AI",Takahito Nakajima,2026-02-01,2602.01086v1,http://arxiv.org/abs/2602.01086v1,https://arxiv.org/pdf/2602.01086v1,databases,cs.AI,"Background: As of 2026, Large Language Models (LLMs) demonstrate expert-level medical knowledge. However, deploying them as autonomous ""Clinical Agents"" remains limited. Current Electronic Medical Records (EMRs) and standards like FHIR are designed for human review, creating a ""Context Mismatch"": AI agents receive fragmented data and must rely on probabilistic inference (e.g., RAG) to reconstruct patient history. This approach causes hallucinations and hinders auditability. Methods: We propose MedBeads, an agent-native data infrastructure where clinical events are immutable ""Beads""--nodes in a Merkle Directed Acyclic Graph (DAG)--cryptographically referencing causal predecessors. This ""write-once, read-many"" architecture makes tampering mathematically detectable. We implemented a prototype with a Go Core Engine, Python middleware for LLM integration, and a React-based visualization interface. Results: We successfully implemented the workflow using synthetic data. The FHIR-to-DAG conversion transformed flat resources into a causally-linked graph. Our Breadth-First Search (BFS) Context Retrieval algorithm traverses relevant subgraphs with O(V+E) complexity, enabling real-time decision support. Tamper-evidence is guaranteed by design: any modification breaks the cryptographic chain. The visualization aids clinician understanding through explicit causal links. Conclusion: MedBeads addresses the ""Context Mismatch"" by shifting from probabilistic search to deterministic graph traversal, and from mutable records to immutable chains, providing the substrate for ""Trustworthy Medical AI."" It guarantees the context the AI receives is deterministic and tamper-evident, while the LLM determines interpretation. The structured Bead format serves as a token-efficient ""AI-native language."" We release MedBeads as open-source software to accelerate agent-native data standards.",https://github.com/medbeads/medbeads,"19 pages, 5 figures. Code available at https://github.com/medbeads/medbeads"
Can LLMs Clean Up Your Mess? A Survey of Application-Ready Data Preparation with LLMs,"Wei Zhou, Jun Zhou, Haoyu Wang, Zhenghao Li, Qikang He, Shaokun Han, Guoliang Li, Xuanhe Zhou, Yeye He, Chunwei Liu, Zirui Tang, Bin Wang, Shen Tang, Kai Zuo, Yuyu Luo, Zhenzhe Zheng, Conghui He, Jingren Zhou, Fan Wu",2026-01-22,2601.17058v1,http://arxiv.org/abs/2601.17058v1,https://arxiv.org/pdf/2601.17058v1,databases,cs.DB,"Data preparation aims to denoise raw datasets, uncover cross-dataset relationships, and extract valuable insights from them, which is essential for a wide range of data-centric applications. Driven by (i) rising demands for application-ready data (e.g., for analytics, visualization, decision-making), (ii) increasingly powerful LLM techniques, and (iii) the emergence of infrastructures that facilitate flexible agent construction (e.g., using Databricks Unity Catalog), LLM-enhanced methods are rapidly becoming a transformative and potentially dominant paradigm for data preparation.
  By investigating hundreds of recent literature works, this paper presents a systematic review of this evolving landscape, focusing on the use of LLM techniques to prepare data for diverse downstream tasks. First, we characterize the fundamental paradigm shift, from rule-based, model-specific pipelines to prompt-driven, context-aware, and agentic preparation workflows. Next, we introduce a task-centric taxonomy that organizes the field into three major tasks: data cleaning (e.g., standardization, error processing, imputation), data integration (e.g., entity matching, schema matching), and data enrichment (e.g., data annotation, profiling). For each task, we survey representative techniques, and highlight their respective strengths (e.g., improved generalization, semantic understanding) and limitations (e.g., the prohibitive cost of scaling LLMs, persistent hallucinations even in advanced agents, the mismatch between advanced methods and weak evaluation). Moreover, we analyze commonly used datasets and evaluation metrics (the empirical part). Finally, we discuss open research challenges and outline a forward-looking roadmap that emphasizes scalable LLM-data systems, principled designs for reliable agentic workflows, and robust evaluation protocols.",https://github.com/weAIDB/awesome-data-llm,Please refer to our repository for more details: https://github.com/weAIDB/awesome-data-llm
